Name,STARmeter,Known for
Joshua Jackson Ben  Ben  See fewer,Top 5000,The Affair (2014)
Rachael Taylor Jane  Jane  See fewer,Top 5000,Transformers (2007)
Megumi Okina Megumi  Megumi  See fewer,Members only,Ju-on: The Grudge (2002)
David Denman Bruno  Bruno  See fewer,Top 5000,Brightburn (2019)
John Hensley Adam  Adam  See fewer,Members only,Nip/Tuck (2003)
Maya Hazen Seiko  Seiko  See fewer,Members only,Shrooms (2007)
James Kyson Ritsuo (as James Kyson Lee)  Ritsuo (as James Kyson Lee)  See fewer,Members only,Preacher (2016)
Yoshiko Miyazaki Akiko  Akiko  See fewer,Members only,Ran (1985)
Kei Yamamoto Murase  Murase  See fewer,Members only,Live Your Own Way (1967)
Daisy Betts Natasha  Natasha  See fewer,Members only,The Player (2015)
Adrienne Pickering Megan  Megan  See fewer,Members only,Knowing (2009)
Pascal Morineau Wedding Photographer  Wedding Photographer  See fewer,Members only,Shutter (I) (2008)
Masaki Ota Police Officer  Police Officer  See fewer,Members only,Nankyoku tairiku: Kami no ryouiki ni idonda otoko to inu no monogatari (2011)
Heideru Tatsuo Police Officer  Police Officer  See fewer,Members only,Confessions (2010)
Eri Otoguro Yoko  Yoko  See fewer,Members only,Kamen Rider W Forever: A to Z/The Gaia Memories of Fate (2010)
Rina Matsuki TGK Receptionist  TGK Receptionist  See fewer,Members only,Konjaku monogatari: The new edition (2007)
Tomotaka Kanzaki Client  Client  See fewer,Members only,Memoirs of a Teenage Amnesiac (2010)
Jun Yakushiji Client  Client  See fewer,Members only,Kamen Rider Kiva (2008)
Emi Tamura Emi  Emi  See fewer,Members only,Shutter (I) (2008)
Polina Kononova Studio Model  Studio Model  See fewer,Members only,Shutter (I) (2008)
Yulia Ryzhova Studio Model  Studio Model  See fewer,Members only,Shutter (I) (2008)
Mika Kinose Office Lady  Office Lady  See fewer,Members only,Shutter (I) (2008)
Masakazu Nagakura Pachinko Parlor Employee  Pachinko Parlor Employee  See fewer,Members only,Shutter (I) (2008)
Shinji Furukawa Pachinko Parlor Customer  Pachinko Parlor Customer  See fewer,Members only,Keiji ichidai: Hiratsuka Hachibei no Shôwa jiken shi (2009)
Maria Takagi Waitress at Japanese Restaurant  Waitress at Japanese Restaurant  See fewer,Members only,Tokyo Zombie (2005)
Akihiko Ando Restaurant Manager  Restaurant Manager  See fewer,Members only,Shutter (I) (2008)
Alessandra Model  Model  See fewer,Members only,Más vale tarde (2007)
Katrina B. Model  Model  See fewer,Members only,Make It Hurt (2011)
Tanya Allen Model (as Tanya)  Model (as Tanya)  See fewer,Members only,Silent Hill (2006)
Takao Toji Tokyo Doctor  Tokyo Doctor  See fewer,Members only,Departures (2008)
Shizuka Fujimoto Tokyo Exam Room Nurse  Tokyo Exam Room Nurse  See fewer,Members only,Ganbatte ikimasshoi (2005)
Yutaka Mishima Ghost Magazine Layout Designer  Ghost Magazine Layout Designer  See fewer,Members only,Silence (I) (2016)
Maiko Asano Mother on Train  Mother on Train  See fewer,Members only,Dark Water (2002)
Rei Sato Boy on Train  Boy on Train  See fewer,Members only,School Girl's Gestation (2014)
Homare Hasegawa Passenger on Train  Passenger on Train  See fewer,Members only,Shiroi haru (2009)
Kei Hirosawa Passenger on Train  Passenger on Train  See fewer,Members only,Shutter (I) (2008)
Michiyo Kaneko Passenger on Train  Passenger on Train  See fewer,Members only,Taiyô ni hoero! (1972)
Koichi Kase Passenger on Train  Passenger on Train  See fewer,Members only,Dreams (1990)
Yasuke Kawarada Passenger on Train  Passenger on Train  See fewer,Members only,Shutter (I) (2008)
Ayuko Koyama Passenger on Train  Passenger on Train  See fewer,Members only,Shutter (I) (2008)
Konomi Moriyama Passenger on Train  Passenger on Train  See fewer,Members only,Kagi no kakatta heya (2012)
Akira Sato Passenger on Train  Passenger on Train  See fewer,Members only,The Grudge 2 (2006)
Miyoko Yamaguchi Passenger on Train  Passenger on Train  See fewer,Members only,Oh Lucy! (2017)
Runa Kozuki Girl in Park (as Runa Kozuka)  Girl in Park (as Runa Kozuka)  See fewer,Members only,Uchû kikaku 2004 Super DX (2004)
Natsuki TGK Female Staff  TGK Female Staff  See fewer,Members only,Beauty and the Paparazzo (2010)
Akihiro Shimomura Megumi's Father  Megumi's Father  See fewer,Members only,Takushî sanba (1981)
Gen Takatsuka Monk  Monk  See fewer,Members only,Shutter (I) (2008)
Natalia Tsvetkova Brooklyn Nurse  Brooklyn Nurse  See fewer,Members only,Shutter (I) (2008)
Asya Model in Adam's Photo Box  Model in Adam's Photo Box  See fewer,Members only,Shutter (I) (2008)
Graziela Model in Adam's Photo Box  Model in Adam's Photo Box  See fewer,Members only,Shutter (I) (2008)
Ami Fujimoto Model in Adam's Photo Box  Model in Adam's Photo Box  See fewer,Members only,Reiko's Hina Dolls (2012)
Miki Hirono Model in Adam's Photo Box  Model in Adam's Photo Box  See fewer,Members only,Shutter (I) (2008)
Ingrid Model in Adam's Photo Box  Model in Adam's Photo Box  See fewer,Members only,Shutter (I) (2008)
Ananda Model in Adam's Photo Box  Model in Adam's Photo Box  See fewer,Members only,Shutter (I) (2008)
Emiko Kondo Model in Adam's Photo Box  Model in Adam's Photo Box  See fewer,Members only,Masters of Horror (2005)
Liana Model in Adam's Photo Box  Model in Adam's Photo Box  See fewer,Members only,Shutter (I) (2008)
Tsukasa Minami Model in Adam's Photo Box  Model in Adam's Photo Box  See fewer,Members only,Shutter (I) (2008)
Asami Momose Model in Adam's Photo Box  Model in Adam's Photo Box  See fewer,Members only,Xenoblade Chronicles 2 (2017)
Nadia Model in Adam's Photo Box  Model in Adam's Photo Box  See fewer,Members only,Shutter (I) (2008)
Nadiya Model in Adam's Photo Box  Model in Adam's Photo Box  See fewer,Members only,Charan Dada (1989)
Natsue Orikawa Model in Adam's Photo Box  Model in Adam's Photo Box  See fewer,Members only,Shutter (I) (2008)
Zoya Model in Adam's Photo Box  Model in Adam's Photo Box  See fewer,Members only,Shutter (I) (2008)
Olga Alex Model in Headshot  Model in Headshot  See fewer,Members only,Nihonjin no shiranai nihongo (2010)
Julia G. Model in Headshot  Model in Headshot  See fewer,Members only,Sto (dia)dromo (2008)
Ira M. Model in Headshot  Model in Headshot  See fewer,Members only,Shutter (I) (2008)
Natalia Silkina Model in Headshot (as Natalia Si)  Model in Headshot (as Natalia Si)  See fewer,Members only,Brave Hearts: Umizaru (2012)
Reila Aphrodite Satsuki (uncredited)  Satsuki (uncredited)  See fewer,Members only,Drain Away: Is Pure Longing a Sin? (2021)
Masami Kosaka Japanese Man (uncredited)  Japanese Man (uncredited)  See fewer,Members only,The Twilight Saga: Breaking Dawn - Part 2 (2012)
Rana Morrison Wedding Guest (uncredited)  Wedding Guest (uncredited)  See fewer,Members only,Stealth (2005)
Bob Werley Wedding Guest (uncredited)  Wedding Guest (uncredited)  See fewer,Members only,Shin Godzilla (2016)
