Name,STARmeter,Known for
Ye-ryeon Cha In-jeong  In-jeong  See fewer,Members only,Sector 7 (2011)
Suk-kyu Han Moon-jae  Moon-jae  See fewer,Members only,Tree with Deep Roots (2011)
Kyeong-ho Jeong Hong-bae  Hong-bae  See fewer,Members only,Femme Fatal (2007)
Shi-hoo Kim Hyun-jae  Hyun-jae  See fewer,Members only,Lady Vengeance (2005)
Byung-joon Lee Young-sun  Young-sun  See fewer,Members only,I'm Not a Robot (2017)
Mun-shik Lee Bong-yeon  Bong-yeon  See fewer,Members only,Iljimae (2008)
Dal-su Oh O-guen  O-guen  See fewer,Members only,Oldboy (2003)
Hyung Tak Shim Won-ryong (as Hyeong-tak Shin)  Won-ryong (as Hyeong-tak Shin)  See fewer,Members only,Let's Eat (2013)
