Name,STARmeter,Known for
Ivan Barnev mladý Jan Díte  mladý Jan Díte  See fewer,Members only,Lady Zee (2005)
Oldrich Kaiser staý rJan Díte  staý rJan Díte  See fewer,Members only,A Prominent Patient (2016)
Julia Jentsch Líza  Líza  See fewer,Members only,Sophie Scholl: The Final Days (2005)
Marián Labuda Walden  Walden  See fewer,Members only,Kral Ubu (1996)
Milan Lasica Profesor  Profesor  See fewer,Members only,Hostage (2014)
Zuzana Fialová Marcela  Marcela  See fewer,Members only,Kriminálka Staré Mesto (2010)
Martin Huba Skrivánek  Skrivánek  See fewer,Members only,Svedek umírajícího casu (1983)
Josef Abrhám Hotelier Brandejs  Hotelier Brandejs  See fewer,Members only,Valerie and Her Week of Wonders (1970)
Jirí Lábus séf hotelu U Zlatého mesta Prahy  séf hotelu U Zlatého mesta Prahy  See fewer,Members only,Amerika (1994)
Rudolf Hrusínský Tichota  Tichota  See fewer,Members only,Buttoners (1997)
Pavel Nový Generál  Generál  See fewer,Members only,Ice Mother (2017)
Jaromír Dulava císník Karel  císník Karel  See fewer,Members only,Cerní baroni (1992)
Petra Hrebícková Jaruska  Jaruska  See fewer,Members only,Men in Hope (2011)
Eva Kalcovská Wanda  Wanda  See fewer,Members only,I Served the King of England (2006)
Sárka Petruzelová Julinka  Julinka  See fewer,Members only,I Served the King of England (2006)
Tonya Graves Císar  Císar  See fewer,Members only,The Omen (2006)
Jirí Sesták Císník  Císník  See fewer,Members only,Innocence (2011)
Jan Kusak Milionár  Milionár  See fewer,Members only,I Served the King of England (2006)
Petr Brukner Milionár  Milionár  See fewer,Members only,"Jára Cimrman Lying, Sleeping (1983)"
Jirí Zák Milionár  Milionár  See fewer,Members only,Child 44 (2015)
Tomas Sechser Milionár  Milionár  See fewer,Members only,I Served the King of England (2006)
Jaroslav Tomsa Milionár  Milionár  See fewer,Members only,Stalingrad (1993)
Pavel Vondruska Milionár  Milionár  See fewer,Members only,"Jára Cimrman Lying, Sleeping (1983)"
István Szabó A jako zvlástni host  A jako zvlástni host  See fewer,Members only,Sunshine (1999)
Thomas Zielinski Lékar v sanatoriu  Lékar v sanatoriu  See fewer,Members only,Habermann (2010)
Nikolay Penev Pilolik Ferda  Pilolik Ferda  See fewer,Members only,Beauty in Trouble (2006)
Petr Ctvrtnícek Burzián  Burzián  See fewer,Members only,Ceská soda (1998)
Ladislav Zupanic Burzián  Burzián  See fewer,Members only,The Mysterious Castle in the Carpathians (1981)
Petr Herrmann Burzián  Burzián  See fewer,Members only,Five Minutes to Seven (1965)
Václav Knop Burzián  Burzián  See fewer,Members only,Mág (1988)
Rudolf Jelínek Burzián  Burzián  See fewer,Members only,Tri spory (1981)
Oldrich Vlach Brukner  Brukner  See fewer,Members only,Mnága - Happy End (1996)
Václav Chalupa Hrdlicka  Hrdlicka  See fewer,Members only,xXx (2002)
Jirí Knot Weinfurter  Weinfurter  See fewer,Members only,Das siebte Foto (2003)
Vlastimil Brabec Wimmer  Wimmer  See fewer,Members only,Small Town (2003)
Viktor Taus Weigel  Weigel  See fewer,Members only,Clownwise (2013)
Nada Konvalinková Sestricka  Sestricka  See fewer,Members only,Adele's Dinner (1978)
Emília Vásáryová pani. Rajska  pani. Rajska  See fewer,Members only,Eva Nová (2015)
Zdenek Maryska Nemecký host  Nemecký host  See fewer,Members only,The Prince and Me (2004)
Zdenek Zák Milicionár  Milicionár  See fewer,Members only,The Good Neighborhood (2005)
Martin Zahálka Milicionár  Milicionár  See fewer,Members only,Ordinace v ruzové zahrade 2 (2008)
Marie Málková slecna v hotelu Tichole  slecna v hotelu Tichole  See fewer,Members only,Fotograf (2015)
Dominika Hrzanova slecna v hotelu Tichole (as Dominika Hrzanová)  slecna v hotelu Tichole (as Dominika Hrzanová)  See fewer,Members only,I Served the King of England (2006)
Svatava Milkova slecna v hotelu Tichole (as Svatava Milková)  slecna v hotelu Tichole (as Svatava Milková)  See fewer,Members only,Cesty domú (2010)
Lucie Stepánková slecna v hotelu Tichole  slecna v hotelu Tichole  See fewer,Members only,Sever (2019)
Anna Tuskova slecna v hotelu Tichole (as Anna Tusková)  slecna v hotelu Tichole (as Anna Tusková)  See fewer,Members only,I Served the King of England (2006)
Paulina Janebova slecna v hotelu Tichole (as Paulina Janebová)  slecna v hotelu Tichole (as Paulina Janebová)  See fewer,Members only,I Served the King of England (2006)
Zuzana Krystynova slecna v hotelu Tichole (as Zuzana Krystynová)  slecna v hotelu Tichole (as Zuzana Krystynová)  See fewer,Members only,I Served the King of England (2006)
Zdenka Valenova slecna v hotelu Tichole (as Zdenka Valenová)  slecna v hotelu Tichole (as Zdenka Valenová)  See fewer,Members only,I Served the King of England (2006)
Vladimír Kulhavý Nemecký lekar  Nemecký lekar  See fewer,Members only,Casino Royale (2006)
Stephan Nobbe Nemecký starosta  Nemecký starosta  See fewer,Members only,Visions of Europe (2004)
Kristýna Boková Aranzerky  Aranzerky  See fewer,Members only,Toman (2018)
Jana Vranova Aranzerky (as Jana Vránová)  Aranzerky (as Jana Vránová)  See fewer,Members only,I Served the King of England (2006)
Zdenek Babka  Actor  Actor  See fewer,Members only,I Served the King of England (2006)
Andrea Balaszová  Actress  Actress  See fewer,Members only,I Served the King of England (2006)
Petr Binder  Actor  Actor  See fewer,Members only,I Served the King of England (2006)
Simona Broziková  Actress  Actress  See fewer,Members only,I Served the King of England (2006)
Benge Carlos  Actor  Actor  See fewer,Members only,I Served the King of England (2006)
Zdenek Dolejsí  Actor  Actor  See fewer,Members only,Experti (2006)
Iva Erbanová  Actress  Actress  See fewer,Members only,I Served the King of England (2006)
Yanna Fabian  Actress (as Jana Fabiánová)  Actress (as Jana Fabiánová)  See fewer,Members only,The Road Within (2014)
Otokar Harlas  Actor (as Otakar Harlas)  Actor (as Otakar Harlas)  See fewer,Members only,Before the Fall (2004)
Jindrich Hippmann  Actor  Actor  See fewer,Members only,I Served the King of England (2006)
Jirí Jann  Actor  Actor  See fewer,Members only,I Served the King of England (2006)
Valerie Kelecsinyiová  Actress  Actress  See fewer,Members only,I Served the King of England (2006)
Petr Kohler  Actor  Actor  See fewer,Members only,I Served the King of England (2006)
Vendula Kozeluhová  Actress  Actress  See fewer,Members only,I Served the King of England (2006)
Antonin Krepinský  Actor  Actor  See fewer,Members only,I Served the King of England (2006)
Jan Krmicek  Actor  Actor  See fewer,Members only,I Served the King of England (2006)
Markéta Kudrejová  Actress  Actress  See fewer,Members only,Blood Countess (2008)
Veronika Leiferová  Actress  Actress  See fewer,Members only,I Served the King of England (2006)
Stanislav Macák  Actor  Actor  See fewer,Members only,I Served the King of England (2006)
Petr Mika  Actor  Actor  See fewer,Members only,Brat Packed (2005)
Barbora Mottlová Aryan  Aryan  See fewer,Members only,Gangster Ka (2015)
Marta Ondrácková  Actress  Actress  See fewer,Members only,In Rage (2016)
Eliska Pilarová  Actress  Actress  See fewer,Members only,I Served the King of England (2006)
Martin Skodák  Actor  Actor  See fewer,Members only,I Served the King of England (2006)
Martina Smutna  Actress  Actress  See fewer,Members only,The Zookeeper's Wife (2017)
Petra Sobková  Actress  Actress  See fewer,Members only,I Served the King of England (2006)
Klára Stemberová  Actress  Actress  See fewer,Members only,I Served the King of England (2006)
Hana Valková  Actress  Actress  See fewer,Members only,I Served the King of England (2006)
Pavel Vorech  Actor  Actor  See fewer,Members only,I Served the King of England (2006)
Bohumil Váchal  Actor  Actor  See fewer,Members only,The Grand Budapest Hotel (2014)
Veronika Zborniková  Actress  Actress  See fewer,Members only,I Served the King of England (2006)
Adolf Hitler Himself (archive footage) (uncredited)  Himself (archive footage) (uncredited)  See fewer,Members only,War Comes to America (1945)
