Name,STARmeter,Known for
Minnie Driver Ana Nichols  Ana Nichols  See fewer,Top 5000,Good Will Hunting (1997)
Jeremy Renner Saul Gregor  Saul Gregor  See fewer,Top 5000,The Hurt Locker (2008)
Bobby Coleman Jesse Nichols  Jesse Nichols  See fewer,Members only,The Last Song (2010)
Adam Rodriguez Steven  Steven  See fewer,Top 5000,CSI: Miami (2002)
David Denman Marty Nichols  Marty Nichols  See fewer,Top 5000,Brightburn (2019)
Emily Harrison Wendy  Wendy  See fewer,Members only,The Bold and the Beautiful (1987)
Bill McKinney Benjamin Gregor  Benjamin Gregor  See fewer,Members only,First Blood (1982)
Francesca P. Roberts Principal  Principal  See fewer,Members only,Legally Blonde (2001)
Jessica Stier Mrs. Bachanas  Mrs. Bachanas  See fewer,Members only,JAG (1995)
Rocky Marquette Mark  Mark  See fewer,Members only,On the Road (2012)
Paul Schackman Sam  Sam  See fewer,Members only,Café Society (2016)
Griff Furst Young Mechanic  Young Mechanic  See fewer,Members only,The Magnificent Seven (2016)
Shane Woodson Older Mechanic  Older Mechanic  See fewer,Members only,Resident Evil: Extinction (2007)
Courtenay Taylor Truck Driver (as Courtenay Kellen Taylor)  Truck Driver (as Courtenay Kellen Taylor)  See fewer,Members only,OK K.O.! Let's Be Heroes (2017)
Louis Mandylor Terrell  Terrell  See fewer,Members only,My Big Fat Greek Wedding (2002)
Patrick Dollaghan Supervising Officer  Supervising Officer  See fewer,Members only,Flags of our Fathers (2006)
Shane Johnson Officer Runion  Officer Runion  See fewer,Members only,Behind Enemy Lines (2001)
Kendall Clement Guard #1  Guard #1  See fewer,Members only,Silicon Towers (1999)
Andrew Thacher Guard #2  Guard #2  See fewer,Members only,Better Call Saul (2015)
Michael Ciulla Chuck (as Michael Colon)  Chuck (as Michael Colon)  See fewer,Members only,Law & Order (1990)
Patrick Brennan Incensed Man  Incensed Man  See fewer,Members only,The Twilight Saga: Breaking Dawn - Part 2 (2012)
Ryan Layton Simmons Bank Teller (as Ryan Simmons)  Bank Teller (as Ryan Simmons)  See fewer,Members only,Food Boy (2007)
Richard Bairos Male Customer  Male Customer  See fewer,Members only,Boston Legal (2004)
Veronica Lauren Female Patron  Female Patron  See fewer,Members only,Homeward Bound: The Incredible Journey (1993)
Theo Nicholas Pagones Pharmacist (as Theo Pagones)  Pharmacist (as Theo Pagones)  See fewer,Members only,Ten Days in the Valley (2017)
Tom Schmid Boss  Boss  See fewer,Members only,Bones (2005)
Dale Dickey Truck Woman  Truck Woman  See fewer,Top 5000,Hell or High Water (II) (2016)
Edward James Gage Older Man  Older Man  See fewer,Members only,The One (2001)
Keith Biondi Camper Man  Camper Man  See fewer,Members only,The Neighbors (2012)
Willie C. Carpenter Aging Man  Aging Man  See fewer,Members only,Men in Black (1997)
Allison Miller Shoe Sales Girl  Shoe Sales Girl  See fewer,Top 5000,17 Again (2009)
Todd Waring Loud Talker  Loud Talker  See fewer,Members only,Star Trek: Deep Space Nine (1993)
Rob Elk Senile Man  Senile Man  See fewer,Members only,Bob's Holiday Office Party
Lisa Robert Female Bartender  Female Bartender  See fewer,Members only,Southern Justice (2006)
Thomas F. Evans Dealer / Poker Player  Dealer / Poker Player  See fewer,Members only,The Kids Are Alright (2018)
David Foy Policeman  Policeman  See fewer,Members only,Hatchet II (2010)
Tyrone Benton III SUV Son (uncredited)  SUV Son (uncredited)  See fewer,Members only,Twisted Path (2010)
Cindy S. Benton SUV Mom (uncredited)  SUV Mom (uncredited)  See fewer,Members only,Blind Ambition (2008)
Bryeon Earle Bar Patron (uncredited)  Bar Patron (uncredited)  See fewer,Members only,Tears for Booboo (2010)
Paul Edney Waffle House Patron (uncredited)  Waffle House Patron (uncredited)  See fewer,Members only,NCIS (2003)
Alastair Gilbert Busboy (uncredited)  Busboy (uncredited)  See fewer,Members only,Mystery ER (2007)
Aaron Jennings Hartnell Last Meal Prison Guard (uncredited)  Last Meal Prison Guard (uncredited)  See fewer,Members only,Because I Said So (2007)
Alonzo F. Jones Arguing Husband (uncredited)  Arguing Husband (uncredited)  See fewer,Members only,Contrast (2014)
Katia Louise Waitress (uncredited)  Waitress (uncredited)  See fewer,Members only,Saving America's Horses: A Nation Betrayed (2012)
Jack Seal Day Player (uncredited)  Day Player (uncredited)  See fewer,Members only,Expendable (2008)
Gary Sievers Cafe Patron (uncredited)  Cafe Patron (uncredited)  See fewer,Members only,Public Enemies (1996)
Frank J. Tsacrios Homeless Man (uncredited)  Homeless Man (uncredited)  See fewer,Members only,The Happy Hooker Goes Hollywood (1980)
Connie Wong Pregnant Lady (uncredited)  Pregnant Lady (uncredited)  See fewer,Members only,Kingdom (2014)
