Name,STARmeter,Known for
Alex Fisher Mormon Boy #1  Mormon Boy #1  See fewer,Members only,Judith: The Night She Stayed Home (2010)
Peter Clayton-Luce Mormon Boy #2  Mormon Boy #2  See fewer,Members only,The Strangers (2008)
Scott Speedman James Hoyt  James Hoyt  See fewer,Top 5000,Underworld (2003)
Liv Tyler Kristen McKay  Kristen McKay  See fewer,Top 5000,Armageddon (1998)
Gemma Ward Dollface  Dollface  See fewer,Members only,The Black Balloon (2008)
Kip Weeks Man in Mask  Man in Mask  See fewer,Members only,Glory Road (2006)
Laura Margolis Pin-Up Girl  Pin-Up Girl  See fewer,Members only,Dirty Sexy Money (2007)
Glenn Howerton Mike  Mike  See fewer,Top 5000,It's Always Sunny in Philadelphia (2005)
Jordan Del Spina Jordan - 911 caller (voice) (uncredited)  Jordan - 911 caller (voice) (uncredited)  See fewer,Members only,The Devil's Rejects (2005)
