Name,STARmeter,Known for
Donald Glover Jason  Jason  See fewer,Top 5000,Solo: A Star Wars Story (2018)
D.C. Pierson Duncan  Duncan  See fewer,Members only,The To Do List (2013)
Dominic Dierkes Charlie  Charlie  See fewer,Members only,Workaholics (2011)
Aubrey Plaza Kelly  Kelly  See fewer,Top 500,Safety Not Guaranteed (2012)
Glenn Kalison Robert  Robert  See fewer,Members only,Kindling (II) (2013)
Peter Saati Leroy  Leroy  See fewer,Members only,Mystery Team (2009)
Kay Cannon Destiny  Destiny  See fewer,Members only,30 Rock (2006)
Bobby Moynihan Jordy  Jordy  See fewer,Members only,Saturday Night Live (1975)
Matt Walsh Jim  Jim  See fewer,Members only,Veep (2012)
John Lutz Frank  Frank  See fewer,Members only,Saturday Night Live (1975)
Robbie Sublett Ricky Appleman  Ricky Appleman  See fewer,Members only,Hachi: A Dog's Tale (2009)
Tom Shillue Alan McGinty  Alan McGinty  See fewer,Members only,Only Lovers Left Alive (2013)
Kevin Brown Bouncer  Bouncer  See fewer,Members only,30 Rock (2006)
Ellie Kemper Jamie  Jamie  See fewer,Top 5000,Bridesmaids (I) (2011)
Jon Daly Greg  Greg  See fewer,Members only,Masterminds (I) (2016)
Will Hines Mr. Stevens  Mr. Stevens  See fewer,Members only,Wrecked (2016)
Gregory Burke Football Player  Football Player  See fewer,Members only,Callback (2011)
Neil Casey Broken Man  Broken Man  See fewer,Members only,Ghostbusters (2016)
Lillian Chandler Mrs. Kimmel  Mrs. Kimmel  See fewer,Members only,Mystery Team (2009)
Daphne Ciccarelle Brianna  Brianna  See fewer,Members only,Death on Demand (2008)
Dan Eckman Bread Squeezer  Bread Squeezer  See fewer,Members only,Checkout (I) (2006)
George Eckman Old Man McGinty  Old Man McGinty  See fewer,Members only,Mystery Team (2009)
Cheryl Freeman Mrs. Rogers  Mrs. Rogers  See fewer,Members only,Hercules (1997)
Joe James Security Guard  Security Guard  See fewer,Members only,Algorithm: BLISS
Heidi May Johnson Robert's Wife  Robert's Wife  See fewer,Members only,The Maiden Heist (2009)
Anthony King Office Worker  Office Worker  See fewer,Members only,Wrecked (2016)
Kristopher Kling Sam  Sam  See fewer,Members only,The Deuce (2017)
John Kneeland Officer Mills  Officer Mills  See fewer,Members only,The Moon Under Glass (2010)
Meggie McFadden Cathy  Cathy  See fewer,Members only,Jerry (2007)
Nick Packard Dougie  Dougie  See fewer,Members only,The Magic School Bus Navigates the PTA (2013)
Ben Rodgers Caleb  Caleb  See fewer,Members only,CollegeHumor Originals (2006)
Xavier Salazar Eric  Eric  See fewer,Members only,Mystery Team (2009)
Calvin Santiago Sad Kid  Sad Kid  See fewer,Members only,Mystery Team (2009)
Ben Schwartz Dougie's Buddy  Dougie's Buddy  See fewer,Top 5000,Parks and Recreation (2009)
John Sefel Murphy  Murphy  See fewer,Members only,Buds (I)
Ron Simons Mr. Rogers  Mr. Rogers  See fewer,Members only,27 Dresses (2008)
Steve Stout Tyler  Tyler  See fewer,Members only,Craig Gets His Game On (2008)
Ben Tabor Playground Kid  Playground Kid  See fewer,Members only,The Adventures of Indiana James
Danielle Morse Picketer (uncredited)  Picketer (uncredited)  See fewer,Members only,"The Rude, the Mad, and the Funny (2014)"
