Name,STARmeter,Known for
Eion Bailey Nick  Nick  See fewer,Top 5000,Band of Brothers (2001)
Yvonne Strahovski Lori  Lori  See fewer,Top 500,Dexter (2006)
Will Patton Henry  Henry  See fewer,Top 5000,Armageddon (1998)
Wendy Worthington Motel Manager  Motel Manager  See fewer,Members only,Ally McBeal (1997)
Andrea Marcellus Clerk  Clerk  See fewer,Members only,Out at the Wedding (2007)
Christopher Sweeney Ranger  Ranger  See fewer,Members only,Curio Shop (2014)
Solomon Loop Helicoptor Pilot (as Soloman Loop)  Helicoptor Pilot (as Soloman Loop)  See fewer,Members only,Starkweather (2004)
Ed Tracey Helicoptor Pilot #2  Helicoptor Pilot #2  See fewer,Members only,The Canyon (2009)
Philip Salick Elvis Impersonator (uncredited)  Elvis Impersonator (uncredited)  See fewer,Members only,Dark Skies (2013)
