Name,STARmeter,Known for
Atsuko Okatsuka Atsuko Sakamoto  Atsuko Sakamoto  See fewer,Members only,Lake Los Angeles (2014)
Cory Zacharia Cory Lawler  Cory Lawler  See fewer,Members only,Pearblossom Hwy (2012)
Rintaro Sawamoto Rintaro Sakamoto  Rintaro Sakamoto  See fewer,Members only,The Man in the High Castle (2015)
Roberto 'Sanz' Sanchez Francisco Fumero  Francisco Fumero  See fewer,Members only,2 Fast 2 Furious (2003)
Ryan Dillon Brody  Brody  See fewer,Members only,Puppet Master X: Axis Rising (2012)
Matt Fling Garbo (as Matthew Fling)  Garbo (as Matthew Fling)  See fewer,Members only,Warpath
Ivy Khan Tammy  Tammy  See fewer,Members only,Who's That Guy? (2014)
Lee Lynch Gene  Gene  See fewer,Members only,Tinwoodsman's Home Movie #2 (2008)
Kathleen Maressa Guitar Girl  Guitar Girl  See fewer,Members only,Swine (2012)
Markiss McFadden Marques Wright  Marques Wright  See fewer,Members only,Transformers: Dark of the Moon (2011)
Sean Neff Sean Tippy  Sean Tippy  See fewer,Members only,Portrait of a Monster (2009)
David Nordstrom Troy Mairs  Troy Mairs  See fewer,Members only,Sawdust City (2011)
Sarah Chang Tadayon Sarah (as Sarah Tadayon)  Sarah (as Sarah Tadayon)  See fewer,Members only,Polyester
Brett L. Tinnes Jordan  Jordan  See fewer,Members only,Analog Days (2006)
