Name,STARmeter,Known for
Noel Appleby Everard Proudfoot  Everard Proudfoot  See fewer,Members only,The Lord of the Rings: The Fellowship of the Ring (2001)
Ali Astin Elanor Gamgee (as Alexandra Astin)  Elanor Gamgee (as Alexandra Astin)  See fewer,Members only,Bad Kids of Crestview Academy (2017)
Sean Astin Sam  Sam  See fewer,Top 5000,The Lord of the Rings: The Two Towers (2002)
David Aston Gondorian Soldier 3  Gondorian Soldier 3  See fewer,Members only,The Matrix (1999)
John Bach Madril  Madril  See fewer,Members only,The Lord of the Rings: The Two Towers (2002)
Sean Bean Boromir  Boromir  See fewer,Top 5000,The Lord of the Rings: The Fellowship of the Ring (2001)
Cate Blanchett Galadriel  Galadriel  See fewer,Top 500,Carol (2015)
Orlando Bloom Legolas  Legolas  See fewer,Top 5000,The Lord of the Rings: The Fellowship of the Ring (2001)
Billy Boyd Pippin  Pippin  See fewer,Members only,The Lord of the Rings: The Fellowship of the Ring (2001)
Sadwyn Brophy Eldarion  Eldarion  See fewer,Members only,Catching the Black Widow (2017)
Alistair Browning Damrod  Damrod  See fewer,Members only,Vertical Limit (2000)
Marton Csokas Celeborn  Celeborn  See fewer,Top 5000,The Equalizer (2014)
Richard Edge Gondorian Soldier 1  Gondorian Soldier 1  See fewer,Members only,Eruption (2009)
Jason Fitch Uruk 2  Uruk 2  See fewer,Members only,Pete's Dragon (2016)
Bernard Hill Theoden  Theoden  See fewer,Members only,The Lord of the Rings: The Two Towers (2002)
Ian Holm Bilbo  Bilbo  See fewer,Top 5000,The Lord of the Rings: The Fellowship of the Ring (2001)
Bruce Hopkins Gamling  Gamling  See fewer,Members only,The Lord of the Rings: The Two Towers (2002)
Ian Hughes Irolas  Irolas  See fewer,Members only,Hercules: The Legendary Journeys (1995)
Lawrence Makoare Witchking / Gothmog  Witchking / Gothmog  See fewer,Members only,Die Another Day (2002)
Ian McKellen Gandalf  Gandalf  See fewer,Top 5000,The Lord of the Rings: The Fellowship of the Ring (2001)
Bret McKenzie Elf Escort  Elf Escort  See fewer,Members only,Flight of the Conchords (2007)
Sarah McLeod Rosie Cotton  Rosie Cotton  See fewer,Members only,The Lord of the Rings: The Fellowship of the Ring (2001)
Maisy McLeod-Riera Baby Gamgee (as Maisie McLeod-Riera)  Baby Gamgee (as Maisie McLeod-Riera)  See fewer,Members only,Bridge to Terabithia (2007)
Dominic Monaghan Merry  Merry  See fewer,Top 5000,The Lord of the Rings: The Fellowship of the Ring (2001)
Viggo Mortensen Aragorn  Aragorn  See fewer,93,Eastern Promises (2007)
John Noble Denethor  Denethor  See fewer,Top 5000,The Lord of the Rings: The Two Towers (2002)
Paul Norell King of the Dead  King of the Dead  See fewer,Members only,Hercules: The Legendary Journeys (1995)
Miranda Otto Eowyn  Eowyn  See fewer,Top 5000,The Lord of the Rings: The Two Towers (2002)
Bruce Phillips Grimbold  Grimbold  See fewer,Members only,Without a Paddle (2004)
Shane Rangi Harad Leader 2  Harad Leader 2  See fewer,Members only,The Wolverine (2013)
John Rhys-Davies Gimli  Gimli  See fewer,Top 5000,The Lord of the Rings: The Two Towers (2002)
Todd Rippon Harad Leader 1  Harad Leader 1  See fewer,Members only,King Kong (2005)
Thomas Robins Deagol  Deagol  See fewer,Members only,The Hobbit: An Unexpected Journey (2012)
Andy Serkis Gollum / Smeagol  Gollum / Smeagol  See fewer,Top 5000,War for the Planet of the Apes (2017)
Harry Sinclair Isildur  Isildur  See fewer,Members only,The Lord of the Rings: The Fellowship of the Ring (2001)
Peter Tait Shagrat  Shagrat  See fewer,Members only,Underworld: Rise of the Lycans (2009)
Joel Tobeck Orc Lieutenant 1 (as Joel Tolbeck)  Orc Lieutenant 1 (as Joel Tolbeck)  See fewer,Members only,30 Days of Night (2007)
Liv Tyler Arwen  Arwen  See fewer,Top 5000,Armageddon (1998)
Karl Urban Eomer  Eomer  See fewer,Top 500,Star Trek (2009)
Stephen Ure Gorbag  Gorbag  See fewer,Members only,The Lord of the Rings: The Two Towers (2002)
Hugo Weaving Elrond  Elrond  See fewer,Top 5000,V for Vendetta (2005)
David Wenham Faramir  Faramir  See fewer,Top 5000,The Lord of the Rings: The Two Towers (2002)
Elijah Wood Frodo  Frodo  See fewer,Top 5000,The Lord of the Rings: The Fellowship of the Ring (2001)
Alan Howard Voice of the Ring (voice)  Voice of the Ring (voice)  See fewer,Members only,The Lord of the Rings: The Fellowship of the Ring (2001)
Sala Baker Featured Orc  Featured Orc  See fewer,Members only,Deadpool 2 (2018)
Robert Pollock Featured Orc  Featured Orc  See fewer,Members only,Once Were Warriors (1994)
Ross Duncan Featured Orc  Featured Orc  See fewer,Members only,King Kong (2005)
Pete Smith Featured Orc  Featured Orc  See fewer,Members only,The Quiet Earth (1985)
Jed Brophy Featured Orc  Featured Orc  See fewer,Members only,The Hobbit: An Unexpected Journey (2012)
Lee Hartley Featured Orc  Featured Orc  See fewer,Members only,The Lord of the Rings: The Fellowship of the Ring (2001)
Billy Jackson Featured Child  Featured Child  See fewer,Members only,The Lord of the Rings: The Fellowship of the Ring (2001)
Katie Jackson Featured Child  Featured Child  See fewer,Members only,The Lord of the Rings: The Fellowship of the Ring (2001)
Phil Grieve Orc commander (Extended Edition) (as Phillip Grieve)  Orc commander (Extended Edition) (as Phillip Grieve)  See fewer,Members only,The Lord of the Rings: The Fellowship of the Ring (2001)
Brad Dourif Wormtongue (extended edition)  Wormtongue (extended edition)  See fewer,Top 5000,One Flew Over the Cuckoo's Nest (1975)
Christopher Lee Saruman (extended edition)  Saruman (extended edition)  See fewer,Top 5000,Star Wars: Episode II - Attack of the Clones (2002)
Bruce Spence Black Lieutenant (extended edition)  Black Lieutenant (extended edition)  See fewer,Members only,Mad Max 2: The Road Warrior (1981)
Jane Abbott Coronation Elf (uncredited)  Coronation Elf (uncredited)  See fewer,Members only,The Lord of the Rings: The Fellowship of the Ring (2001)
Gino Acevedo Corsair of Umbar (uncredited)  Corsair of Umbar (uncredited)  See fewer,Members only,King Kong (2005)
Aidan Bell Orc (uncredited)  Orc (uncredited)  See fewer,Members only,Latent (II) (2019)
Jarl Benzon Coronation Elf (uncredited)  Coronation Elf (uncredited)  See fewer,Members only,Mortal Engines (2018)
Jørn Benzon Rivendell Elf (uncredited)  Rivendell Elf (uncredited)  See fewer,Members only,Rose (II) (2006)
Luke Burnyeat Orc (uncredited)  Orc (uncredited)  See fewer,Members only,The Dark Knight (2008)
Robert Catto Gondorian / Rohan / Orc (uncredited)  Gondorian / Rohan / Orc (uncredited)  See fewer,Members only,Dead Letters (2006)
Emma Deakin Diamond of Long Cleave (uncredited)  Diamond of Long Cleave (uncredited)  See fewer,Members only,One Little Step (2007)
Michael Elsworth Cirdan the Shipwright (uncredited)  Cirdan the Shipwright (uncredited)  See fewer,Members only,The Lord of the Rings: The Fellowship of the Ring (2001)
Clint Elvy Haradrim Warrior (uncredited)  Haradrim Warrior (uncredited)  See fewer,Members only,The Hobbit: The Battle of the Five Armies (2014)
Zo Hartley Orc Helper (uncredited)  Orc Helper (uncredited)  See fewer,Members only,King Kong (2005)
Peter Jackson Corsair Bosun (uncredited)  Corsair Bosun (uncredited)  See fewer,Top 5000,The Lord of the Rings: The Fellowship of the Ring (2001)
Sandro Kopp Coronation Elf (uncredited)  Coronation Elf (uncredited)  See fewer,Members only,Okja (2017)
Andrew Lesnie Corsair of Umbar (uncredited)  Corsair of Umbar (uncredited)  See fewer,Members only,The Lord of the Rings: The Fellowship of the Ring (2001)
Joseph Mika-Hunt Orc (uncredited)  Orc (uncredited)  See fewer,Members only,Godplex
Henry Mortensen Pelennor Orc (uncredited)  Pelennor Orc (uncredited)  See fewer,Members only,Crimson Tide (1995)
Craig Parker Gothmog / Orc Lieutenant 1 (voice) (uncredited)  Gothmog / Orc Lieutenant 1 (voice) (uncredited)  See fewer,Top 5000,The Lord of the Rings: The Two Towers (2002)
Rick Porras Corsair of Umbar / Beacon Guard (uncredited)  Corsair of Umbar / Beacon Guard (uncredited)  See fewer,Members only,Contact (1997)
Christian Rivers Corsair of Umbar / Beacon Guard (uncredited)  Corsair of Umbar / Beacon Guard (uncredited)  See fewer,Members only,King Kong (2005)
Michael Semanick Drinking Rohan Soldier (uncredited)  Drinking Rohan Soldier (uncredited)  See fewer,Members only,King Kong (2005)
Howard Shore Drinking Rohan Soldier (uncredited)  Drinking Rohan Soldier (uncredited)  See fewer,Members only,The Twilight Saga: Eclipse (2010)
John Stephenson Witchking (voice) (uncredited)  Witchking (voice) (uncredited)  See fewer,Members only,Charlotte's Web (1973)
Richard Taylor Corsair of Umbar (uncredited)  Corsair of Umbar (uncredited)  See fewer,Members only,King Kong (2005)
Royd Tolkien Gondorian Ranger (uncredited)  Gondorian Ranger (uncredited)  See fewer,Members only,The Hobbit: The Desolation of Smaug (2013)
