Name,STARmeter,Known for
Lauren Watson Sam  Sam  See fewer,Members only,This Means War (2012)
Jamie Temple Jason  Jason  See fewer,Members only,From Beneath (2012)
Blake Retter Dan Kentley  Dan Kentley  See fewer,Members only,From Beneath (2012)
Nicole Smashnuk Sarah Kentley  Sarah Kentley  See fewer,Members only,Surviving Evil (2013)
Jasmin Hawkesboyd Sandra Kentley  Sandra Kentley  See fewer,Members only,From Beneath (2012)
Bella Hawkesboyd Elizabeth Kentley  Elizabeth Kentley  See fewer,Members only,From Beneath (2012)
