Name,STARmeter,Known for
Lukas Haas Zach  Zach  See fewer,Top 5000,Inception (2010)
Madeline Zima Rebecca  Rebecca  See fewer,Top 5000,Californication (2007)
Jake Busey Dan Drake  Dan Drake  See fewer,Top 5000,Starship Troopers (1997)
Tania Raymonde Autumn  Autumn  See fewer,Top 500,Lost (2004)
Blake Garrett Rosenthal Max (as Blake Garrett)  Max (as Blake Garrett)  See fewer,Members only,Bridesmaids (I) (2011)
Ray Wise Zach's Father  Zach's Father  See fewer,Top 5000,Batman: The Killing Joke (2016)
Valerie Mahaffey Zach's Mother  Zach's Mother  See fewer,Members only,Seabiscuit (2003)
Moran Atias Ex  Ex  See fewer,Members only,Third Person (2013)
Ned Bellamy Bob  Bob  See fewer,Members only,Ed Wood (1994)
Laura Miro Ping  Ping  See fewer,Members only,Memoirs of a Geisha (2005)
Regine Nehy Latisha  Latisha  See fewer,Members only,Lakeview Terrace (2008)
Joshua Thorpe Brad  Brad  See fewer,Members only,10 Things I Hate About You (1999)
Harvey Shield British Man  British Man  See fewer,Members only,China Moon (1994)
T. Ryan Mooney Hooligan  Hooligan  See fewer,Members only,Batman v Superman: Dawn of Justice (2016)
Natalie Floyd Blonde  Blonde  See fewer,Members only,Pretty Little Liars (2010)
Michael Pasternak Rabbi  Rabbi  See fewer,Members only,Vegas (2012)
Bruce Gray Lawyer  Lawyer  See fewer,Members only,My Big Fat Greek Wedding (2002)
Wes Scott Large Friend #1  Large Friend #1  See fewer,Members only,Flesh (I) (2007)
Airon Armstrong Large Friend #2  Large Friend #2  See fewer,Members only,The Dark Knight Rises (2012)
Shaun O'Hagan Cop  Cop  See fewer,Members only,Black Swan (2010)
Edward Finlay Chad  Chad  See fewer,Members only,2 Fast 2 Furious (2003)
Reese Hartwig Teen at Funeral  Teen at Funeral  See fewer,Members only,Earth to Echo (2014)
Chris Jorie Doctor (as Chris Jorie)  Doctor (as Chris Jorie)  See fewer,Members only,Major Crimes (2012)
Lauren Byrnes Hipster (uncredited)  Hipster (uncredited)  See fewer,Members only,Sharia (2016)
Christian Calloway Homeless Santa (uncredited)  Homeless Santa (uncredited)  See fewer,Members only,Twin Peaks (2017)
Joshua Davis Make-Out Guy (uncredited)  Make-Out Guy (uncredited)  See fewer,Members only,Elsewhere (II) (2017)
Jessica Elder Hipster (uncredited)  Hipster (uncredited)  See fewer,Members only,Cabin Fever (2002)
Robby George Gay Party Guy (uncredited)  Gay Party Guy (uncredited)  See fewer,Members only,Eating Out: All You Can Eat (2009)
Mitch L. Guy Gay Party Guy (uncredited)  Gay Party Guy (uncredited)  See fewer,Members only,Barracuda (2013)
Jesse Holcomb Hipster (uncredited)  Hipster (uncredited)  See fewer,Members only,Familiar (II) (2016)
Evan Karagias Himself (uncredited)  Himself (uncredited)  See fewer,Members only,WCW Thunder (1998)
Eric Michael Kochmer Guy at the Hotel (uncredited)  Guy at the Hotel (uncredited)  See fewer,Members only,Sweet Caroline (2016)
Sarah Leners Nurse (uncredited)  Nurse (uncredited)  See fewer,Members only,The Secret Lives of Dorks (2013)
Elena Levon Beautiful Brunette (uncredited)  Beautiful Brunette (uncredited)  See fewer,Members only,Between a Greek and a Hard Place
P.D. Mani Indian Call Center Operator (uncredited)  Indian Call Center Operator (uncredited)  See fewer,Members only,The Runaways (2010)
Jennifer Popagain Lesbian Party Goer (uncredited)  Lesbian Party Goer (uncredited)  See fewer,Members only,Dead Cruelty (2015)
Krystina Ptasinski Party Goer (uncredited)  Party Goer (uncredited)  See fewer,Members only,"For a Good Time, Call... (2012)"
Mckeel Robins Hipster (uncredited)  Hipster (uncredited)  See fewer,Members only,Medium (2005)
Kelli Jo Sweeney Hipster (uncredited)  Hipster (uncredited)  See fewer,Members only,Flick (2012)
Kaye Marie Talise Hipster (uncredited)  Hipster (uncredited)  See fewer,Members only,For the Love of Money (2012)
Sal Velez Jr. Drunk Patron (uncredited)  Drunk Patron (uncredited)  See fewer,Members only,Black Summer (2019)
María Antonieta Vázquez Drunk Prostitute (uncredited)  Drunk Prostitute (uncredited)  See fewer,Members only,The Storm (2009)
