Name,STARmeter,Known for
Elizabeth Olsen Sarah  Sarah  See fewer,Top 500,Martha Marcy May Marlene (2011)
Adam Trese John  John  See fewer,Members only,40 Days and 40 Nights (2002)
Eric Sheffer Stevens Peter  Peter  See fewer,Members only,As the World Turns (1956)
Julia Chan Sophia (as Julia Taylor Ross)  Sophia (as Julia Taylor Ross)  See fewer,Members only,Saving Hope (2012)
Adam Barnett Stalking Man  Stalking Man  See fewer,Members only,Touch (VI) (2011)
Haley Murphy Little Girl  Little Girl  See fewer,Members only,My Best Day (2012)
