Name,STARmeter,Known for
Tina Fey Portia Nathan  Portia Nathan  See fewer,Top 5000,Date Night (2010)
Ann Harada Mrs. Lafont  Mrs. Lafont  See fewer,Members only,Happiness (1998)
Ben Levin Junior Lafont  Junior Lafont  See fewer,Members only,Legacies (2018)
Dan Levy James (as Daniel Joseph Levy)  James (as Daniel Joseph Levy)  See fewer,Top 500,Schitt's Creek (2015)
Maggie Keenan-Bolger Girl on Tour  Girl on Tour  See fewer,Members only,The Good Wife (2009)
Gloria Reuben Corinne  Corinne  See fewer,Top 5000,Lincoln (2012)
Paul Rudd John Pressman  John Pressman  See fewer,7,Ant-Man (2015)
Wallace Shawn Clarence  Clarence  See fewer,Top 5000,The Princess Bride (1987)
Elaine Kussack Abby  Abby  See fewer,Members only,Mr. Popper's Penguins (2011)
Christopher Evan Welch Brandt  Brandt  See fewer,Members only,Lincoln (2012)
Michael Genadry Ben  Ben  See fewer,Members only,Ed (2000)
Juliet Brett Praying Applicant  Praying Applicant  See fewer,Members only,Fosse/Verdon (2019)
John Brodsky Smug Kid  Smug Kid  See fewer,Members only,Vera (III)
Camille Branton Gymnast  Gymnast  See fewer,Members only,Bolden (2019)
Sarita Choudhury Rachael  Rachael  See fewer,Top 5000,Lady in the Water (2006)
Michael Sheen Mark  Mark  See fewer,Top 500,Masters of Sex (2013)
Ken Barnett Admissions Counselor  Admissions Counselor  See fewer,Members only,Mozart in the Jungle (2014)
Nat Wolff Jeremiah  Jeremiah  See fewer,Top 5000,The Kill Team (2019)
Travis Bratten Quest Student  Quest Student  See fewer,Members only,Missed Connection (I) (2011)
Tanisha Long Quest Student  Quest Student  See fewer,Members only,Bigger (2019)
Nadia Alexander Quest Student  Quest Student  See fewer,Members only,Blame (I) (2017)
Karen Pham Quest Student  Quest Student  See fewer,Members only,Wholesome
Travaris Spears Nelson (as Travaris Meeks-Spears)  Nelson (as Travaris Meeks-Spears)  See fewer,Members only,The Super (2017)
Lily Tomlin Susannah  Susannah  See fewer,Top 5000,Nashville (1975)
Rob Campbell Richard  Richard  See fewer,Members only,The Crucible (1996)
Sonya Walger Helen  Helen  See fewer,Top 5000,The Librarian: Quest for the Spear (2004)
Olek Krupa Polokov  Polokov  See fewer,Members only,Burn After Reading (2008)
Roby Sobieski Makeout Guy  Makeout Guy  See fewer,Members only,Face (2012)
Lauren Schaffel Student at Party (as Lauren Anne Schaffel)  Student at Party (as Lauren Anne Schaffel)  See fewer,Members only,Death to Smoochy (2002)
Brian Charles Johnson Student at Party  Student at Party  See fewer,Members only,The Wolf of Wall Street (2013)
Lipica Shah Student at Party  Student at Party  See fewer,Members only,A Silent Voice (2016)
Jarod Einsohn Keg Guy  Keg Guy  See fewer,Members only,Project X (2012)
Caliaf St. Aubyn Keg Guy's Friend  Keg Guy's Friend  See fewer,Members only,Admission (2013)
Zita Geoffroy Tour Group Mom (as Zita-Ann Geoffrey)  Tour Group Mom (as Zita-Ann Geoffrey)  See fewer,Members only,At the Jersey Shore (2011)
Laura Jordan Woman  Woman  See fewer,Members only,O.T.P. (2014)
Sarah Quinn Young Mother  Young Mother  See fewer,Members only,The Reluctant Fundamentalist (2012)
Jason Blaj Supermarket Kid  Supermarket Kid  See fewer,Members only,Admission (2013)
Zachary Unger Jeremiah - 8 Years Old  Jeremiah - 8 Years Old  See fewer,Members only,Billions (2016)
Lisa Emery Mrs. Pressman  Mrs. Pressman  See fewer,Members only,Unfaithful (2002)
Mihran Slougian Jeremiah's Dad  Jeremiah's Dad  See fewer,Members only,Steve Jobs (2015)
Lynne Taylor Jeremiah's Mom  Jeremiah's Mom  See fewer,Members only,Bull (2016)
Brian d'Arcy James Christopher Flynn  Christopher Flynn  See fewer,Members only,Spotlight (I) (2015)
Leigha Hancock Yulia Karasov  Yulia Karasov  See fewer,Members only,The Hunger Games (2012)
David Simins A Capella Singer  A Capella Singer  See fewer,Members only,Admission (2013)
Brad Wilson A Capella Singer  A Capella Singer  See fewer,Members only,Love in NY (2018)
Ryan McCarty A Capella Singer  A Capella Singer  See fewer,Members only,Admission (2013)
Krishna Choudhary A Capella Singer  A Capella Singer  See fewer,Members only,Once Upon a Time in Mumbai (2010)
Ricky Jones A Capella Singer  A Capella Singer  See fewer,Members only,Admission (2013)
Thomas Merckens A Capella Singer  A Capella Singer  See fewer,Members only,Admission (2013)
Alan Robert Southworth A Capella Singer  A Capella Singer  See fewer,Members only,Admission (2013)
Chris Brownell A Capella Singer  A Capella Singer  See fewer,Members only,Admission (2013)
Chris Palermo A Capella Singer  A Capella Singer  See fewer,Members only,Top Photographer (2016)
Anthony Capers Jeremiah's Buddy  Jeremiah's Buddy  See fewer,Members only,Luke Cage (2016)
Julia Faye Fisher Agency Receptionist  Agency Receptionist  See fewer,Members only,True Blood (2008)
Gameela Wright Woman in Adoption Agency  Woman in Adoption Agency  See fewer,Members only,John Wick (2014)
Brendan Abbott Student in Dream (uncredited)  Student in Dream (uncredited)  See fewer,Members only,Get Out of My Face (2011)
Ashlynn Alexander Sylvia Hadlock (uncredited)  Sylvia Hadlock (uncredited)  See fewer,Members only,Gotham (2014)
James P. Anderson Baxter Birthday Party Guest (uncredited)  Baxter Birthday Party Guest (uncredited)  See fewer,Members only,Five Minarets in New York (2010)
Tina Benko Andrea (uncredited)  Andrea (uncredited)  See fewer,Members only,The Avengers (2012)
Paula Blum Office Administrator (uncredited)  Office Administrator (uncredited)  See fewer,Members only,Conversatiated (2016)
Matthew Broadley Twin Brother (uncredited)  Twin Brother (uncredited)  See fewer,Members only,Boardwalk Empire (2010)
Sara Lorena Bruno  Actress (uncredited)  Actress (uncredited)  See fewer,Members only,Losing Focus (2012)
Michaela Bryce Princeton College Applicant (uncredited)  Princeton College Applicant (uncredited)  See fewer,Members only,Noah (2014)
Katie Buenneke Dancing Quest Student (uncredited)  Dancing Quest Student (uncredited)  See fewer,Members only,Conquering the Rose (2012)
Ann Chow Beverly (uncredited)  Beverly (uncredited)  See fewer,Members only,Okja (2017)
Vanessa Coelho Quest Student (uncredited)  Quest Student (uncredited)  See fewer,Members only,Crocodile Boy (2016)
Alix Cross Quest School Student (uncredited)  Quest School Student (uncredited)  See fewer,Members only,Red Oaks (2014)
Jonathon Culver Quest Student (uncredited)  Quest Student (uncredited)  See fewer,Members only,The Greatest Showman (2017)
Tom DeFulvio Princeton Student (uncredited)  Princeton Student (uncredited)  See fewer,Members only,The Middle of X (2018)
Jeremy Frutkin Princeton Frat Boy (uncredited)  Princeton Frat Boy (uncredited)  See fewer,Members only,Daredevil (2015)
Giullian Yao Gioiello Princeton Applicant (uncredited)  Princeton Applicant (uncredited)  See fewer,Members only,Scream: The TV Series (2015)
Daniel Grote Princeton College Applicant (uncredited)  Princeton College Applicant (uncredited)  See fewer,Members only,Green Death (2013)
Brandon Lee Harris Office Assistant (uncredited)  Office Assistant (uncredited)  See fewer,Members only,Blue Like Jazz (2012)
Alex Hartman Princeton Applicant (uncredited)  Princeton Applicant (uncredited)  See fewer,Members only,Living the Dream (II) (2017)
Alice Litvak Twin Sister (uncredited)  Twin Sister (uncredited)  See fewer,Members only,The Americans (2013)
Nicole Maggio Lacrosse Girl (uncredited)  Lacrosse Girl (uncredited)  See fewer,Members only,Binge (2017)
Alexis Molnar Princeton College Applicant (uncredited)  Princeton College Applicant (uncredited)  See fewer,Members only,Stake Land (2010)
Meaghan Monaghan Featured - Student (uncredited)  Featured - Student (uncredited)  See fewer,Members only,After the Outbreak (2017)
Rachel Moss Lacrosse Player (uncredited)  Lacrosse Player (uncredited)  See fewer,Members only,One Life to Live (1968)
Asher Muldoon Nelson's Friend (uncredited)  Nelson's Friend (uncredited)  See fewer,Members only,Get Happy! (2016)
Ismaelpeter Casillas Nelson Ismael Cow Milking Expert (uncredited)  Ismael Cow Milking Expert (uncredited)  See fewer,Members only,Hard Sell (2016)
Lindsey Ryan The Applying Student (uncredited)  The Applying Student (uncredited)  See fewer,Members only,Beneath Disheveled Stars (2014)
Edward Sass III Birthday Party Guest (uncredited)  Birthday Party Guest (uncredited)  See fewer,Members only,The Amazing Spider-Man 2 (2014)
Danielle Senk Lacrosse Player (uncredited)  Lacrosse Player (uncredited)  See fewer,Members only,The Avenger of Blood: Redemption
Natasha Tax Prep School Girl (uncredited)  Prep School Girl (uncredited)  See fewer,Members only,White Collar (2009)
Barbara Vincent Birthday Party Guest (uncredited)  Birthday Party Guest (uncredited)  See fewer,Members only,Miracles from Heaven (2016)
Justice Winter Birthday Party Guest (uncredited)  Birthday Party Guest (uncredited)  See fewer,Members only,Annie (2014)
