Name,STARmeter,Known for
Tom Coderre Himself  Himself  See fewer,Members only,The Anonymous People (2013)
Tara Conner Herself  Herself  See fewer,Members only,The Stalking Fields
Laurie Dhue Herself  Herself  See fewer,Members only,Godzilla: King of the Monsters (2019)
Don Fertman Himself  Himself  See fewer,Members only,Shortcuts to Infinity: The Poetry of Stephen Kalinich (2017)
Frank Greenagel Himself  Himself  See fewer,Members only,An American Epidemic (2015)
Chris Herren Himself  Himself  See fewer,Members only,If Only (II) (2015)
Kristen Johnston Herself  Herself  See fewer,Top 5000,3rd Rock from the Sun (1996)
Patrick Kennedy Himself  Himself  See fewer,Members only,The Disappearance of Madeleine McCann (2019)
William Cope Moyers Himself  Himself  See fewer,Members only,The Anonymous People (2013)
Jim Ramstad Himself  Himself  See fewer,Members only,Getting High (2017)
Bill White Himself  Himself  See fewer,Members only,The Anonymous People (2013)
