Name,STARmeter,Known for
Sienna Miller Marilyn  Marilyn  See fewer,Top 500,G.I. Joe: The Rise of Cobra (2009)
Golshifteh Farahani Mona  Mona  See fewer,Top 5000,Paterson (2016)
Bahar Soomekh Soha  Soha  See fewer,Members only,Saw III (2006)
Tim Guinee George  George  See fewer,Members only,99 Homes (2014)
Roschdy Zem Mourad  Mourad  See fewer,Members only,The Cold Light of Day (2012)
Chafia Boudraa La mère de Mourad  La mère de Mourad  See fewer,Members only,Outside the Law (2010)
Richard Jose Ezhno  Ezhno  See fewer,Members only,Just Like a Woman (2012)
Jesse Bob Harper Harvey (as Jesse Harper)  Harvey (as Jesse Harper)  See fewer,Members only,Just Like a Woman (2012)
Sayed Badreya Tarek  Tarek  See fewer,Members only,Iron Man (2008)
Usman Ally Ousman  Ousman  See fewer,Members only,A Series of Unfortunate Events (2017)
Doug James George's Father  George's Father  See fewer,Members only,Boss (2011)
Deanna Dunagan George's Mother  George's Mother  See fewer,Members only,The Visit (I) (2015)
Michael Ehlers Instructor / Peter  Instructor / Peter  See fewer,Members only,A Demon Within (2017)
Aaron Walters Suspect  Suspect  See fewer,Members only,Chicago P.D. (2014)
Loren Lazerine Ron  Ron  See fewer,Members only,Fast & Furious (2009)
Rebekah Ward Rebecca  Rebecca  See fewer,Members only,Chicago Med (2015)
Boots Southerland Cook  Cook  See fewer,Members only,No Country for Old Men (2007)
Helen Young Officer  Officer  See fewer,Members only,Just Like a Woman (2012)
Tim Edward Rhoze Policeman  Policeman  See fewer,Members only,Just Like a Woman (2012)
Will Yazzie Grandfather  Grandfather  See fewer,Members only,Just Like a Woman (2012)
Jacqueline Williams Sharifa  Sharifa  See fewer,Members only,The Chi (2018)
Shi Valdez Ezhno's wife  Ezhno's wife  See fewer,Members only,In Plain Sight (2008)
Mike Miller Neighbor  Neighbor  See fewer,Members only,Ideal Home (2018)
Mary R. Woods Neighbor's Wife  Neighbor's Wife  See fewer,Members only,Longmire (2012)
Galen Hutchinson Neighbor's son  Neighbor's son  See fewer,Members only,Just Like a Woman (2012)
Kimberly Kiegel Woman Judge (as Kim Kiegel)  Woman Judge (as Kim Kiegel)  See fewer,Members only,Waco (2018)
Amy Olson Chinese Delivery Woman  Chinese Delivery Woman  See fewer,Members only,With Grace (2016)
Bridget Kelly Assistant  Assistant  See fewer,Members only,The Deception (2012)
Mathieu Schiffman Cab driver  Cab driver  See fewer,Members only,Adore (2013)
Jack Burning Native American Employee  Native American Employee  See fewer,Members only,Not Forgotten (2009)
Lewis Alexander Gas Station Attendant  Gas Station Attendant  See fewer,Members only,Just Like a Woman (2012)
Richard Cotovsky Bum  Bum  See fewer,Members only,Stir of Echoes (1999)
Kid Dynamite Blues Singer  Blues Singer  See fewer,Members only,Just Like a Woman (2012)
Sir Walter Scott Blues Band member  Blues Band member  See fewer,Members only,Just Like a Woman (2012)
Ronald 'Ron-Ron' Hollister Blues Band member  Blues Band member  See fewer,Members only,Just Like a Woman (2012)
Terrence Williams Blues Band member (as Terrence 'T-Man' Williams)  Blues Band member (as Terrence 'T-Man' Williams)  See fewer,Members only,Just Like a Woman (2012)
Joewaun Scott Blues Band member  Blues Band member  See fewer,Members only,Just Like a Woman (2012)
Ruben Nakai Campaña Indian Youth (uncredited)  Indian Youth (uncredited)  See fewer,Members only,True Grit (2010)
Paolina Cimino Belly Dancer (uncredited)  Belly Dancer (uncredited)  See fewer,Members only,Underemployed (2012)
Lorena Fernández Belly Dancer (uncredited)  Belly Dancer (uncredited)  See fewer,Members only,Dance of the Books (2012)
Rodger Larance Bar Patron (uncredited)  Bar Patron (uncredited)  See fewer,Members only,Shot Caller (2017)
Dan Latham Bus Passenger (uncredited)  Bus Passenger (uncredited)  See fewer,Members only,Transformers: Age of Extinction (2014)
Francisco Peramos Judge (uncredited)  Judge (uncredited)  See fewer,Members only,Dance of the Books (2012)
Jaime Powers Dancing Bar Patron (uncredited)  Dancing Bar Patron (uncredited)  See fewer,Members only,Transcendence (I) (2014)
