Name,STARmeter,Known for
Sebastian Arcelus Mark  Mark  See fewer,Members only,Split (IX) (2016)
Bill English Chris  Chris  See fewer,Members only,Person of Interest (2011)
Rhett Henckel Roddy  Roddy  See fewer,Members only,Ambition's Debt (2017)
Michael Izquierdo Dan  Dan  See fewer,Members only,Succession (2018)
Heather Lind Shannon  Shannon  See fewer,Top 5000,Mistress America (2015)
Vanessa Ray Phoebe  Phoebe  See fewer,Top 5000,Frances Ha (2012)
Julie Sharbutt Erin  Erin  See fewer,Members only,The Good Wife (2009)
Lauren Worsham Lisa  Lisa  See fewer,Members only,Sakura Diaries (1997)
