Name,STARmeter,Known for
Allison Miller Samantha McCall  Samantha McCall  See fewer,Top 5000,17 Again (2009)
Zach Gilford Zach McCall  Zach McCall  See fewer,Top 5000,The Purge: Anarchy (2014)
Sam Anderson Father Thomas  Father Thomas  See fewer,Members only,Forrest Gump (1994)
Roger Payano Cab Driver  Cab Driver  See fewer,Members only,"Me, You, & Him (2015)"
Vanessa Ray Suzie  Suzie  See fewer,Top 5000,Frances Ha (2012)
Bill Martin Williams Ken  Ken  See fewer,Members only,Tales from the Hood 2 (2018)
Geraldine Singer Sally  Sally  See fewer,Members only,Get Out (I) (2017)
Julia Denton Natalie  Natalie  See fewer,Members only,The Fundamentals of Caring (2016)
Colin Walker Stanley  Stanley  See fewer,Members only,Treme (2010)
Madison Wolfe Brittany  Brittany  See fewer,Top 5000,The Conjuring 2 (2016)
Joshua Shane Brooks Braedon  Braedon  See fewer,Members only,Devil's Due (2014)
Aimee Carrero Emily  Emily  See fewer,Members only,Elena of Avalor (2016)
Robert Belushi Mason  Mason  See fewer,Members only,Chicago P.D. (2014)
DeMaris Gordon Psychic  Psychic  See fewer,Members only,Circle (II) (2015)
Donna Duplantier Dr. J. Ludka  Dr. J. Ludka  See fewer,Members only,The Curious Case of Benjamin Button (2008)
Robert Aberdeen Dr. Dylan  Dr. Dylan  See fewer,Members only,Lee Daniels' The Butler (2013)
Catherine Kresge Tina  Tina  See fewer,Members only,"Hello, My Name Is Doris (2015)"
Kurt Krause Jay  Jay  See fewer,Members only,American Crime (2015)
Tyler Forrest Steve  Steve  See fewer,Members only,22 Jump Street (2014)
Sloane Coe Ashley  Ashley  See fewer,Members only,Ghost Shark (2013)
Michael Papajohn Officer Miska  Officer Miska  See fewer,Members only,Jurassic World (2015)
Douglas M. Griffin Detective Zeman  Detective Zeman  See fewer,Members only,Hap and Leonard (2016)
Nicole Stuart Lamaze Instructor  Lamaze Instructor  See fewer,Members only,The Egg and I
Yohance Myles Jim  Jim  See fewer,Members only,Containment (2016)
Stacie Davis Karen  Karen  See fewer,Members only,The Wire (2002)
Annie Gaia Club Girl  Club Girl  See fewer,Members only,9 Full Moons (2013)
Sylvia Grace Crim Nurse  Nurse  See fewer,Members only,The Hunt (IX)
Jennifer Schemke Mother in Market  Mother in Market  See fewer,Members only,Abraham Lincoln: Vampire Hunter (2012)
Hunter Lobre Boy in Market  Boy in Market  See fewer,Members only,Devil's Due (2014)
Candi Brooks Wedding Guest  Wedding Guest  See fewer,Members only,Preacher (2016)
Derek Hall Wedding Guest  Wedding Guest  See fewer,Members only,Escape Plan (2013)
Katherine Grace Yeaton Communion Girl (as Katherine Yeaton)  Communion Girl (as Katherine Yeaton)  See fewer,Members only,Kiddie Flamingos (2015)
Justyna Kelley Paris Wife  Paris Wife  See fewer,Members only,The King's Daughter
Shane Woodward Paris Husband  Paris Husband  See fewer,Members only,3 Days to Kill (2014)
Maverick Maverick  Maverick  See fewer,Members only,Devil's Due (2014)
Elizabeth Austin Sam's Friend (uncredited)  Sam's Friend (uncredited)  See fewer,Members only,Dawn of the Planet of the Apes (2014)
Rex Baker Wedding Guest (uncredited)  Wedding Guest (uncredited)  See fewer,Members only,Criminal Activities (2015)
Kenneth Kynt Bryan Wedding Guest (uncredited)  Wedding Guest (uncredited)  See fewer,Members only,Claws (2017)
Janet Lynn Carey Communion Parent (uncredited)  Communion Parent (uncredited)  See fewer,Members only,Kidnap (2017)
Joseph Randy Causin Patient (uncredited)  Patient (uncredited)  See fewer,Members only,Ravenswood (2013)
Rebecca Collins Wedding Guest (uncredited)  Wedding Guest (uncredited)  See fewer,Members only,Homefront (I) (2013)
Haylie Creppel Communion Girl (uncredited)  Communion Girl (uncredited)  See fewer,Members only,Re-Kill (2015)
Steven J. Daniels Orderly (uncredited)  Orderly (uncredited)  See fewer,Members only,Wild Card (2015)
Joseph Fischer  Actor (uncredited)  Actor (uncredited)  See fewer,Members only,Wild Card (2015)
Axel Flores Juan (uncredited)  Juan (uncredited)  See fewer,Members only,Queen of the South (2016)
Claire Frederiksen Sam's Friend (uncredited)  Sam's Friend (uncredited)  See fewer,Members only,Quarry (2016)
Griff Furst Keith (uncredited)  Keith (uncredited)  See fewer,Members only,The Magnificent Seven (2016)
Steffie Grote Sam's Friend (uncredited)  Sam's Friend (uncredited)  See fewer,Members only,Pawn Shop Chronicles (2013)
Colin Haag Jr. wedding Guest (uncredited)  wedding Guest (uncredited)  See fewer,Members only,Day 5 (2016)
Raiden Integra Wedding Guest (uncredited)  Wedding Guest (uncredited)  See fewer,Members only,Tell No One (II)
Jacquelyn Twodat Jackson Church goer (uncredited)  Church goer (uncredited)  See fewer,Members only,Memphis Beat (2010)
Allyson Leigh Jordan Wedding Guest (uncredited)  Wedding Guest (uncredited)  See fewer,Members only,Common Law (2012)
Mark Joyce Wedding Guest (uncredited)  Wedding Guest (uncredited)  See fewer,Members only,Parker (2013)
Elton LeBlanc Dr. B. Yeaton (uncredited)  Dr. B. Yeaton (uncredited)  See fewer,Members only,Deja Vu (2006)
Claire McReynolds Communion Girl (uncredited)  Communion Girl (uncredited)  See fewer,Members only,Hypnotized
Wendi Merritt Shopper (uncredited)  Shopper (uncredited)  See fewer,Members only,Remember Sunday (2013)
David Stephen Mitchell Wedding Guest (uncredited)  Wedding Guest (uncredited)  See fewer,Members only,Hot Pursuit (2015)
Rebekah Jean Morgan Wedding Guest (uncredited)  Wedding Guest (uncredited)  See fewer,Members only,Stained Memories (2003)
Lola Phillips Hospital Guest (uncredited)  Hospital Guest (uncredited)  See fewer,Members only,Desiree (2015)
Zachary Probus Altar Boy (uncredited)  Altar Boy (uncredited)  See fewer,Members only,Salem (2014)
Terence Rosemore Security Guard (uncredited)  Security Guard (uncredited)  See fewer,Members only,Guardians of the Galaxy Vol. 2 (2017)
Aaron Ruiz Diego (uncredited)  Diego (uncredited)  See fewer,Members only,"Bless Me, Ultima (2012)"
Katherine Jeanie Russell ER Doctor (uncredited)  ER Doctor (uncredited)  See fewer,Members only,Ravenswood (2013)
Robert Segari Doctor (uncredited)  Doctor (uncredited)  See fewer,Members only,Stolen (2012)
Emily Jessie Thomas Church Guest (uncredited)  Church Guest (uncredited)  See fewer,Members only,The Lookalike (2014)
Lionel Toyer LaMaze Dad (uncredited)  LaMaze Dad (uncredited)  See fewer,Members only,G.I. Joe: Retaliation (2013)
Spencer Tracy Groomsman #1 (uncredited)  Groomsman #1 (uncredited)  See fewer,Members only,Green Lantern (2011)
Joseph Uzzell Communion Parent (uncredited)  Communion Parent (uncredited)  See fewer,Members only,Hot Pursuit (2015)
Olga Wilhelmine Violinist (uncredited)  Violinist (uncredited)  See fewer,Members only,10 Cloverfield Lane (2016)
