Name,STARmeter,Known for
Ryan Jones Tommy  Tommy  See fewer,Members only,Khephir (2010)
Nathan Varnson Eric  Eric  See fewer,Members only,No Good Heroes (2016)
Colm O'Leary Ian's Father  Ian's Father  See fewer,Members only,The Comedy (2012)
Thomas Cruz Tristan  Tristan  See fewer,Members only,Hide Your Smiling Faces (2013)
Christina Starbuck Mother  Mother  See fewer,Members only,New Amsterdam (2008)
Chris Kies Father  Father  See fewer,Members only,A Little Closer (2011)
Andrew M. Chamberlain Blake  Blake  See fewer,Members only,Elementary (2012)
Clark Middleton Religious Man  Religious Man  See fewer,Members only,Sin City (2005)
Ivan Tomic Ian  Ian  See fewer,Members only,School Spirits (2011)
