Name,STARmeter,Known for
Viv Albertine D  D  See fewer,Members only,The Tomorrow People (1992)
Liam Gillick H  H  See fewer,Members only,A Guiding Light (2011)
Tom Hiddleston Estate Agent  Estate Agent  See fewer,Top 5000,The Avengers (2012)
Harry Kershaw Estate Agent  Estate Agent  See fewer,Members only,Skyfall (2012)
Mary Roscoe Neighbour Guest  Neighbour Guest  See fewer,Members only,Les Misérables (2012)
Carol McFadden Dina Breeze  Dina Breeze  See fewer,Members only,Aurangzeb (2013)
Chris Wilson Ambulance Paramedic  Ambulance Paramedic  See fewer,Members only,Mutant Chronicles (2008)
