Name,STARmeter,Known for
Ben Stiller Larry Daley / Laaa  Larry Daley / Laaa  See fewer,Top 5000,Zoolander (2001)
Robin Williams Teddy Roosevelt / Voice of Garuda  Teddy Roosevelt / Voice of Garuda  See fewer,Top 5000,Mrs. Doubtfire (1993)
Owen Wilson Jedediah  Jedediah  See fewer,Top 5000,The Royal Tenenbaums (2001)
Steve Coogan Octavius  Octavius  See fewer,Top 5000,Philomena (2013)
Ricky Gervais Dr. McPhee  Dr. McPhee  See fewer,Top 5000,The Office (2001)
Dan Stevens Sir Lancelot  Sir Lancelot  See fewer,Top 5000,Downton Abbey (2010)
Rebel Wilson Tilly  Tilly  See fewer,Top 5000,Pitch Perfect (2012)
Skyler Gisondo Nick Daley  Nick Daley  See fewer,Top 5000,Vacation (I) (2015)
Rami Malek Ahkmenrah  Ahkmenrah  See fewer,Top 500,Bohemian Rhapsody (2018)
Patrick Gallagher Attila  Attila  See fewer,Members only,Night at the Museum (2006)
Mizuo Peck Sacajawea  Sacajawea  See fewer,Members only,Night at the Museum (2006)
Ben Kingsley Merenkahre (Ahk's Father)  Merenkahre (Ahk's Father)  See fewer,Top 5000,Sexy Beast (2000)
Crystal the Monkey Dexter  Dexter  See fewer,Members only,The Hangover Part II (2011)
Dick Van Dyke Cecil  Cecil  See fewer,Top 5000,Mary Poppins (1964)
Mickey Rooney Gus  Gus  See fewer,Top 5000,It's a Mad Mad Mad Mad World (1963)
Bill Cobbs Reginald  Reginald  See fewer,Members only,Demolition Man (1993)
Andrea Martin Rose (Archivist)  Rose (Archivist)  See fewer,Members only,My Big Fat Greek Wedding (2002)
Rachael Harris Madeline Phelps  Madeline Phelps  See fewer,Top 5000,The Hangover (2009)
Matt Frewer Archibald Stanley  Archibald Stanley  See fewer,Top 5000,Watchmen (2009)
Brad Garrett Easter Island Head (voice)  Easter Island Head (voice)  See fewer,Top 5000,Everybody Loves Raymond (1996)
Regina Taufen NY Reporter (voice)  NY Reporter (voice)  See fewer,Members only,Finding Dory (2016)
Percy Hynes White C.J. Fredericks (as Percy Hynes-White)  C.J. Fredericks (as Percy Hynes-White)  See fewer,Members only,The Gifted (2017)
Brennan Elliott Robert Fredericks  Robert Fredericks  See fewer,Members only,UnREAL (2015)
Kerry van der Griend Neanderthal #1  Neanderthal #1  See fewer,Members only,Toke is Cheap (2019)
Matthew Harrison Neanderthal #2  Neanderthal #2  See fewer,Members only,Watchmen (2009)
Jody Racicot Neanderthal #3  Neanderthal #3  See fewer,Members only,Flash Gordon (2007)
Randy Lee Hun #1  Hun #1  See fewer,Members only,Rise of the Planet of the Apes (2011)
Darryl Quon Hun #2  Hun #2  See fewer,Members only,War for the Planet of the Apes (2017)
Paul Cheng Hun #3  Hun #3  See fewer,Members only,Deadpool 2 (2018)
Gerald Wong Hun #4  Hun #4  See fewer,Members only,"I, Robot (2004)"
Anjali Jay Shepseheret (Ahk's Mother)  Shepseheret (Ahk's Mother)  See fewer,Members only,Power Rangers (2017)
Matty Finochio Roman Sentry  Roman Sentry  See fewer,Members only,Freaks (2018)
Patrick Sabongui Amir  Amir  See fewer,Members only,Homeland (2011)
Amir M. Korangy 1938 Egyptian Worker (as Amir Korangy)  1938 Egyptian Worker (as Amir Korangy)  See fewer,Members only,Batman (1989)
Louriza Tronco Andrea (Nick's Party)  Andrea (Nick's Party)  See fewer,Members only,Zapped (2014)
Sophie Levy Sophie (Nick's Party)  Sophie (Nick's Party)  See fewer,Members only,Real Steel (2011)
Jin Sangha Egyptian High Priest  Egyptian High Priest  See fewer,Members only,Air (I) (2015)
James Neate Augustus Statue  Augustus Statue  See fewer,Members only,The Man in the High Castle (2015)
Judy Wilson Gala Patron  Gala Patron  See fewer,Members only,Mysteries at the Museum (2010)
Kishore Bhatt Theatre Patron (uncredited)  Theatre Patron (uncredited)  See fewer,Members only,Fan (I) (2016)
Dmitrious Bistrevsky Greek Statue (uncredited)  Greek Statue (uncredited)  See fewer,Members only,Alita: Battle Angel (2019)
Hannah Blamires Theatre Patron (uncredited)  Theatre Patron (uncredited)  See fewer,Members only,Jab Tak Hai Jaan (2012)
Sawyer Brashear Roland (uncredited)  Roland (uncredited)  See fewer,Members only,A Shallow Grave (2012)
Jill Buchanan Passerby (uncredited)  Passerby (uncredited)  See fewer,Members only,Doctor Strange (2016)
Arpit Chaudhary Theatre Patron (uncredited)  Theatre Patron (uncredited)  See fewer,Members only,Kuch Rang Pyar Ke Aise Bhi (2016)
Michael Patrick Denis Young Ahkmenrah's Father (uncredited)  Young Ahkmenrah's Father (uncredited)  See fewer,Members only,The Twilight Zone (2019)
Theo Devaney Lord Nelson (uncredited)  Lord Nelson (uncredited)  See fewer,Members only,Run (III) (2015)
Sian Doughty Theatre Patron (uncredited)  Theatre Patron (uncredited)  See fewer,Members only,The Scared of Death Society (2010)
John Dryden Mummy #2 (uncredited)  Mummy #2 (uncredited)  See fewer,Members only,Everything or Nothing (2007)
Alice Eve Alice Eve (uncredited)  Alice Eve (uncredited)  See fewer,Top 500,Before We Go (I) (2014)
Neve Gachev Theater Guest (uncredited)  Theater Guest (uncredited)  See fewer,Members only,Snow White and the Huntsman (2012)
Jordan Gardiner Wealthy Donor (uncredited)  Wealthy Donor (uncredited)  See fewer,Members only,The Tomorrow People (2013)
Ian Hawes Gala Photographer (uncredited)  Gala Photographer (uncredited)  See fewer,Members only,Altered Carbon (2018)
Matthew Hoglie Gala Attendee (uncredited)  Gala Attendee (uncredited)  See fewer,Members only,Bloody Knuckles (2014)
Nils Hognestad Cowboy (uncredited)  Cowboy (uncredited)  See fewer,Members only,The Eagle (2011)
Hugh Jackman Hugh Jackman (uncredited)  Hugh Jackman (uncredited)  See fewer,Top 5000,Les Misérables (2012)
Marcus G. Johnson Theatre Patron (uncredited)  Theatre Patron (uncredited)  See fewer,Members only,Dumbo (2019)
Todor Jordanov Museum Guard (uncredited)  Museum Guard (uncredited)  See fewer,Members only,Essex Boys: Law of Survival (2015)
Zivile Kaminskaite Gala Event Wealthy Donor (uncredited)  Gala Event Wealthy Donor (uncredited)  See fewer,Members only,Gods Behaving Badly (2013)
Sayed Kassem Assyrian (uncredited)  Assyrian (uncredited)  See fewer,Members only,Exodus: Gods and Kings (2014)
Demi Kazanis Theatre Patron (uncredited)  Theatre Patron (uncredited)  See fewer,Members only,Real Steel (2011)
Greg LaSalle Augustus Caesar (uncredited)  Augustus Caesar (uncredited)  See fewer,Members only,Deadpool (2016)
Shaun Lucas Museum Patron / Passerby (uncredited)  Museum Patron / Passerby (uncredited)  See fewer,Members only,Jab Tak Hai Jaan (2012)
Sid Man Passerby (uncredited)  Passerby (uncredited)  See fewer,Members only,Skyfall (2012)
Craig March NY Cop #2 (uncredited)  NY Cop #2 (uncredited)  See fewer,Members only,Supernatural (2005)
Stuart Matthews Theatre Patron (uncredited)  Theatre Patron (uncredited)  See fewer,Members only,Guardians of the Galaxy (2014)
Martyn Mayger Action Car Driver (uncredited)  Action Car Driver (uncredited)  See fewer,Members only,Outside Bet (2012)
Doris McCarthy Wealthy Donor (uncredited)  Wealthy Donor (uncredited)  See fewer,Members only,The Intern (I) (2015)
Pete Meads Passerby (uncredited)  Passerby (uncredited)  See fewer,Members only,The Brothers Grimsby (2016)
Keith Milner Theatre Patron (uncredited)  Theatre Patron (uncredited)  See fewer,Members only,Strippers vs Werewolves (2012)
James M.L. Muller Theatre Patron (uncredited)  Theatre Patron (uncredited)  See fewer,Members only,The Flood (2019)
Will Parker Bus Passenger (uncredited)  Bus Passenger (uncredited)  See fewer,Members only,Bullock the Bruiser (2017)
Dhruv Patel Hun (uncredited)  Hun (uncredited)  See fewer,Members only,Watchmen (2019)
Leah Perkins BMW Driver (uncredited)  BMW Driver (uncredited)  See fewer,Members only,1 - Nenokkadine (2014)
Jacqueline Ryan Wealthy Donor (uncredited)  Wealthy Donor (uncredited)  See fewer,Members only,For a Few Lousy Dollars (1995)
Andrea Sandell Passerby (uncredited)  Passerby (uncredited)  See fewer,Members only,I Scream on the Beach!
Steve Saunders Passerby (uncredited)  Passerby (uncredited)  See fewer,Members only,The Aeronauts (2019)
Harold Smith Roman Sentry (uncredited)  Roman Sentry (uncredited)  See fewer,Members only,The Doors: Live at the Bowl '68 (2012)
Orpheus Spiliotopoulos Passerby (uncredited)  Passerby (uncredited)  See fewer,Members only,Rock Band Vs Vampires (2017)
Celeste White Steele Theater Attendee (uncredited)  Theater Attendee (uncredited)  See fewer,Members only,Despicable Me 3 (2017)
Ella Olivia Stiller Child on London Bus (uncredited)  Child on London Bus (uncredited)  See fewer,Members only,Megamind (2010)
Quinn Dempsey Stiller Child on London Bus (uncredited)  Child on London Bus (uncredited)  See fewer,Members only,Megamind (2010)
Winson Ting Man (uncredited)  Man (uncredited)  See fewer,Members only,Rogue One: A Star Wars Story (2016)
Stefano Villabona Gala Photographer (uncredited)  Gala Photographer (uncredited)  See fewer,Members only,Smash (2012)
Seth Whittaker Museum Guard #2 (uncredited)  Museum Guard #2 (uncredited)  See fewer,Members only,Crash Pad (I) (2017)
Buppha Witt Passerby (uncredited)  Passerby (uncredited)  See fewer,Members only,The Existence
Chris Woods Theatre Patron (uncredited)  Theatre Patron (uncredited)  See fewer,Members only,Contact 4:12
Brian Woodward Theatre Patron (uncredited)  Theatre Patron (uncredited)  See fewer,Members only,The Province (2014)
