Name,STARmeter,Known for
Robert Redford Bill Bryson  Bill Bryson  See fewer,Top 5000,The Natural (1984)
Nick Nolte Stephen Katz  Stephen Katz  See fewer,Top 5000,Warrior (2011)
Emma Thompson Catherine Bryson  Catherine Bryson  See fewer,Top 5000,Sense and Sensibility (1995)
Mary Steenburgen Jeannie  Jeannie  See fewer,Top 5000,Last Vegas (2013)
Nick Offerman REI Dave  REI Dave  See fewer,Top 5000,Parks and Recreation (2009)
Kristen Schaal Mary Ellen  Mary Ellen  See fewer,Top 5000,Gravity Falls (2012)
R. Keith Harris Sam Bryson  Sam Bryson  See fewer,Members only,The Walking Dead (2010)
Randall Newsome TV Host  TV Host  See fewer,Members only,TURN: Washington's Spies (2014)
Hayley Lovitt Donna  Donna  See fewer,Members only,The Gifted (2017)
Linds Edwards Darren  Darren  See fewer,Members only,Lethal Weapon (2016)
Susan McPhail Beulah  Beulah  See fewer,Members only,The Peanut Butter Falcon (2019)
Andrew Vogel Young Hiker #1  Young Hiker #1  See fewer,Members only,Under the Dome (2013)
Derek Krantz Young Hiker #2  Young Hiker #2  See fewer,Members only,Nashville (2012)
Gaia Wise Becca  Becca  See fewer,Members only,Last Chance Harvey (2008)
Tucker Meek Grandson  Grandson  See fewer,Members only,Little (I) (2019)
Chandler Head Granddaughter  Granddaughter  See fewer,Members only,The Glass Castle (2017)
Sandra Ellis Lafferty Widow (as Sandra Lafferty)  Widow (as Sandra Lafferty)  See fewer,Members only,The Hunger Games (2012)
John Schmedes Gene  Gene  See fewer,Members only,Devious Maids (2013)
Valentin Almendarez Funeral Guest  Funeral Guest  See fewer,Members only,License to Wed (2007)
Danny Vinson Georgia Cab Driver  Georgia Cab Driver  See fewer,Members only,Leatherheads (2008)
Valerie Payton Waitress Raynette  Waitress Raynette  See fewer,Members only,What to Expect When You're Expecting (2012)
Stephanie Astalos-Jones Georgia Mountain Waitress  Georgia Mountain Waitress  See fewer,Members only,Dirty Grandpa (2016)
Kevin Harrison Southbound Hiker  Southbound Hiker  See fewer,Members only,Kill the Messenger (2014)
Bridget Gethins Campground Jensine  Campground Jensine  See fewer,Members only,Loving (2016)
Alex Van Bunkhouse Peter  Bunkhouse Peter  See fewer,Members only,RoboCop 3 (1993)
John Kap Beulah's Husband  Beulah's Husband  See fewer,Members only,Slaw (2017)
Mimi Gould Jeannie's Mother  Jeannie's Mother  See fewer,Members only,Last Vegas (2013)
Rowan Bousaid Rental Agent  Rental Agent  See fewer,Members only,Manhunt: Unabomber (2017)
Njema Williams Trail Head Taxi Driver  Trail Head Taxi Driver  See fewer,Members only,Masterminds (I) (2016)
Sue-Lynn Ansari Hiker (uncredited)  Hiker (uncredited)  See fewer,Members only,Star Trek (2009)
Perry Ball Driver (uncredited)  Driver (uncredited)  See fewer,Members only,Displaced
Esther Cason Restaurant Patron (uncredited)  Restaurant Patron (uncredited)  See fewer,Members only,Practice What You Preach (2016)
Tony Caudill Hiker in Bunker (uncredited)  Hiker in Bunker (uncredited)  See fewer,Members only,A Stone's Throw Movie (2020)
Marshall Choka Restaurant Patron (uncredited)  Restaurant Patron (uncredited)  See fewer,Members only,Goosebumps (2015)
Marcy Conway Hiker in Bunk House (uncredited)  Hiker in Bunk House (uncredited)  See fewer,Members only,The Hunger Games: Mockingjay - Part 1 (2014)
Fred Galle News Anchor (uncredited)  News Anchor (uncredited)  See fewer,Members only,Anchorman 2: The Legend Continues (2013)
Katie Groshong Lesbian #1 (uncredited)  Lesbian #1 (uncredited)  See fewer,Members only,A Measure of the Sin (2013)
Roger A. Harrison Trail Hiker (uncredited)  Trail Hiker (uncredited)  See fewer,Members only,3 Days Till Darkness
Walter Hendrix III Laundry Patron (uncredited)  Laundry Patron (uncredited)  See fewer,Members only,This Time It's Reel (2014)
Leslie Kimbell Attorney (uncredited)  Attorney (uncredited)  See fewer,Members only,Bring Me a Dream
Donald J. Koko TV Production Tech (uncredited)  TV Production Tech (uncredited)  See fewer,Members only,The Road to Rachel (2011)
Hayley H. Long Hiker in Bunk House (uncredited)  Hiker in Bunk House (uncredited)  See fewer,Members only,Northfield (2016)
Dylan Lowe Little Acorn #1 (uncredited)  Little Acorn #1 (uncredited)  See fewer,Members only,Self/less (2015)
Duke McNeil Park Ranger (uncredited)  Park Ranger (uncredited)  See fewer,Members only,Red Zone (2014)
Dan Michael Bunk House Hiker (uncredited)  Bunk House Hiker (uncredited)  See fewer,Members only,Ride Along 2 (2016)
William J. Mode Confederate Reenactor-Cafe Patron (uncredited)  Confederate Reenactor-Cafe Patron (uncredited)  See fewer,Members only,Into the Wilderness (I)
Chrystee Pharris Ticket Agent (uncredited)  Ticket Agent (uncredited)  See fewer,Members only,Scrubs (2001)
Speir Rahn Restaurant Customer (uncredited)  Restaurant Customer (uncredited)  See fewer,Members only,Kabhi Alvida Naa Kehna (2006)
Eric Elijah Rogers Little Acorn #3 (uncredited)  Little Acorn #3 (uncredited)  See fewer,Members only,Homicide Hunter: Lt. Joe Kenda (2011)
Joel Rogers Funeral Director (uncredited)  Funeral Director (uncredited)  See fewer,Members only,Rings (2017)
Patti Schellhaas Restaurant Diner (uncredited)  Restaurant Diner (uncredited)  See fewer,Members only,Captain America: Civil War (2016)
Kai Schmoll Tweed Jacket (uncredited)  Tweed Jacket (uncredited)  See fewer,Members only,Kill the Messenger (2014)
Andrew Wicklum Little Acorn #2 (uncredited)  Little Acorn #2 (uncredited)  See fewer,Members only,The Substitute Spy (2016)
Erick Wofford Day Hiker (uncredited)  Day Hiker (uncredited)  See fewer,Members only,The Hunger Games: Mockingjay - Part 1 (2014)
Rachel Woodhouse Lesbian #2 (uncredited)  Lesbian #2 (uncredited)  See fewer,Members only,Door to Door (2013)
