Name,STARmeter,Known for
Josh Charles Bruce Brooks  Bruce Brooks  See fewer,Top 5000,Dead Poets Society (1989)
Skylar Gaertner Eli Brooks  Eli Brooks  See fewer,Members only,Ozark (2017)
Shayne Coleman Janey Brooks  Janey Brooks  See fewer,Members only,Silencio (I) (2018)
Sarah Silverman Laney Brooks  Laney Brooks  See fewer,Top 5000,Wreck-It Ralph (2012)
Nick Taylor Guard  Guard  See fewer,Members only,Paradise East (2010)
Mia Barron Susan  Susan  See fewer,Members only,Righteous Kill (2008)
Thomas Sadoski Donny  Donny  See fewer,Members only,Loser (2000)
Sean Reda Henry  Henry  See fewer,Members only,Les Miserables: The Broadway Musical (2014)
Cynthia Darlow Mrs. Kosinski  Mrs. Kosinski  See fewer,Members only,The Thomas Crown Affair (1999)
Kristin Griffith Nurse Pauline  Nurse Pauline  See fewer,Members only,Cold in July (2014)
Terry Kinney Dr. Page  Dr. Page  See fewer,Members only,Oz (1997)
Clark Jackson Mr. Odesky  Mr. Odesky  See fewer,Members only,Ghosttown Ballers (2005)
Brian Koppelman David Blackman  David Blackman  See fewer,Members only,Runaway Jury (2003)
Emma Ishta Katrina  Katrina  See fewer,Members only,Stitchers (2015)
Oona Laurence Daisy  Daisy  See fewer,Members only,Pete's Dragon (2016)
Chris Sarandon Roger  Roger  See fewer,Top 5000,Fright Night (1985)
Mike Sharits Bartender  Bartender  See fewer,Members only,Rosy (2018)
Mia Katigbak Mrs. Mattingly  Mrs. Mattingly  See fewer,Members only,Chicago P.D. (2014)
Gregory Dann Quaker State  Quaker State  See fewer,Members only,Michael Clayton (2007)
Kevin Abernethy Restaurant Patron (uncredited)  Restaurant Patron (uncredited)  See fewer,Members only,What Happened Last Night (2016)
Sidné Anderson Pauline (uncredited)  Pauline (uncredited)  See fewer,Members only,Blue Ruin (2013)
Linda Blackstock Mom in Parking Lot (uncredited)  Mom in Parking Lot (uncredited)  See fewer,Members only,Those People (2010)
Luke Bogdanski Chopstick Kid (uncredited)  Chopstick Kid (uncredited)  See fewer,Members only,One Bad Choice (2015)
Bryan Burton Teenager (uncredited)  Teenager (uncredited)  See fewer,Members only,The Night Of (2016)
Sarah Dulat Sienna (uncredited)  Sienna (uncredited)  See fewer,Members only,Kilimanjaro (I) (2013)
Donovan Edmondson Toy Store Kid (uncredited)  Toy Store Kid (uncredited)  See fewer,Members only,What Happened Last Night (2016)
Jordan Edmondson Toy Store Kid (uncredited)  Toy Store Kid (uncredited)  See fewer,Members only,What Happened Last Night (2016)
Karen Edmondson Toy Store Patron (uncredited)  Toy Store Patron (uncredited)  See fewer,Members only,What Happened Last Night (2016)
Maggie Elizabeth Cubby Fraggle Bear Bingo (uncredited)  Bingo (uncredited)  See fewer,Members only,At the End of Her Rope (2009)
Joseph Galizio Jr. Father (uncredited)  Father (uncredited)  See fewer,Members only,Long Island Volunteer (2017)
Isaac Galizio Student (uncredited)  Student (uncredited)  See fewer,Members only,Tom's Dilemma (2016)
Juliana Guggino Student (uncredited)  Student (uncredited)  See fewer,Members only,The Blacklist (2013)
Kaitlyn T. Junas Piano Player (uncredited)  Piano Player (uncredited)  See fewer,Members only,Broken Chains (2017)
Stephanie Katz Restaurant Patron (uncredited)  Restaurant Patron (uncredited)  See fewer,Members only,Wolves (I) (2016)
Colton Kraese Piano Recital Child (uncredited)  Piano Recital Child (uncredited)  See fewer,Members only,The Blacklist (2013)
Mary Beth Kraese Piano Recital Parent (uncredited)  Piano Recital Parent (uncredited)  See fewer,Members only,"Rich Boy, Rich Girl (2018)"
Lex LeBlanc Mom at school (uncredited)  Mom at school (uncredited)  See fewer,Members only,The Arrangement (II) (2017)
Billy Magnussen Zach (uncredited)  Zach (uncredited)  See fewer,Top 5000,Into the Woods (2014)
Ailysch Markowitz Rehab Visitor (uncredited)  Rehab Visitor (uncredited)  See fewer,Members only,What Happened Last Night (2016)
Amie Markowitz Piano Recital Parent (uncredited)  Piano Recital Parent (uncredited)  See fewer,Members only,What Happened Last Night (2016)
Craig Markowitz Rehab Patient (uncredited)  Rehab Patient (uncredited)  See fewer,Members only,"Rich Boy, Rich Girl (2018)"
Juliette Marotta Teacher (uncredited)  Teacher (uncredited)  See fewer,Members only,Wolves (I) (2016)
Kirsty Meier Piano Recital Child (uncredited)  Piano Recital Child (uncredited)  See fewer,Members only,Deadly Sins (2012)
Kurt Meier Piano Recital Child (uncredited)  Piano Recital Child (uncredited)  See fewer,Members only,Addiction: A 60's Love Story (2015)
Thomas Murphy Sr. Teacher (uncredited)  Teacher (uncredited)  See fewer,Members only,Good Bones (II) (2017)
Alexis Eileen Murphy Student (uncredited)  Student (uncredited)  See fewer,Members only,Boardwalk Empire (2010)
Annmarie Murphy Jessica (uncredited)  Jessica (uncredited)  See fewer,Members only,Good Bones (II) (2017)
Ryan J. Murphy Student (uncredited)  Student (uncredited)  See fewer,Members only,I Smile Back (2015)
Jack Romond Student (uncredited)  Student (uncredited)  See fewer,Members only,Hepburn (2014)
Kiera Romond Student (uncredited)  Student (uncredited)  See fewer,Members only,Deadly Sins (2012)
Kristen Romond Mother (uncredited)  Mother (uncredited)  See fewer,Members only,Amish Haunting (2014)
Judy San Roman Teacher (uncredited)  Teacher (uncredited)  See fewer,Members only,FAIR MARKET VALUE (2019)
