Name,STARmeter,Known for
Jayson White Texas Tech Sideline Football Player (uncredited)  Texas Tech Sideline Football Player (uncredited)  See fewer,Members only,Opera of Cruelty (2017)
Daniel Whittle California Coach (uncredited)  California Coach (uncredited)  See fewer,Members only,Choices: A Documentary (2014)
Brett Wilson Jr. Football Player (uncredited)  Football Player (uncredited)  See fewer,Members only,Zombie Reign: Revelation (2016)
Brett Wilson Sr. Football Fan (uncredited)  Football Fan (uncredited)  See fewer,Members only,Starmaker (I) (2017)
Brandy Wilson Football Fan (uncredited)  Football Fan (uncredited)  See fewer,Members only,Praying Mantis (2017)
Pamela A. Yarborough 1960s Texas Faculty (uncredited)  1960s Texas Faculty (uncredited)  See fewer,Members only,Zatanna: Fear of Puppetts
Robert T. Yarborough 1960s Texas Faculty (uncredited)  1960s Texas Faculty (uncredited)  See fewer,Members only,Terror Birds (2016)
Sydney G. Yarborough 1960s Texas Student (uncredited)  1960s Texas Student (uncredited)  See fewer,Members only,From Dusk Till Dawn: The Series (2014)
Emily Yates Wheat Ridge Cheerleader / UT Student / Football Fan (uncredited)  Wheat Ridge Cheerleader / UT Student / Football Fan (uncredited)  See fewer,Members only,Believe Me (2014)
Tony Lee Yates Texas Tech Coach (uncredited)  Texas Tech Coach (uncredited)  See fewer,Members only,Left (I) (2017)
Steve Young Football Fan (uncredited)  Football Fan (uncredited)  See fewer,Members only,11.22.63 (2016)
Matthew Zapata Danny Lester (uncredited)  Danny Lester (uncredited)  See fewer,Members only,All We Have Is Now
Eric Zettina Randy Woodward (uncredited)  Randy Woodward (uncredited)  See fewer,Members only,Cycle (X) (2014)
