Name,STARmeter,Known for
Jennifer Lawrence Katniss Everdeen  Katniss Everdeen  See fewer,75,The Hunger Games (2012)
Josh Hutcherson Peeta Mellark  Peeta Mellark  See fewer,Top 5000,The Hunger Games (2012)
Liam Hemsworth Gale Hawthorne  Gale Hawthorne  See fewer,Top 5000,The Hunger Games (2012)
Woody Harrelson Haymitch Abernathy  Haymitch Abernathy  See fewer,Top 500,True Detective (2014)
Donald Sutherland President Snow  President Snow  See fewer,Top 5000,The Hunger Games: Catching Fire (2013)
Philip Seymour Hoffman Plutarch Heavensbee  Plutarch Heavensbee  See fewer,Top 5000,The Master (2012)
Julianne Moore President Alma Coin  President Alma Coin  See fewer,Top 5000,Still Alice (2014)
Willow Shields Primrose Everdeen  Primrose Everdeen  See fewer,Top 5000,The Hunger Games (2012)
Sam Claflin Finnick Odair  Finnick Odair  See fewer,Top 500,The Hunger Games: Catching Fire (2013)
Elizabeth Banks Effie Trinket  Effie Trinket  See fewer,Top 500,The Hunger Games (2012)
Mahershala Ali Boggs  Boggs  See fewer,Top 5000,House of Cards (2013)
Jena Malone Johanna Mason  Johanna Mason  See fewer,Top 5000,Contact (1997)
Jeffrey Wright Beetee  Beetee  See fewer,Top 5000,Shaft (2000)
Paula Malcomson Katniss' Mother  Katniss' Mother  See fewer,Top 5000,The Hunger Games (2012)
Stanley Tucci Caesar Flickerman  Caesar Flickerman  See fewer,Top 5000,Big Night (1996)
Natalie Dormer Cressida  Cressida  See fewer,Top 500,Game of Thrones (2011)
Evan Ross Messalla  Messalla  See fewer,Members only,The Hunger Games: Mockingjay - Part 1 (2014)
Elden Henson Pollux  Pollux  See fewer,Top 5000,Daredevil (2015)
Wes Chatham Castor  Castor  See fewer,Top 5000,The Hunger Games: Mockingjay - Part 1 (2014)
Eugenie Bondurant Tigris  Tigris  See fewer,Members only,Fear of Rain
Sarita Choudhury Egeria  Egeria  See fewer,Top 5000,Lady in the Water (2006)
Stef Dawson Annie Cresta  Annie Cresta  See fewer,Members only,The Hunger Games: Mockingjay - Part 1 (2014)
Meta Golding Enobaria  Enobaria  See fewer,Members only,Surrogates (2009)
Patina Miller Commander Paylor  Commander Paylor  See fewer,Members only,The Hunger Games: Mockingjay - Part 1 (2014)
Omid Abtahi Homes  Homes  See fewer,Members only,Brothers (I) (2009)
Joe Chrest Mitchell  Mitchell  See fewer,Members only,Stranger Things (2016)
Michelle Forbes Lieutenant Jackson  Lieutenant Jackson  See fewer,Top 5000,Kalifornia (1993)
Misty Ormiston Leeg #1  Leeg #1  See fewer,Members only,Meet the Spartans (2008)
Kim Ormiston Leeg #2  Leeg #2  See fewer,Members only,Meet the Spartans (2008)
Gwendoline Christie Commander Lyme  Commander Lyme  See fewer,Top 5000,Star Wars: Episode VII - The Force Awakens (2015)
Robert Knepper Antonius  Antonius  See fewer,Top 5000,Prison Break (2005)
Mark Jeffrey Miller D4 Officiant  D4 Officiant  See fewer,Members only,The Patriot (2000)
April Grace Doctor Aurelius  Doctor Aurelius  See fewer,Members only,Magnolia (1999)
David Hallyday Greenhouse Guard #1  Greenhouse Guard #1  See fewer,Members only,Eddie and the Cruisers II: Eddie Lives! (1989)
Linds Edwards Injured Career  Injured Career  See fewer,Members only,Lethal Weapon (2016)
Thomas Blake Jr. Rebel Sniper  Rebel Sniper  See fewer,Members only,Allegiant (2016)
Cameron MacConomy Pugnax  Pugnax  See fewer,Members only,Red Sparrow (2018)
Desmond Phillips Commander of D5  Commander of D5  See fewer,Members only,Let's Be Cops (2014)
Elle Graham Girl in Lemon Yellow Coat  Girl in Lemon Yellow Coat  See fewer,Members only,Swamp Thing (2019)
Lacy Dmitriew Rebel Nurse  Rebel Nurse  See fewer,Members only,Dust (IX) (2018)
Kate Rachesky Capitol Girl  Capitol Girl  See fewer,Members only,Insurgent (2015)
Phillip Troy Linger Katniss's Father  Katniss's Father  See fewer,Members only,The Hunger Games (2012)
Bear Lawrence Everdeen Child #1  Everdeen Child #1  See fewer,Members only,Pawns No More: Making the Hunger Games: Mockingjay Part 2 (2016)
Theodore Lawrence Everdeen Child #2  Everdeen Child #2  See fewer,Members only,Pawns No More: Making the Hunger Games: Mockingjay Part 2 (2016)
Jasmine Ahnie District 8 Hospital Patient (uncredited)  District 8 Hospital Patient (uncredited)  See fewer,Members only,Cookie Crumbles (2019)
Cammy Aller Capital Women (uncredited)  Capital Women (uncredited)  See fewer,Members only,
Andrew Almanza Guy (uncredited)  Guy (uncredited)  See fewer,Members only,Super High Me (2007)
Evan D. Anderson Capitol Citizen (uncredited)  Capitol Citizen (uncredited)  See fewer,Members only,Stages (I) (2018)
Sue-Lynn Ansari District 8 (uncredited)  District 8 (uncredited)  See fewer,Members only,Star Trek (2009)
Phil Armijo Capital Citizen (uncredited)  Capital Citizen (uncredited)  See fewer,Members only,Burn Notice (2007)
De'Marco Arrington Rebel Kid (uncredited)  Rebel Kid (uncredited)  See fewer,Members only,Catalyst (I) (2016)
Trevor Bagwell Capitol Kid (uncredited)  Capitol Kid (uncredited)  See fewer,Members only,A Free Bird (2014)
Jonathan Billions Capitol Boy (uncredited)  Capitol Boy (uncredited)  See fewer,Members only,My Father Die (2016)
Samuel L. Billions Capitol Boy (uncredited)  Capitol Boy (uncredited)  See fewer,Members only,Fire Summer (2018)
William David Billions Capitol Boy (uncredited)  Capitol Boy (uncredited)  See fewer,Members only,Fire Summer (2018)
Jae Bireley Capitol Citizen (uncredited)  Capitol Citizen (uncredited)  See fewer,Members only,Would? (2013)
Sarah Blackman Mom of Girl in Yellow Coat (uncredited)  Mom of Girl in Yellow Coat (uncredited)  See fewer,Members only,Dumb and Dumberer: When Harry Met Lloyd (2003)
Austin Bollinger Military Rebel (uncredited)  Military Rebel (uncredited)  See fewer,Members only,Bad Boys for Life (2020)
Milena Bolouri District 7 Rebel (uncredited)  District 7 Rebel (uncredited)  See fewer,Members only,Captain America: Civil War (2016)
Bradley Bowen C151 Capitol Resident (uncredited)  C151 Capitol Resident (uncredited)  See fewer,Members only,The Flight
Dante Briggins Peacekeeper (uncredited)  Peacekeeper (uncredited)  See fewer,Members only,Star Wars: Episode VII - The Force Awakens (2015)
Cameron Brinkman District 5 Rebel (uncredited)  District 5 Rebel (uncredited)  See fewer,Members only,La La Land (I) (2016)
DuRa Brown District 13 Soldier (uncredited)  District 13 Soldier (uncredited)  See fewer,Members only,War-Angel: The Awakening
Stephen Mackenzie Brown District 13 Soldier (uncredited)  District 13 Soldier (uncredited)  See fewer,Members only,Education in Love (2018)
Alyssa Riley Burrell Capitol Girl (uncredited)  Capitol Girl (uncredited)  See fewer,Members only,Stay with Me (IV) (2015)
Robert Byron District 5 Rebel (uncredited)  District 5 Rebel (uncredited)  See fewer,Members only,Winners & Losers (2011)
Phil Cappadora Citizen B (uncredited)  Citizen B (uncredited)  See fewer,Members only,Good Time (2017)
John M. Carpenter Peacekeeper / District 13 Soldier (uncredited)  Peacekeeper / District 13 Soldier (uncredited)  See fewer,Members only,Teachers (2013)
Esther Cason Capital (uncredited)  Capital (uncredited)  See fewer,Members only,Practice What You Preach (2016)
Sandhya Chandel District 13 Citizen (uncredited)  District 13 Citizen (uncredited)  See fewer,Members only,Cleanland (2014)
Melissa Chandler Capitol Citizen (uncredited)  Capitol Citizen (uncredited)  See fewer,Members only,Insurgent (2015)
Marshall Choka District 13 Citizen (uncredited)  District 13 Citizen (uncredited)  See fewer,Members only,Goosebumps (2015)
Charles William Cook Capitol Citizen (uncredited)  Capitol Citizen (uncredited)  See fewer,Members only,Sick People (2015)
Kirk Crenshaw Peacekeeper (uncredited)  Peacekeeper (uncredited)  See fewer,Members only,The Prince (I) (2014)
Greg Crews Peacekeeper (uncredited)  Peacekeeper (uncredited)  See fewer,Members only,Dark Wasteland (2017)
Christopher De Stefano District 13 Rebel (uncredited)  District 13 Rebel (uncredited)  See fewer,Members only,Paper Towns (2015)
Courtney Dietz Capitol Citizen (uncredited)  Capitol Citizen (uncredited)  See fewer,Members only,Hell Fest (2018)
Francis Dobrisky District 7 Rebel (uncredited)  District 7 Rebel (uncredited)  See fewer,Members only,Between Rock and a Hard Place (2015)
Chandler Dollahite Capitol Citizen (uncredited)  Capitol Citizen (uncredited)  See fewer,Members only,Endash (2015)
Mark Casimir Dyniewicz Jr. District 5 Rebel (uncredited)  District 5 Rebel (uncredited)  See fewer,Members only,Vermont Street
Jacklyn Edney District 13 Citizen (uncredited)  District 13 Citizen (uncredited)  See fewer,Members only,Sacrifices (2014)
Michael Entrekin Capitol Citizen (uncredited)  Capitol Citizen (uncredited)  See fewer,Members only,Woodlawn (2015)
Jason Lee Erickson Lumberjack Rebel (uncredited)  Lumberjack Rebel (uncredited)  See fewer,Members only,Sorice (2016)
Ricardo Ewert Worker (uncredited)  Worker (uncredited)  See fewer,Members only,American Renegades (2017)
Izzy Fenech Capitol Kid (uncredited)  Capitol Kid (uncredited)  See fewer,Members only,The Accountant (2016)
Livi Fenech Capital Citizen (uncredited)  Capital Citizen (uncredited)  See fewer,Members only,Creature Feature (2015)
Brittany Foti Capital Citizen (uncredited)  Capital Citizen (uncredited)  See fewer,Members only,Marley (2018)
Micky Francis Capitol Citizen (uncredited)  Capitol Citizen (uncredited)  See fewer,Members only,Stand Your Ground (2013)
William Frasca Capitol Aristocrat (uncredited)  Capitol Aristocrat (uncredited)  See fewer,Members only,Drag Him Out! (2013)
Marco Fuller Capitol Citizen (uncredited)  Capitol Citizen (uncredited)  See fewer,Members only,The Son (2017)
Jennifer Joy Funkhouser Capitol Citizen (uncredited)  Capitol Citizen (uncredited)  See fewer,Members only,Hangman (III) (2018)
Tiffany Furbee Capital Citizen (uncredited)  Capital Citizen (uncredited)  See fewer,Members only,Pitch Perfect 3 (2017)
Fred Galle District 13 Lt. General (uncredited)  District 13 Lt. General (uncredited)  See fewer,Members only,Anchorman 2: The Legend Continues (2013)
Joshua Geckles District 5 Rebel (uncredited)  District 5 Rebel (uncredited)  See fewer,Members only,Not Fan Enough (2014)
Jeff Glover Lumberjack (uncredited)  Lumberjack (uncredited)  See fewer,Members only,The Hunger Games: Catching Fire (2013)
Curtis Gordon District 13 Citizen (uncredited)  District 13 Citizen (uncredited)  See fewer,Members only,The Haves and the Have Nots (2013)
Danny M. Gray District 13 Command Center (uncredited)  District 13 Command Center (uncredited)  See fewer,Members only,Lila & Eve (2015)
Roderick Green District 11 Military Rebel (uncredited)  District 11 Military Rebel (uncredited)  See fewer,Members only,Death Note (2016)
Katie Hartmann Capitol Resident (uncredited)  Capitol Resident (uncredited)  See fewer,Members only,Rainy Carolina (2018)
Grace Hartsfield Capitol Citizen (uncredited)  Capitol Citizen (uncredited)  See fewer,Members only,Wtf!? (2015)
Robert Hatch District 13 Citizen (uncredited)  District 13 Citizen (uncredited)  See fewer,Members only,First Man (2018)
Tayloe Hatch District 13 Citizen (uncredited)  District 13 Citizen (uncredited)  See fewer,Members only,A Pizza Story (2008)
Roy Hawkins Jr. Peacekeeper (uncredited)  Peacekeeper (uncredited)  See fewer,Members only,Brave New Jersey (2016)
Matt Hay District 5 Rebel (uncredited)  District 5 Rebel (uncredited)  See fewer,Members only,The Reel Review (2017)
Rory Healy Military Rebel (uncredited)  Military Rebel (uncredited)  See fewer,Members only,Goosebumps (2015)
Lauren Henneberg District 13 Citizen (uncredited)  District 13 Citizen (uncredited)  See fewer,Members only,Lauren's Legends of the Hidden Temple Game Show (2013)
Sarah Turner Holland District 13 Citizen (uncredited)  District 13 Citizen (uncredited)  See fewer,Members only,Remnant 13
Sean Householder Power Rebel (uncredited)  Power Rebel (uncredited)  See fewer,Members only,First Daughter (2004)
Raiden Integra District 11 Rebel (uncredited)  District 11 Rebel (uncredited)  See fewer,Members only,Tell No One (II)
John Jaret Timpani Drummer (uncredited)  Timpani Drummer (uncredited)  See fewer,Members only,The Equestrian (2015)
Clay Jeffries District 13 Citizen (uncredited)  District 13 Citizen (uncredited)  See fewer,Members only,The Hunger Games: Mockingjay - Part 1 (2014)
Richard Jones Citizen of the Capitol (uncredited)  Citizen of the Capitol (uncredited)  See fewer,Members only,Dirty Grandpa (2016)
Stephanie Tyler Jones Citizen Runner (uncredited)  Citizen Runner (uncredited)  See fewer,Members only,Spider-Man (2018)
Toby Jones Claudius Templesmith (uncredited)  Claudius Templesmith (uncredited)  See fewer,Top 5000,Tinker Tailor Soldier Spy (2011)
Hannah Keeterle Capitol Citizen (uncredited)  Capitol Citizen (uncredited)  See fewer,Members only,The Accidental President (2014)
Cameron James Khan District 13 Rebel (uncredited)  District 13 Rebel (uncredited)  See fewer,Members only,Musical Salvation (2017)
Jesse Kindred District 13 Systems Operator (uncredited)  District 13 Systems Operator (uncredited)  See fewer,Members only,The Fate of the Furious (2017)
King Capitol Aristocrat (uncredited)  Capitol Aristocrat (uncredited)  See fewer,Members only,The Dark Knight Rises (2012)
Nathan J Kress Lumberjack Rebel (uncredited)  Lumberjack Rebel (uncredited)  See fewer,Members only,The Chickasaw Rancher
Levi Krevinghaus District 7 Rebel Guard (uncredited)  District 7 Rebel Guard (uncredited)  See fewer,Members only,ATL Homicide (2018)
Kenley Krey Capitol Kid (uncredited)  Capitol Kid (uncredited)  See fewer,Members only,The Broken Ballerina (2013)
Evlin Lake Capitol Woman 1 (uncredited)  Capitol Woman 1 (uncredited)  See fewer,Members only,G.I. Joe: Retaliation (2013)
Roy Larsen Capitol Citizen (uncredited)  Capitol Citizen (uncredited)  See fewer,Members only,Warm Springs (2005)
Tobias Lauterberg Extra (uncredited)  Extra (uncredited)  See fewer,Members only,Valkyrie (2008)
Rachel Lawley District 7 Rebel (uncredited)  District 7 Rebel (uncredited)  See fewer,Members only,Halfway to Hell (2018)
David London District 13 (uncredited)  District 13 (uncredited)  See fewer,Members only,Bird of Prey (III) (2015)
Jean Christophe Loustau Peacekeeper (uncredited)  Peacekeeper (uncredited)  See fewer,Members only,Covert Affairs (2010)
Cecil Love Hovercraft Pilot (uncredited)  Hovercraft Pilot (uncredited)  See fewer,Members only,"I, Tonya (2017)"
Luke Loveless Capital Kid (uncredited)  Capital Kid (uncredited)  See fewer,Members only,The Highwaymen (2019)
Jasmine Lowe Capitol Woman / District 8 Rebel (uncredited)  Capitol Woman / District 8 Rebel (uncredited)  See fewer,Members only,My Life Alternative
Jason Lyke Capital (uncredited)  Capital (uncredited)  See fewer,Members only,At Cloverlift Lane (2015)
Corey Maher District 13 General Bogg's Guard (uncredited)  District 13 General Bogg's Guard (uncredited)  See fewer,Members only,House of Cards (2013)
"Agnes Mai Combat Commander, District 13 (uncredited)  Combat Commander, District 13 (uncredited)  See fewer",Members only,Who Am I (2014)
Lucky Mangione District 13 Rebel (uncredited)  District 13 Rebel (uncredited)  See fewer,Members only,Goosebumps (2015)
Kenneth Manos Bogg's Security (uncredited)  Bogg's Security (uncredited)  See fewer,Members only,Sabotage (2014)
Dominyck McCargo District 11 Rebel (uncredited)  District 11 Rebel (uncredited)  See fewer,Members only,American Crime (2015)
Trey McGriff Capitol Resident (uncredited)  Capitol Resident (uncredited)  See fewer,Members only,Cobra Kai (2018)
Kayla Moore Capitol Citizen (uncredited)  Capitol Citizen (uncredited)  See fewer,Members only,Vacation (I) (2015)
Roger Neal Capitol Citizen (uncredited)  Capitol Citizen (uncredited)  See fewer,Members only,Baby Driver (2017)
Jessica Padgett Capitol Citizen / Young Mother (uncredited)  Capitol Citizen / Young Mother (uncredited)  See fewer,Members only,VOD Indie (2012)
Jessica Paidge Capital Citizen (uncredited)  Capital Citizen (uncredited)  See fewer,Members only,Locke & Key (2011)
Justin Parks Capitol Twin (uncredited)  Capitol Twin (uncredited)  See fewer,Members only,HoneyBee (2016)
Brayden Patterson District 13 Citizen (uncredited)  District 13 Citizen (uncredited)  See fewer,Members only,Up on High Ground (2014)
Michael J. Patterson D-11 Citizen (uncredited)  D-11 Citizen (uncredited)  See fewer,Members only,Four Points (2018)
Darla Pelton-Perez Capitol Citizen (uncredited)  Capitol Citizen (uncredited)  See fewer,Members only,Contrived Silence
Max Perethian Lumber rebel (uncredited)  Lumber rebel (uncredited)  See fewer,Members only,Spider-Man: Homecoming (2017)
Ej Peterson Capital Woman (uncredited)  Capital Woman (uncredited)  See fewer,Members only,Silent Screams
Zane Pittman Peacekeeper (uncredited)  Peacekeeper (uncredited)  See fewer,Members only,Echoes (VII) (2018)
Lou Ravelli Capitol Girl (uncredited)  Capitol Girl (uncredited)  See fewer,Members only,Sauvage / Wild (2018)
Lilly Roberson Capitol Citizen (uncredited)  Capitol Citizen (uncredited)  See fewer,Members only,Suburgatory (2011)
Emma Elle Roberts Capitol Citizen (uncredited)  Capitol Citizen (uncredited)  See fewer,Members only,I'm Not Ashamed (2016)
Christabelle Rose District 5 Rebel (uncredited)  District 5 Rebel (uncredited)  See fewer,Members only,The Gifted (2017)
Nancy Sandlin District 5 Rebel (uncredited)  District 5 Rebel (uncredited)  See fewer,Members only,The Hunger Games: Catching Fire (2013)
Caleb Shore District 5 Rebel (uncredited)  District 5 Rebel (uncredited)  See fewer,Members only,Simple Conjecture (2018)
Gary Sievers District 7 Rebel (uncredited)  District 7 Rebel (uncredited)  See fewer,Members only,Public Enemies (1996)
Diego Simion District 8 Rebel (uncredited)  District 8 Rebel (uncredited)  See fewer,Members only,Beat (2018)
Raian Stanley District 5 Rebel (uncredited)  District 5 Rebel (uncredited)  See fewer,Members only,Scattered (I) (2016)
Chris Stein Capitol Citizen (uncredited)  Capitol Citizen (uncredited)  See fewer,Members only,Lady and the Tramp (2019)
Kaitlynn Stone Capitol Child (uncredited)  Capitol Child (uncredited)  See fewer,Members only,Nashville (2012)
London Summers District 13 captiol (uncredited)  District 13 captiol (uncredited)  See fewer,Members only,Drumline: A New Beat (2014)
Chayma Surhan Woman district (uncredited)  Woman district (uncredited)  See fewer,Members only,Les gorilles (2015)
Sandra Tauro District 13 Combat Soldier (uncredited)  District 13 Combat Soldier (uncredited)  See fewer,Members only,Number of Silence (2013)
Dezirae Teal Capitol Woman (uncredited)  Capitol Woman (uncredited)  See fewer,Members only,Valerie (II) (2018)
Chris Theisinger District 13 Combat Security (uncredited)  District 13 Combat Security (uncredited)  See fewer,Members only,Mute (II) (2018)
Josh Tippey Nuclear Technician (uncredited)  Nuclear Technician (uncredited)  See fewer,Members only,Better Than You Found It (2015)
Kyle Viveiros District 13 Soldier (uncredited)  District 13 Soldier (uncredited)  See fewer,Members only,The Nexum Agency (2015)
Jeffrey Vu District 8 Rebel (uncredited)  District 8 Rebel (uncredited)  See fewer,Members only,OMG... We're in a Horror Film!!! (2016)
Ikia Walker Fabric Rebel (uncredited)  Fabric Rebel (uncredited)  See fewer,Members only,10 Minutes Gone (2019)
Kathy Walton District 13 Citizen (uncredited)  District 13 Citizen (uncredited)  See fewer,Members only,An Evergreen Christmas (2014)
Bailee Watters District 13 Citizen / Runner (uncredited)  District 13 Citizen / Runner (uncredited)  See fewer,Members only,Parasitic
Grace Marie Williams Capitol Citizen (uncredited)  Capitol Citizen (uncredited)  See fewer,Members only,Avengers: Endgame (2019)
Kathryn Williams Capitol Citizen (uncredited)  Capitol Citizen (uncredited)  See fewer,Members only,Open Borders (2019)
Erick Wofford District 5 Rebel (uncredited)  District 5 Rebel (uncredited)  See fewer,Members only,The Hunger Games: Mockingjay - Part 1 (2014)
Ilia Wolfe Capitol Kid (uncredited)  Capitol Kid (uncredited)  See fewer,Members only,Snap (I) (2011)
Aja Wooldridge Capitol Kid (uncredited)  Capitol Kid (uncredited)  See fewer,Members only,Substitutes
Ashton Lee Woolen District 13 Rebel (uncredited)  District 13 Rebel (uncredited)  See fewer,Members only,Goosebumps (2015)
Stefanie Wright District 11 official (uncredited)  District 11 official (uncredited)  See fewer,Members only,Princess Avengers: World Cleansers (2018)
Alexander Yassin District 13 Citizen (uncredited)  District 13 Citizen (uncredited)  See fewer,Members only,Don 2 (2011)
Jessica Yoshimura D 13 Contra Dancer (uncredited)  D 13 Contra Dancer (uncredited)  See fewer,Members only,Acrimony (2018)
Cheyanna Lavon Zubas Capitol citizen (uncredited)  Capitol citizen (uncredited)  See fewer,Members only,Guardians of the Galaxy Vol. 2 (2017)
