Name,STARmeter,Known for
Vince Vaughn Dan Trunkman  Dan Trunkman  See fewer,Top 5000,The Break-Up (2006)
Tom Wilkinson Timothy McWinters  Timothy McWinters  See fewer,Top 5000,Michael Clayton (2007)
Dave Franco Mike Pancake  Mike Pancake  See fewer,Top 5000,Neighbors (I) (2014)
Sienna Miller Chuck Portnoy  Chuck Portnoy  See fewer,Top 500,G.I. Joe: The Rise of Cobra (2009)
June Diane Raphael Susan Trunkman  Susan Trunkman  See fewer,Top 5000,Year One (2009)
Britton Sear Paul Trunkman  Paul Trunkman  See fewer,Members only,Boy Erased (2018)
Ella Anderson Bess Trunkman  Bess Trunkman  See fewer,Members only,The Glass Castle (2017)
Nick Frost Bill Whilmsley  Bill Whilmsley  See fewer,Top 5000,Paul (2011)
James Marsden Jim Spinch  Jim Spinch  See fewer,Top 5000,Hairspray (2007)
Ken Scott Tourist at German Hotel  Tourist at German Hotel  See fewer,Members only,Unfinished Business (I) (2015)
Kasia Malinowska Craigslist Maid  Craigslist Maid  See fewer,Members only,Summer Villa (2016)
Carmen Lopez Actual Maid  Actual Maid  See fewer,Members only,Drop Dead Diva (2009)
Melissa McMeekin National Rental Clerk  National Rental Clerk  See fewer,Members only,American Hustle (2013)
Michael Krabbe Dandlin Desk Clerk  Dandlin Desk Clerk  See fewer,Members only,Rote Rosen (2006)
Uwe Ochsenknecht Maarten Daaervk  Maarten Daaervk  See fewer,Members only,Transporter: The Series (2012)
Patrick Pinheiro Soldier  Soldier  See fewer,Members only,Ninja Assassin (2009)
Jil Funke Pretty German Girl  Pretty German Girl  See fewer,Members only,Anna (2008)
Marc Zwinz German Police Officer  German Police Officer  See fewer,Members only,Großstadtrevier (1986)
Volker Wackermann Second German Police Officer  Second German Police Officer  See fewer,Members only,Drei Wünsche (2012)
Jonathan Gyles Hostel Kid  Hostel Kid  See fewer,Members only,Go with Le Flo (2014)
Frowin Wolter Hostel Kid  Hostel Kid  See fewer,Members only,The King's Surrender (2014)
Leonard Carow Kelf / Hostel Young Man  Kelf / Hostel Young Man  See fewer,Members only,War Horse (2011)
Antonia Putiloff Female Hostel Clerk  Female Hostel Clerk  See fewer,Members only,Who Am I (2014)
Golo Euler Crowd Member  Crowd Member  See fewer,Members only,Kasimir und Karoline (2011)
Simone Hanselmann German Office Receptionist  German Office Receptionist  See fewer,Members only,Free Rainer (2007)
Christian Sengewald German Stranger  German Stranger  See fewer,Members only,Anonymous (I) (2011)
Anian Zollner German Stranger  German Stranger  See fewer,Members only,Race (I) (2016)
Eray Egilmez Folsom Goer  Folsom Goer  See fewer,Members only,Die LottoKönige (2012)
Sven Gerhardt Race Official  Race Official  See fewer,Members only,Never Look Away (2018)
Bonita Friedericy Helen (as Bonita Fri Edericy)  Helen (as Bonita Fri Edericy)  See fewer,Members only,Chuck (2007)
Rainer Reiners Museum Tourist  Museum Tourist  See fewer,Members only,Mute (II) (2018)
Terry Conforti St. Louis Ticket Agent (as Terry J. Conforti)  St. Louis Ticket Agent (as Terry J. Conforti)  See fewer,Members only,Edge of Darkness (2010)
Michael Tow Japanese Businessman  Japanese Businessman  See fewer,Members only,Blindspot (2015)
Sarah Randall Hunt Spa Receptionist  Spa Receptionist  See fewer,Members only,Stupid Cupid (2018)
David Akinloye Bar Guest (uncredited)  Bar Guest (uncredited)  See fewer,Members only,Deconstruct Stereotypes! (2012)
Stephanie Atkinson Mom on Hayride (uncredited)  Mom on Hayride (uncredited)  See fewer,Members only,Island Zero (2018)
Melanie Benna Police Officer (uncredited)  Police Officer (uncredited)  See fewer,Members only,A Cure for Wellness (2016)
Amanda Blattner Farm Goer (uncredited)  Farm Goer (uncredited)  See fewer,Members only,Rough Night (2017)
Jim Boyd Hotel Patron (uncredited)  Hotel Patron (uncredited)  See fewer,Members only,Manchester by the Sea (2016)
Thomas Braun Demonstrator (uncredited)  Demonstrator (uncredited)  See fewer,Members only,Die wahre Geschichte (2014)
David Brückner Band Singer on Stage (uncredited)  Band Singer on Stage (uncredited)  See fewer,Members only,Dead Survivors (2010)
Hélène Cardona German Receptionist (voice) (uncredited)  German Receptionist (voice) (uncredited)  See fewer,Members only,Chocolat (2000)
Kadian Clarke Office Worker (uncredited)  Office Worker (uncredited)  See fewer,Members only,Blessid (2015)
Jeffrey Corazzini Businessman (uncredited)  Businessman (uncredited)  See fewer,Members only,R.I.P.D. (2013)
Patrick Vincent Curran Group Home Member (uncredited)  Group Home Member (uncredited)  See fewer,Members only,Louie (2010)
Anna Daraz Hostel Girl #1 (uncredited)  Hostel Girl #1 (uncredited)  See fewer,Members only,M jak milosc (2000)
Adam DeBenedittis Office worker (uncredited)  Office worker (uncredited)  See fewer,Members only,Lazarus (VI)
Steven Dougherty Vendor Employee (uncredited)  Vendor Employee (uncredited)  See fewer,Members only,Tumbledown (2015)
Curtis Eames Hostel Worker (uncredited)  Hostel Worker (uncredited)  See fewer,Members only,Stronger (I) (2017)
Christopher Eaton Wayne (uncredited)  Wayne (uncredited)  See fewer,Members only,Scariest Places on Earth (2000)
Larry Eudene Office Gossiper (uncredited)  Office Gossiper (uncredited)  See fewer,Members only,The Finest Hours (2016)
Brian Faherty Toll Booth Employee (uncredited)  Toll Booth Employee (uncredited)  See fewer,Members only,Measure of a Man (2018)
John Franchi Professional Business Traveler (uncredited)  Professional Business Traveler (uncredited)  See fewer,Members only,Year by the Sea (2016)
Susan Garibotto Business Woman (uncredited)  Business Woman (uncredited)  See fewer,Members only,"The Rude, the Mad, and the Funny (2014)"
Ali Geldiava Hostel Girl #2 (uncredited)  Hostel Girl #2 (uncredited)  See fewer,Members only,Paragods (2013)
Phyllis A. Gordon Business Woman (uncredited)  Business Woman (uncredited)  See fewer,Members only,Who Does That? (2016)
Elaine Victoria Grey Farm Goer (uncredited)  Farm Goer (uncredited)  See fewer,Members only,Spotlight (I) (2015)
Alin Halajian Office Worker / Business Professional (uncredited)  Office Worker / Business Professional (uncredited)  See fewer,Members only,Ted 2 (2015)
London Hall Business Woman (uncredited)  Business Woman (uncredited)  See fewer,Members only,Bleed for This (2016)
Claudina Hoff ter Heide Marathon Runner (uncredited)  Marathon Runner (uncredited)  See fewer,Members only,Inglourious Basterds (2009)
Rosemary Howard Dynamic Systems Employee / Airport Traveller (uncredited)  Dynamic Systems Employee / Airport Traveller (uncredited)  See fewer,Members only,Glass (2019)
Kimberly Howe Pillow Fight Girl (uncredited)  Pillow Fight Girl (uncredited)  See fewer,Members only,Portico (2014)
Nicole Jesson Dog Walker (uncredited)  Dog Walker (uncredited)  See fewer,Members only,Wonderland (II) (2019)
Glenn W. Kane Hotel Guest (uncredited)  Hotel Guest (uncredited)  See fewer,Members only,A Quiet Place 2 (2020)
Ken Kansky Professional (uncredited)  Professional (uncredited)  See fewer,Members only,Stronger (I) (2017)
Wendy Kay Pedestrian (uncredited)  Pedestrian (uncredited)  See fewer,Members only,Open Graves (2009)
Bobby Kenney Bus Passenger (uncredited)  Bus Passenger (uncredited)  See fewer,Members only,Serena and the Ratts (2012)
Remington Keyes Model U.N. Student (uncredited)  Model U.N. Student (uncredited)  See fewer,Members only,Power Rangers Annihilation (2014)
Jeffery Kincannon Hotel Manager (uncredited)  Hotel Manager (uncredited)  See fewer,Members only,The Equalizer (2014)
Ren Knopf Elevator Occupant (uncredited)  Elevator Occupant (uncredited)  See fewer,Members only,Knight and Day (2010)
Hashim Lafond Hostel Patron (uncredited)  Hostel Patron (uncredited)  See fewer,Members only,Before Love After Marriage (2017)
Isabel B. Lirag Farm Goer (uncredited)  Farm Goer (uncredited)  See fewer,Members only,Permanent (2014)
Gwen MacKay Pedestrian (uncredited)  Pedestrian (uncredited)  See fewer,Members only,The Man Who Killed Hitler and Then The Bigfoot (2018)
Paul Melendy Russell (uncredited)  Russell (uncredited)  See fewer,Members only,"Love, Weddings & Other Disasters"
Ed O'Keefe Dynamic Systems Employee (uncredited)  Dynamic Systems Employee (uncredited)  See fewer,Members only,Mystic River (2003)
Dennis Oestreich Man with Bicycle at Ritz Carlton (uncredited)  Man with Bicycle at Ritz Carlton (uncredited)  See fewer,Members only,War Machine (2017)
Rebecca Olejniczak Sexy Spa Girl (uncredited)  Sexy Spa Girl (uncredited)  See fewer,Members only,Ray Donovan (2013)
Joseph Oliveira Bus Passenger (uncredited)  Bus Passenger (uncredited)  See fewer,Members only,Midnight Butterflies
Richard Pacheco Man in Airport (uncredited)  Man in Airport (uncredited)  See fewer,Members only,The 6th Amendment (2017)
Jamal Peters Sebastian (uncredited)  Sebastian (uncredited)  See fewer,Members only,Black Mass (2015)
Heidi Philipsen German Car Rental Rep (uncredited)  German Car Rental Rep (uncredited)  See fewer,Members only,Salt (2010)
Steven Rears Airport Traveler (uncredited)  Airport Traveler (uncredited)  See fewer,Members only,District C-11 (2017)
Stew Replogle Hotel Guest (uncredited)  Hotel Guest (uncredited)  See fewer,Members only,Bleed for This (2016)
Osmani Rodriguez Brian Peters (uncredited)  Brian Peters (uncredited)  See fewer,Members only,Sex Tape (2014)
Gary Roscoe Airport Traveler (uncredited)  Airport Traveler (uncredited)  See fewer,Members only,The Purge: Election Year (2016)
Austin J. Ryan Class Mate (uncredited)  Class Mate (uncredited)  See fewer,Members only,The Groundskeeper
Luke Ryan Student (uncredited)  Student (uncredited)  See fewer,Members only,Black Mass (2015)
Diego Simion Barmen (uncredited)  Barmen (uncredited)  See fewer,Members only,Beat (2018)
Stuart Spinks Barman (uncredited)  Barman (uncredited)  See fewer,Members only,Diana: The Day Britain Cried (2017)
Lino Tanaka Japanese Businessman #2 (uncredited)  Japanese Businessman #2 (uncredited)  See fewer,Members only,Cocktail Party (2016)
Carl 'CJ' Tempesta Ecstasy User #1 (uncredited)  Ecstasy User #1 (uncredited)  See fewer,Members only,The Finest Hours (2016)
Janine Theisen German TV Reporter (uncredited)  German TV Reporter (uncredited)  See fewer,Members only,A Cure for Wellness (2016)
Chris Theisinger Demonstrator (uncredited)  Demonstrator (uncredited)  See fewer,Members only,Mute (II) (2018)
Noelle Trudeau Topless Pillow Girl (uncredited)  Topless Pillow Girl (uncredited)  See fewer,Members only,Bleed for This (2016)
Jaimie Tucker Pillow Fight Girl (uncredited)  Pillow Fight Girl (uncredited)  See fewer,Members only,Make America Great (2016)
Clement von Franckenstein Armand (uncredited)  Armand (uncredited)  See fewer,Members only,Take Me Home Tonight (2011)
Alyssa Mae Walsh Student (uncredited)  Student (uncredited)  See fewer,Members only,Year by the Sea (2016)
Christopher Weigel Berliner (uncredited)  Berliner (uncredited)  See fewer,Members only,The Folklorist (2012)
Caitlin Patricia Weiler Hostel Guest (uncredited)  Hostel Guest (uncredited)  See fewer,Members only,Más sabe el Diablo por Viejo (2018)
Alexander Yassin Indonesian Marathon Runner (uncredited)  Indonesian Marathon Runner (uncredited)  See fewer,Members only,Don 2 (2011)
Hannah Yun Korean Toaster (uncredited)  Korean Toaster (uncredited)  See fewer,Members only,Bride Wars (2009)
