Name,STARmeter,Known for
Andrew Garfield Desmond Doss  Desmond Doss  See fewer,Top 5000,The Social Network (2010)
Richard Pyros Teach  Teach  See fewer,Members only,The Tragedy of Hamlet Prince of Denmark (2007)
Jacob Warner James Pinnick  James Pinnick  See fewer,Members only,Ride Like a Girl (2019)
Milo Gibson Lucky Ford  Lucky Ford  See fewer,Members only,Brother's Keeper (VIII)
Darcy Bryce Young Desmond  Young Desmond  See fewer,Members only,Jack Irish (2016)
Roman Guerriero Young 'Hal' Doss  Young 'Hal' Doss  See fewer,Members only,Hacksaw Ridge (2016)
James Lugton Hiker  Hiker  See fewer,Members only,Candy Regentag (1989)
Kasia Stelmach Hiker's Friend  Hiker's Friend  See fewer,Members only,The Great Gatsby (2013)
Hugo Weaving Tom Doss  Tom Doss  See fewer,Top 5000,The Lord of the Rings: The Return of the King (2003)
Rachel Griffiths Bertha Doss  Bertha Doss  See fewer,Top 5000,Muriel's Wedding (1994)
Jarin Towney Teenage Boy  Teenage Boy  See fewer,Members only,Underbelly (2008)
Tim McGarry Local Man  Local Man  See fewer,Members only,Aisha's Communion
Tyler Coppin Lynchburg Doctor  Lynchburg Doctor  See fewer,Members only,Winchester (2018)
Teresa Palmer Dorothy Schutte  Dorothy Schutte  See fewer,Top 500,Lights Out (II) (2016)
Richard Platt Flirting Hospital Soldier  Flirting Hospital Soldier  See fewer,Members only,Gods of Egypt (2016)
Nathaniel Buzolic Harold 'Hal' Doss  Harold 'Hal' Doss  See fewer,Members only,The Originals (2013)
Laura Buckton Cinema Kissing Sweetheart  Cinema Kissing Sweetheart  See fewer,Members only,Hacksaw Ridge (2016)
Anthony Rizzo Cinema Kissing Soldier  Cinema Kissing Soldier  See fewer,Members only,The Bronxville Affair (2014)
Simon Edds MP Gibbs  MP Gibbs  See fewer,Members only,The Great Gatsby (2013)
Thatcher McMaster Company B Soldier  Company B Soldier  See fewer,Members only,Better Watch Out (II) (2016)
Charles Jacobs Private Webb  Private Webb  See fewer,Members only,The Devil Made Them Do It (2014)
Dennis Kreusler Sergeant Amos (as Dennis Kruesler)  Sergeant Amos (as Dennis Kruesler)  See fewer,Members only,Two de Force (2011)
Firass Dirani Vito Rinnelli  Vito Rinnelli  See fewer,Members only,Escape and Evasion (2019)
Michael Sheasby Tex Lewis  Tex Lewis  See fewer,Members only,The Nightingale (I) (2018)
Luke Pegler Hollywood Zane  Hollywood Zane  See fewer,Members only,See No Evil (2006)
Ben Mingay Grease Nolan  Grease Nolan  See fewer,Members only,Home and Away (1988)
Luke Bracey Smitty Ryker  Smitty Ryker  See fewer,Top 5000,Point Break (2015)
Nico Cortez Wal Kirzinski  Wal Kirzinski  See fewer,Members only,Pirates of the Caribbean: Dead Men Tell No Tales (2017)
Goran D. Kleut Ghoul  Ghoul  See fewer,Members only,Gods of Egypt (2016)
Harry Greenwood Henry Brown  Henry Brown  See fewer,Members only,Old School (2014)
Damien Thomlinson Ralph Morgan  Ralph Morgan  See fewer,Members only,Underbelly (2008)
Ben O'Toole Corporal Jessop  Corporal Jessop  See fewer,Members only,Detroit (2017)
Vince Vaughn Sgt Howell  Sgt Howell  See fewer,Top 5000,The Break-Up (2006)
Andrew Sears Private Maguire  Private Maguire  See fewer,Members only,Torn Soul (2012)
Jim Robison Private Bates  Private Bates  See fewer,Members only,Danger Close (2019)
Nathan Baird Private Green  Private Green  See fewer,Members only,Murrays Run (2015)
Samuel R. Wright Private Dixon (as Sam Wright)  Private Dixon (as Sam Wright)  See fewer,Members only,The Pacific (2010)
Mikael Koski Private Giles  Private Giles  See fewer,Members only,A Single Rider (2017)
Troy Pickering Private Tyler  Private Tyler  See fewer,Members only,Hacksaw Ridge (2016)
James Moffett Private Lewis  Private Lewis  See fewer,Members only,Hacksaw Ridge (2016)
Sam Worthington Captain Glover  Captain Glover  See fewer,Top 500,Avatar (2009)
Josh Dean Williams Private Perry  Private Perry  See fewer,Members only,Neighbours (1985)
Richard Roxburgh Colonel Stelzer  Colonel Stelzer  See fewer,Top 5000,Moulin Rouge! (2001)
Andrew Hansch Bugle Player  Bugle Player  See fewer,Members only,Hacksaw Ridge (2016)
John Cannon Corporal Cannon  Corporal Cannon  See fewer,Members only,Hacksaw Ridge (2016)
Robert Morgan Colonel Sangston  Colonel Sangston  See fewer,Members only,Childhood's End (2015)
Helmut Bakaitis Minister  Minister  See fewer,Members only,The Matrix Reloaded (2003)
Georgia Adamson Receptionist  Receptionist  See fewer,Members only,The Code (2014)
Bill Young General Musgrove  General Musgrove  See fewer,Members only,The Matrix (1999)
Benedict Hardie Captain Daniels  Captain Daniels  See fewer,Members only,The Light Between Oceans (2016)
Philip Quast Judge  Judge  See fewer,Members only,The Devil's Double (2011)
James Mackay Prosecutor  Prosecutor  See fewer,Members only,Pirates of the Caribbean: Dead Men Tell No Tales (2017)
Ryan Corr Lieutenant Manville  Lieutenant Manville  See fewer,Members only,Holding the Man (2015)
Sam Parsonson 96th Soldier Bob  96th Soldier Bob  See fewer,Members only,Love My Way (2004)
James O'Connell 96th Soldier Page  96th Soldier Page  See fewer,Members only,Hacksaw Ridge (2016)
Ori Pfeffer Irv Schecter  Irv Schecter  See fewer,Members only,Princess (I) (2014)
Craig Reeves Climbing Soldier  Climbing Soldier  See fewer,Members only,Hacksaw Ridge (2016)
Adrian Twigg Soldier - Death Throes  Soldier - Death Throes  See fewer,Members only,Kurzeme Fortress (2017)
Sean Lynch Popeye  Popeye  See fewer,Members only,Danger Close (2019)
Luke McMahon Stretcher Bearer  Stretcher Bearer  See fewer,Members only,Don't Stop for No One (2017)
Bill Thompson Wounded Soldier  Wounded Soldier  See fewer,Members only,Hacksaw Ridge (2016)
William Takayanagi-Temm Firing Japanese Soldier #1 (as William Temm)  Firing Japanese Soldier #1 (as William Temm)  See fewer,Members only,The Wolverine (2013)
Kazuaki Ono Firing Japanese Soldier #2  Firing Japanese Soldier #2  See fewer,Members only,Abandoned (2015)
Thomas Unger Stretcher Bearer  Stretcher Bearer  See fewer,Members only,The Light Between Oceans (2016)
Eric Taugherbeck Wounded Private O'Conner  Wounded Private O'Conner  See fewer,Members only,Hacksaw Ridge (2016)
Hayden Geens Wounded Private Blake  Wounded Private Blake  See fewer,Members only,Unleashing the Demons (2019)
Ned Law Rescued Private Horvath (as Edward Ned Law)  Rescued Private Horvath (as Edward Ned Law)  See fewer,Members only,The Daughter (2015)
Kazuki Yuyama Corpse with Rats #2  Corpse with Rats #2  See fewer,Members only,Hacksaw Ridge (2016)
Daisaku Takeda Corpse With Rats #3 (as Daisuka Takeda)  Corpse With Rats #3 (as Daisuka Takeda)  See fewer,Members only,Abandoned (2015)
Raphael Dubois Corpse with Rats #4  Corpse with Rats #4  See fewer,Members only,Slip Road (2019)
Tim Potter Soldier Hank  Soldier Hank  See fewer,Members only,Lemonade Stand (2012)
Santo Tripodi Soldier Carl  Soldier Carl  See fewer,Members only,Strike Back (2010)
Matt Nable Lt Colonel Cooney  Lt Colonel Cooney  See fewer,Members only,Riddick (2013)
Laurence Brewer Head Doctor  Head Doctor  See fewer,Members only,Devil's Dust (2012)
John Batziolas Rescued Private Schulenburg  Rescued Private Schulenburg  See fewer,Members only,Hacksaw Ridge (2016)
Nobuaki Shimamoto Japanese Officer  Japanese Officer  See fewer,Members only,Abandoned (2018)
Hiroshi Kasuga Japanese Hanging Soldier  Japanese Hanging Soldier  See fewer,Members only,Unbroken (I) (2014)
Ryuzaburo Naruse Injured Japanese in Tunnel  Injured Japanese in Tunnel  See fewer,Members only,Unbroken (I) (2014)
Taka Uematsu Reacting Japanese Soldier #2 (as Hisataka Uematsu)  Reacting Japanese Soldier #2 (as Hisataka Uematsu)  See fewer,Members only,Unbroken (I) (2014)
Adam Bowes Rescued Wounded Leg Soldier  Rescued Wounded Leg Soldier  See fewer,Members only,Jeremy the Dud (2017)
Michael Hennessy Rescued Private Moran  Rescued Private Moran  See fewer,Members only,Hacksaw Ridge (2016)
Benjamin McCann Rescued Private Saareste  Rescued Private Saareste  See fewer,Members only,Hacksaw Ridge (2016)
Yuki Nagashima Rescued Japanese Soldier (as Yukihiro Nagashima)  Rescued Japanese Soldier (as Yukihiro Nagashima)  See fewer,Members only,Emperor (2012)
Taki Abe Japanese Sniper (as Takehiro Abe)  Japanese Sniper (as Takehiro Abe)  See fewer,Members only,The Wolverine (2013)
Daniel Thone Stretcher Bearer  Stretcher Bearer  See fewer,Members only,Growing Pains (2018)
Nathan Halls Private Tillson  Private Tillson  See fewer,Members only,Voices (II) (2019)
Nicholas Cowey Private Gregan  Private Gregan  See fewer,Members only,Hacksaw Ridge (2016)
Charles Upton Scared Military Officer  Scared Military Officer  See fewer,Members only,Dream Channel (2017)
Yoji Tatsuta Japanese General  Japanese General  See fewer,Members only,Unbroken (I) (2014)
Toshiyuki Teramoto Surrendering Soldier  Surrendering Soldier  See fewer,Members only,Hacksaw Ridge (2016)
Honsen Haga Japanese General's Assistant  Japanese General's Assistant  See fewer,Members only,Heirloom (IV) (2014)
Chris Bartlett Private Baudour (uncredited)  Private Baudour (uncredited)  See fewer,Members only,Fatal Attraktion (2016)
Jake Bennett company B Soldier (uncredited)  company B Soldier (uncredited)  See fewer,Members only,Brock (2016)
Jeremy Costello 96th Battalion G.I (uncredited)  96th Battalion G.I (uncredited)  See fewer,Members only,The Friendly Fellas (2016)
Wez Debono US Army Company B 1177 (uncredited)  US Army Company B 1177 (uncredited)  See fewer,Members only,Infini (2015)
Matthew Dippel US Army - Company B (uncredited)  US Army - Company B (uncredited)  See fewer,Members only,Advanced (2008)
Desmond T. Doss Himself (archive footage) (uncredited)  Himself (archive footage) (uncredited)  See fewer,Members only,Medal of Honor (2000)
Harold Doss Himself (archive footage) (uncredited)  Himself (archive footage) (uncredited)  See fewer,Members only,Scream: The TV Series (2015)
Akira Fujii Japanese Soldier (uncredited)  Japanese Soldier (uncredited)  See fewer,Members only,Hyde & Seek (2016)
Mark Gadaleta Officer (uncredited)  Officer (uncredited)  See fewer,Members only,Here (I) (2017)
Jack Glover Himself (archive footage) (uncredited)  Himself (archive footage) (uncredited)  See fewer,Members only,The Conscientious Objector (2004)
Daniel Keen Military Police / 96th Battalion (uncredited)  Military Police / 96th Battalion (uncredited)  See fewer,Members only,Hello Au Revoir (2018)
Dragon Oli Lee Japanese Gunner (uncredited)  Japanese Gunner (uncredited)  See fewer,Members only,Forgetting Taylor (2016)
So Mang Lee Japanese Soldier (uncredited)  Japanese Soldier (uncredited)  See fewer,Members only,Remember (I) (2016)
Tom Molnar Soldier (uncredited)  Soldier (uncredited)  See fewer,Members only,Fearless Game (2014)
Jason Pugh 96th Battalion G.I (uncredited)  96th Battalion G.I (uncredited)  See fewer,Members only,Australia: The Story of Us (2014)
Milan Pulvermacher Billy Bob (uncredited)  Billy Bob (uncredited)  See fewer,Members only,The Great Gatsby (2013)
Jim Punnett Japanese Soldier (uncredited)  Japanese Soldier (uncredited)  See fewer,Members only,Pacific Rim: Uprising (2018)
Sam Romain US Medic (uncredited)  US Medic (uncredited)  See fewer,Members only,A Solid Place to Stand (2010)
Matt Scaletti US Army Soldier (uncredited)  US Army Soldier (uncredited)  See fewer,Members only,The One Dollar Movie (2012)
Glen Snow 96th Battalion Soldier (uncredited)  96th Battalion Soldier (uncredited)  See fewer,Members only,Tabernacle 101 (2019)
Andrew Wang Japanese Soldier (uncredited)  Japanese Soldier (uncredited)  See fewer,Members only,After Nightfall (2018)
Michael Adam Welsh 96th Battalion Soldier (uncredited)  96th Battalion Soldier (uncredited)  See fewer,Members only,Last Kung Fu Monk (2010)
