Name,STARmeter,Known for
John Berger Himself  Himself  See fewer,Members only,Jonah Who Will Be 25 in the Year 2000 (1976)
Ben Lerner Himself  Himself  See fewer,Members only,The Seasons in Quincy: Four Portraits of John Berger (2016)
Colin MacCabe Himself  Himself  See fewer,Members only,Friendship's Death (1987)
Christopher Roth Himself  Himself  See fewer,Members only,Baader (2002)
Akshi Singh Herself  Herself  See fewer,Members only,The Seasons in Quincy: Four Portraits of John Berger (2016)
Honor Swinton Byrne Herself  Herself  See fewer,Members only,The Souvenir (2019)
Tilda Swinton Herself  Herself  See fewer,Top 5000,We Need to Talk About Kevin (2011)
