Name,STARmeter,Known for
Perro Aguayo Jr. El Hijo Del Perro Aguayo  El Hijo Del Perro Aguayo  See fewer,Members only,Qué pobres tan ricos (2013)
Jon Anderson Jon Strongman  Jon Strongman  See fewer,Members only,The Dog Wedding (2015)
Matt Bloom Gigante Bernard  Gigante Bernard  See fewer,Members only,WWE SmackDown Live (1999)
"Blue Demon Jr. Blue Demon, Jr  Blue Demon, Jr  See fewer",Members only,Get the Gringo (2012)
Dulce María García Sexy Star  Sexy Star  See fewer,Members only,Lucha Underground (2014)
Ultimo Guerrero Ultimo Guerrero  Ultimo Guerrero  See fewer,Members only,Ya Veremos (2018)
Jair Soria Reyna Shocker  Shocker  See fewer,Members only,Lucha Mexico: Round Two
Julio César Rivera Julio César Rivera  Julio César Rivera  See fewer,Members only,Ras de lona (2008)
Tony Salazar Tony Salazar  Tony Salazar  See fewer,Members only,Los vampiros de Coyoacán (1974)
