Name,STARmeter,Known for
Dextina Booker Herself  Herself  See fewer,Members only,Generation Startup (2016)
Kate Catlin Herself  Herself  See fewer,Members only,Generation Startup (2016)
Avery Hairston Himself  Himself  See fewer,Members only,Generation Startup (2016)
Pamela Lewis Herself  Herself  See fewer,Members only,Generation Startup (2016)
Max Nussenbaum Himself  Himself  See fewer,Members only,Generation Startup (2016)
Labib Rahman Himself  Himself  See fewer,Members only,Generation Startup (2016)
Brian Rudolph Himself  Himself  See fewer,Members only,Generation Startup (2016)
Andrew Yang Himself  Himself  See fewer,Members only,Inherent Good
