Name,STARmeter,Known for
Kathy Jones-Gates Herself  Herself  See fewer,Members only,Dawson City: Frozen Time (2016)
Michael Gates Himself  Himself  See fewer,Members only,Lost Forever (2011)
Sam Kula Himself  Himself  See fewer,Members only,Dawson City: Frozen Time (2016)
Bill O'Farrell Himself  Himself  See fewer,Members only,Dawson City: Frozen Time (2016)
Chris 'Mad Dog' Russo Himself  Himself  See fewer,Members only,Bad Lieutenant (1992)
Bill Morrison Himself  Himself  See fewer,Members only,The Village Detective
