Name,STARmeter,Known for
"Karthi Kaashmora, Rajnayak  Kaashmora, Rajnayak  See fewer",Members only,Theeran Adhigaaram Ondru (2017)
Nayanthara Ratnamahadevi  Ratnamahadevi  See fewer,Top 5000,Iru Mugan (2016)
Sri Divya Yamini  Yamini  See fewer,Members only,Varuthapadatha Valibar Sangam (2013)
Vivek  Actor  Actor  See fewer,Members only,Sivaji (2007)
Jangiri Madhumitha  Actress  Actress  See fewer,Members only,K-13 (2019)
Anoop Shekhar's Friend  Shekhar's Friend  See fewer,Members only,Kaashmora (2016)
Aryan Bhai Friend  Bhai Friend  See fewer,Members only,Kaashmora (2016)
Roshan Chandra Arjunan  Arjunan  See fewer,Members only,Kaashmora (2016)
Damodaran King's Minister  King's Minister  See fewer,Members only,Pachaikili Parimala (2017)
Deepak TV Show Audience  TV Show Audience  See fewer,Members only,Bharjari (2017)
Dhanush Bomb Specialist  Bomb Specialist  See fewer,Members only,Kaashmora (2016)
Dinesh Soldier  Soldier  See fewer,Members only,Kaashmora (2016)
Divya Newsreader  Newsreader  See fewer,Members only,Kaashmora (2016)
Elango Thirumeni Assistant 1  Thirumeni Assistant 1  See fewer,Members only,Sketch (I) (2018)
Gayathri Yaamini's Friend  Yaamini's Friend  See fewer,Members only,Kaashmora (2016)
Ajay Gosh Mahaan  Mahaan  See fewer,Members only,Mutham (2013)
Ramkumar Kalashetra Deiva Kumari Temple Priest  Deiva Kumari Temple Priest  See fewer,Members only,Kaashmora (2016)
Mukhtar Khan King  King  See fewer,Members only,Kaashmora (2016)
Sarath Logithashwa Minister Dhanakodi  Minister Dhanakodi  See fewer,Members only,Kaashmora (2016)
Madhumitha Amala  Amala  See fewer,Members only,Biriyani (2013)
Maya Samuel's Daughter  Samuel's Daughter  See fewer,Members only,Kaashmora (2016)
Monica Press Reporter  Press Reporter  See fewer,Members only,Kaashmora (2016)
Vinod Munna Assistant Commisioner  Assistant Commisioner  See fewer,Members only,Andava Kanoom (2018)
Muruganandam House Broker  House Broker  See fewer,Members only,Aangal Jaakirathai
Parota Murugesh Head Constable  Head Constable  See fewer,Members only,Rubaai (2017)
Nagesh Jallapadiraan (Ghost)  Jallapadiraan (Ghost)  See fewer,Members only,Kaashmora (2016)
Nagesh Jalapathy Rao  Jalapathy Rao  See fewer,Members only,Kaashmora (2016)
Karuppu Nambiyaar Inspector Rajalingam  Inspector Rajalingam  See fewer,Members only,Kaala (2018)
Kayal Perera Samuvel  Samuvel  See fewer,Members only,Raja Manthiri (2016)
Priya Minister Wife  Minister Wife  See fewer,Members only,Kaashmora (2016)
Stills Raj Vettiyaan  Vettiyaan  See fewer,Members only,Kaashmora (2016)
David Solomon Raja Inspector Khan Sahib  Inspector Khan Sahib  See fewer,Members only,Nibunan (2017)
Pattimandram Raja Yamini's Father  Yamini's Father  See fewer,Members only,Sivaji (2007)
Arandhai Rajagopal Thirumeni Assistant 2  Thirumeni Assistant 2  See fewer,Members only,Nibunan (2017)
Rajkumar Advocate  Advocate  See fewer,Members only,Kaashmora (2016)
Arumbakkam Ramesh Rajesh  Rajesh  See fewer,Members only,Kaashmora (2016)
Beard Ranga Ghost House Old Man  Ghost House Old Man  See fewer,Members only,Kaashmora (2016)
Madhusudhan Rao Thirumeni  Thirumeni  See fewer,Members only,Goli Soda (2014)
Santhosh Kaashmora Assistant 1  Kaashmora Assistant 1  See fewer,Members only,Kaashmora (2016)
Satish Shekhar  Shekhar  See fewer,Members only,Kaashmora (2016)
Tamil Selvi Rajesh Wife  Rajesh Wife  See fewer,Members only,Kaashmora (2016)
Rayapuram Shanmugham Bhai  Bhai  See fewer,Members only,Kaashmora (2016)
Sharmila Kaashmora's Mother  Kaashmora's Mother  See fewer,Members only,Kaashmora (2016)
Ramachandra Singh Party Leader  Party Leader  See fewer,Members only,1 - Nenokkadine (2014)
Baby Smriti Daiva Kumari  Daiva Kumari  See fewer,Members only,Kaashmora (2016)
Saravana Subbiah TV Host  TV Host  See fewer,Members only,Adhibar (2015)
Sudesh King's Opponent  King's Opponent  See fewer,Members only,Kaashmora (2016)
Susheendran Prince  Prince  See fewer,Members only,Kaashmora (2016)
Shaaji Syed Minister's PA  Minister's PA  See fewer,Members only,Kaashmora (2016)
Takkar Kaashmora Assistant 2  Kaashmora Assistant 2  See fewer,Members only,Kaashmora (2016)
Vijaya Kaashmora's Grandmother  Kaashmora's Grandmother  See fewer,Members only,Kaashmora (2016)
Siddharth Vipin Yaamini's Bride  Yaamini's Bride  See fewer,Members only,Hello Naan Pei Pesuren (2016)
