Name,STARmeter,Known for
Szabolcs Thuróczy Rupaszov  Rupaszov  See fewer,Members only,Sandwich (I) (2017)
Zoltán Fenyvesi Zolika  Zolika  See fewer,Members only,Lakástalkshow (2012)
Ádám Fekete Barba Papa  Barba Papa  See fewer,Members only,Földiek (2017)
Mónika Balsai Zita  Zita  See fewer,Members only,Liza the Fox-Fairy (2015)
Lídia Danis Évi  Évi  See fewer,Members only,Easy Living (2015)
Dusán Vitanovics Rados  Rados  See fewer,Members only,Dealer (I) (2004)
Zoltán Mucsi Rupaszov's cellmate  Rupaszov's cellmate  See fewer,Members only,Tinker Tailor Soldier Spy (2011)
Björn Freiberg Dr. Björn  Dr. Björn  See fewer,Members only,Terminator: Dark Fate (2019)
Gödeny György Bodyguard (as György Gödény)  Bodyguard (as György Gödény)  See fewer,Members only,Easy Living (2015)
