Name,STARmeter,Known for
John Cage Himself (archive footage)  Himself (archive footage)  See fewer,Members only,Shutter Island (2010)
Pico Iyer Himself  Himself  See fewer,Members only,Gringo Trails (2013)
Garry Moore Himself (archive footage)  Himself (archive footage)  See fewer,Members only,It Happened to Jane (1959)
Steve Orfield Himself  Himself  See fewer,Members only,Blueprint for Green (2007)
George Prochnik Himself  Himself  See fewer,Members only,Sonic Sea (2016)
Stephen Stansfeld Himself  Himself  See fewer,Members only,Click (2000)
Poppy Szkiler Herself  Herself  See fewer,Members only,In Pursuit of Silence (2015)
Julian Treasure Himself  Himself  See fewer,Members only,Voice Arts® Awards (2018)
David Tudor Himself (archive footage)  Himself (archive footage)  See fewer,Members only,American Masters (1985)
