Name,STARmeter,Known for
Charles Mully Himself  Himself  See fewer,Members only,Tavis Smiley (2004)
Esther Mully Herself  Herself  See fewer,Members only,Mully (2015)
Isaac Mulli Himself  Himself  See fewer,Members only,Vice World of Sports (2016)
Ndondo Mulli Herself  Herself  See fewer,Members only,Mully (2015)
Dickson Mulli Himself  Himself  See fewer,Members only,Mully (2015)
Grace Mulli Herself  Herself  See fewer,Members only,Mully (2015)
Mueni Mulli Herself  Herself  See fewer,Members only,Mully (2015)
Kaleli Mulli Himself  Himself  See fewer,Members only,Mully (2015)
Janey Mulli Herself  Herself  See fewer,Members only,Mully (2015)
Rhoda Mulli Herself  Herself  See fewer,Members only,Mully (2015)
Daudi Mulli Himself  Himself  See fewer,Members only,Mully (2015)
Zacharia Mulli Himself  Himself  See fewer,Members only,Mully (2015)
Philip Ekiru Will Digger #2  Will Digger #2  See fewer,Members only,Mully (2015)
Lucky Hassan Young Charles  Young Charles  See fewer,Members only,Mully (2015)
Rio Evans Juma Car Thief  Car Thief  See fewer,Members only,Zawadi (2015)
Sheila Juma Child at Dinner Table #3  Child at Dinner Table #3  See fewer,Members only,Mully (2015)
Veronia Mwikali Kinyili Woman with Food  Woman with Food  See fewer,Members only,Mully (2015)
Mily Lukiko Child at Dinner Table #2  Child at Dinner Table #2  See fewer,Members only,Mully (2015)
Festus Musyoka Matingi Young Charles' Father  Young Charles' Father  See fewer,Members only,Mully (2015)
Irene Mbithe Child at Dinner Table  Child at Dinner Table  See fewer,Members only,Mully (2015)
Jennifer Ndunge Mukwata Teen Esther  Teen Esther  See fewer,Members only,Mully (2015)
Bernard Mutinda Musyoka Well Digger  Well Digger  See fewer,Members only,Mully (2015)
Richard Mutinda Child at Dinner Table #5  Child at Dinner Table #5  See fewer,Members only,Mully (2015)
Angela Mutua Young Charles' Mother  Young Charles' Mother  See fewer,Members only,Mully (2015)
Rebecca Nduku Child at Dinner Table #4  Child at Dinner Table #4  See fewer,Members only,Mully (2015)
Clinton Odour Teen Charles  Teen Charles  See fewer,Members only,Mully (2015)
Michael Odour Young Charles' Uncle  Young Charles' Uncle  See fewer,Members only,Mully (2015)
John Ogutu Street Kid #2 (as John Ogutu Matiku)  Street Kid #2 (as John Ogutu Matiku)  See fewer,Members only,Mully (2015)
Elissa Shay Indian Woman  Indian Woman  See fewer,Members only,Paradise (IV) (2013)
