Name,STARmeter,Known for
João Pedro Zappa Gabriel Buchmann  Gabriel Buchmann  See fewer,Members only,Disparos (2012)
Caroline Abras Cristina  Cristina  See fewer,Members only,The Mechanism (2018)
Alex Alembe  Actor  Actor  See fewer,Members only,Gabriel and the Mountain (2017)
Rashidi Athuman  Actress  Actress  See fewer,Members only,Gabriel and the Mountain (2017)
John Goodluck  Actor  Actor  See fewer,Members only,Gabriel and the Mountain (2017)
Luke Mpata  Actor  Actor  See fewer,Members only,Gabriel and the Mountain (2017)
Manuela Picq Nadia  Nadia  See fewer,Members only,Gabriel and the Mountain (2017)
Rhosinah Sekeleti  Actress  Actress  See fewer,Members only,Gabriel and the Mountain (2017)
Leonard Siampala  Actor  Actor  See fewer,Members only,Gabriel and the Mountain (2017)
