Name,STARmeter,Known for
Melissa McCarthy Lee Israel  Lee Israel  See fewer,Top 500,The Heat (I) (2013)
Richard E. Grant Jack Hock  Jack Hock  See fewer,Top 5000,Gosford Park (2001)
Dolly Wells Anna  Anna  See fewer,Members only,Pride and Prejudice and Zombies (2016)
Ben Falcone Alan Schmidt  Alan Schmidt  See fewer,Members only,Tammy (2014)
Gregory Korostishevsky Andre  Andre  See fewer,Members only,Extremely Loud & Incredibly Close (2011)
Jane Curtin Marjorie  Marjorie  See fewer,Members only,3rd Rock from the Sun (1996)
Stephen Spinella Paul  Paul  See fewer,Members only,Ravenous (1999)
Christian Navarro Kurt  Kurt  See fewer,Members only,13 Reasons Why (2017)
Pun Bandhu Agent Doyle  Agent Doyle  See fewer,Members only,Michael Clayton (2007)
Erik LaRay Harvey Agent Solonas  Agent Solonas  See fewer,Members only,Luke Cage (2016)
Brandon Scott Jones Glen  Glen  See fewer,Members only,Isn't It Romantic (2019)
Shae D'lyn Nell  Nell  See fewer,Members only,Boardwalk Empire (2010)
Rosal Colon Rachel  Rachel  See fewer,Members only,Orange Is the New Black (2013)
Anna Deavere Smith Elaine  Elaine  See fewer,Members only,The Human Stain (2003)
Marc Evan Jackson Lloyd  Lloyd  See fewer,Top 5000,Jumanji: Welcome to the Jungle (2017)
Marcella Lowery Guest at Party  Guest at Party  See fewer,Members only,School for Scoundrels (2006)
Roberta Wallach Tom Clancy Groupie  Tom Clancy Groupie  See fewer,Members only,The Effect of Gamma Rays on Man-in-the-Moon Marigolds (1972)
Tina Benko Karen  Karen  See fewer,Members only,The Avengers (2012)
Sandy Rosenberg Yale Librarian  Yale Librarian  See fewer,Members only,Person of Interest (2011)
Kevin Carolan Tom Clancy  Tom Clancy  See fewer,Members only,Disney's Newsies the Broadway Musical (2017)
Ben Rauch Coat Check Guy  Coat Check Guy  See fewer,Members only,The Big Bang Theory (2007)
Ethel Fisher Mrs. Unger  Mrs. Unger  See fewer,Members only,Reservations (I) (2013)
Chris Lamberth Exterminator  Exterminator  See fewer,Members only,Unbreakable Kimmy Schmidt (2015)
Joanna Adler Arlene (as Joanna P. Alder)  Arlene (as Joanna P. Alder)  See fewer,Members only,American Crime Story (2016)
Mary B. McCann Judge (as Mary McCann)  Judge (as Mary McCann)  See fewer,Members only,Little Children (2006)
Michael Laurence Fenwick  Fenwick  See fewer,Members only,Shades of Blue (2016)
Michael Cyril Creighton Harry  Harry  See fewer,Members only,Spotlight (I) (2015)
Alice Kremelberg Server  Server  See fewer,Members only,Orange Is the New Black (2013)
Moisés Acevedo Clerk  Clerk  See fewer,Members only,Remember Me (I) (2010)
Lucy DeVito Gossipy Office Worker  Gossipy Office Worker  See fewer,Members only,Deadbeat (2014)
Josh Evans Boss in Office  Boss in Office  See fewer,Members only,FBI (2018)
Ricky Garcia Security Guard  Security Guard  See fewer,Members only,What Happens in Vegas (2008)
Charlotte Mary Wen Cubicle Worker  Cubicle Worker  See fewer,Members only,The Young and the Restless (1973)
Marcus Choi Another Cubicle Worker  Another Cubicle Worker  See fewer,Members only,Sharknado (2013)
Mx Justin Vivian Bond Lounge Singer (as Justin Vivian Bond)  Lounge Singer (as Justin Vivian Bond)  See fewer,Members only,Shortbus (2006)
Tim Cummings Craig  Craig  See fewer,Members only,Grimm (2011)
Havilah Brewster Toni  Toni  See fewer,Members only,A Beautiful Day in the Neighborhood (2019)
Towne The Cat Jersey  Jersey  See fewer,Members only,Can You Ever Forgive Me? (2018)
Marmee Regine Cosico Museum Patron  Museum Patron  See fewer,Members only,Too Big to Fail (2011)
Antoine Drye Musician in Bar Scene  Musician in Bar Scene  See fewer,Members only,Vista/View (2007)
Dann Fink Male (voice)  Male (voice)  See fewer,Members only,The Big Sick (2017)
Zabryna Guevara Female (voice)  Female (voice)  See fewer,Members only,The Rebound (2009)
Bonita Hamilton Female (voice)  Female (voice)  See fewer,Members only,The Knick (2014)
Ron Maestri Book Store Customer  Book Store Customer  See fewer,Members only,Quicksilver (1994)
Dan McCabe Male (voice)  Male (voice)  See fewer,Members only,Can You Ever Forgive Me? (2018)
Sean Oliver Male (voice)  Male (voice)  See fewer,Members only,Can You Ever Forgive Me? (2018)
Lori Prince Female (voice)  Female (voice)  See fewer,Members only,Triple Frontier (2019)
Armando Riesco Male (voice)  Male (voice)  See fewer,Members only,The Chi (2018)
Sandy Rustin Female (voice)  Female (voice)  See fewer,Members only,Let's Be Cops (2014)
George Aloi Literary Agent (uncredited)  Literary Agent (uncredited)  See fewer,Members only,The Leftovers (2014)
Tiffany Blair Lady with Bird (uncredited)  Lady with Bird (uncredited)  See fewer,Members only,Orange Is the New Black (2013)
Linwood Brown Prosecutor (uncredited)  Prosecutor (uncredited)  See fewer,Members only,High Flying Bird (2019)
Kevin Cristaldi Other Dealer (uncredited)  Other Dealer (uncredited)  See fewer,Members only,Buffy the Vampire Slayer (1997)
Barbara Ann Davison Bookstore Employee (uncredited)  Bookstore Employee (uncredited)  See fewer,Members only,Going in Style (2017)
Peter Donovan Greg (uncredited)  Greg (uncredited)  See fewer,Members only,Fake News (2017)
Liz Eng Lisa (uncredited)  Lisa (uncredited)  See fewer,Members only,New Amsterdam (2018)
George R. Golden Bookshop Browser (uncredited)  Bookshop Browser (uncredited)  See fewer,Members only,The Exam (I) (2015)
Anne Hollister Young Girl at Vet (uncredited)  Young Girl at Vet (uncredited)  See fewer,Members only,Implicit (2016)
Katie Kocik Bookstore Customer (uncredited)  Bookstore Customer (uncredited)  See fewer,Members only,The Kitchen (2019)
Doris McCarthy Dinner Guest (uncredited)  Dinner Guest (uncredited)  See fewer,Members only,The Intern (I) (2015)
Wayne J. Miller Pancake Man at Counter (uncredited)  Pancake Man at Counter (uncredited)  See fewer,Members only,First Samurai in New York (2018)
Leroy Phillips Jr. Pedestrian (uncredited)  Pedestrian (uncredited)  See fewer,Members only,George! (I)
Bill Walters Homeless Man (uncredited)  Homeless Man (uncredited)  See fewer,Members only,Marjorie Prime (2017)
