Name,STARmeter,Known for
Vahid Aghapoor Father  Father  See fewer,Members only,Golden Time (II) (2017)
Parnian Akhtari Anahita  Anahita  See fewer,Members only,Ava (V) (2017)
Sarah Alimardani Shirin (as Sarah Alimoradi)  Shirin (as Sarah Alimoradi)  See fewer,Members only,Ava (V) (2017)
Mona Ghiasi Yasi  Yasi  See fewer,Members only,Ava (V) (2017)
Houman Hoursan Nima  Nima  See fewer,Members only,Ava (V) (2017)
Mahour Jabbari Ava  Ava  See fewer,Members only,Ava (V) (2017)
Bahar Noohian Mother  Mother  See fewer,Members only,Hands and shoulders (2016)
Leili Rashidi Ms. Dehkhoda  Ms. Dehkhoda  See fewer,Members only,Permission (2018)
Shayesteh Sajadi Melody  Melody  See fewer,Members only,Ava (V) (2017)
