Name,STARmeter,Known for
Alia Shawkat Naima  Naima  See fewer,32,Arrested Development (2003)
Laia Costa Sergio  Sergio  See fewer,Top 5000,Victoria (II) (2015)
Mae Whitman Ellen  Ellen  See fewer,Top 5000,The Duff (2015)
Hong Chau Glow  Glow  See fewer,Top 5000,Watchmen (2019)
Kumail Nanjiani Jake  Jake  See fewer,Top 5000,The Big Sick (2017)
Kate Berlant Kathy  Kathy  See fewer,Members only,Once Upon a Time in Hollywood (2019)
Deborah Adair Old Neighbor  Old Neighbor  See fewer,Members only,Duck Butter (2018)
LaDonna Adams Oil Can Harrys Background  Oil Can Harrys Background  See fewer,Members only,Dirt Merchants: Destinova (2019)
Cassandra Borges El Cid Background  El Cid Background  See fewer,Members only,Duck Butter (2018)
Lindsay Burdge Kate  Kate  See fewer,Members only,Easy (2016)
Andrew Y. Byrd Andrea  Andrea  See fewer,Members only,Duck Butter (2018)
Jibz Cameron Jess  Jess  See fewer,Members only,Ambiance Man (2013)
Marguerite Carter Oil Can Harry's MC  Oil Can Harry's MC  See fewer,Members only,Duck Butter (2018)
Dolores Castelano Oil Can Harrys Background  Oil Can Harrys Background  See fewer,Members only,Duck Butter (2018)
Chelsea Choi El Cid Background  El Cid Background  See fewer,Members only,Duck Butter (2018)
Amber Clark El Cid Background  El Cid Background  See fewer,Members only,Duck Butter (2018)
Chris Connel El Cid Background  El Cid Background  See fewer,Members only,Duck Butter (2018)
Ruth Craft Oil Can Harrys Background  Oil Can Harrys Background  See fewer,Members only,Duck Butter (2018)
Lisa Dickinson Oil Can Harrys Background  Oil Can Harrys Background  See fewer,Members only,Duck Butter (2018)
Maxine the Dog Maxine  Maxine  See fewer,Members only,Duck Butter (2018)
Jessica Doherty El Cid Background  El Cid Background  See fewer,Members only,Duck Butter (2018)
Tracey Dominique Oil Can Harrys Background  Oil Can Harrys Background  See fewer,Members only,Forever & Always (II) (2017)
Shaun Duffy El Cid Background  El Cid Background  See fewer,Members only,Body of Lies (2008)
Jay Duplass Jay  Jay  See fewer,Members only,Transparent (2014)
Mark Duplass Mark  Mark  See fewer,Top 5000,Safety Not Guaranteed (2012)
Daniel Egan El Cid Background  El Cid Background  See fewer,Members only,Storage (2018)
Winifred Elam Oil Can Harrys Background  Oil Can Harrys Background  See fewer,Members only,Party-N-Play (2019)
Mel Eslyn the Producer / AD  the Producer / AD  See fewer,Members only,The One I Love (2014)
Kyle Field Oil Can Harrys Background  Oil Can Harrys Background  See fewer,Members only,Duck Butter (2018)
Lillie Fischer El Cid Background  El Cid Background  See fewer,Members only,Duck Butter (2018)
LeAnn Fishman Oil Can Harrys Background  Oil Can Harrys Background  See fewer,Members only,Megalodon (2018)
Wolf Fleetwood-Ross the PA  the PA  See fewer,Members only,Rio (2017)
Millie Fong Oil Can Harrys Background  Oil Can Harrys Background  See fewer,Members only,Let Me In (I) (2016)
William Talman Fortune El Cid Background  El Cid Background  See fewer,Members only,Duck Butter (2018)
Marsha Gael Oil Can Harrys Background  Oil Can Harrys Background  See fewer,Members only,Duck Butter (2018)
Margie Gilmore Margaret Gilmore (as Margaret Gilmore)  Margaret Gilmore (as Margaret Gilmore)  See fewer,Members only,In Passing (2002)
Anthony Gobeille El Cid Background  El Cid Background  See fewer,Members only,Duck Butter (2018)
Elizabeth Hangan Elizabeth  Elizabeth  See fewer,Members only,Duck Butter (2018)
Tamara Jackson Oil Can Harrys Background  Oil Can Harrys Background  See fewer,Members only,Duck Butter (2018)
Patricia Jendrasak Oil Can Harrys Background  Oil Can Harrys Background  See fewer,Members only,Duck Butter (2018)
Laura Juilly Oil Can Harrys Background  Oil Can Harrys Background  See fewer,Members only,CollegeHumor Originals (2006)
Matt Keibler El Cid Background  El Cid Background  See fewer,Members only,Duck Butter (2018)
Debbie Kindred Club Goer  Club Goer  See fewer,Members only,Danny Boy (III)
Courtney Kivowitz Naima's agent (voice)  Naima's agent (voice)  See fewer,Members only,Duck Butter (2018)
Stacey Koff Stacey  Stacey  See fewer,Members only,Star Maps (1997)
Yelena Koshelevskaya Yelena  Yelena  See fewer,Members only,Duck Butter (2018)
Ely Kreimendahl Excited Fan (as Lissy Kilman)  Excited Fan (as Lissy Kilman)  See fewer,Members only,Bad Yogi (2016)
Chandler LaFee El Cid Background  El Cid Background  See fewer,Members only,Girly Tales (2017)
Drew Langer News Reporter 1 (voice)  News Reporter 1 (voice)  See fewer,Members only,Lower Broads (2014)
Hsiang Liu Oil Can Harrys  Oil Can Harrys  See fewer,Members only,Jian wang zi (1970)
Angelina Llongueras Susana  Susana  See fewer,Members only,The Young Picasso: 1881-1906 (1993)
Marguaret Love Older Woman- Hilary  Older Woman- Hilary  See fewer,Members only,Duck Butter (2018)
Marc Maron Marc (voice)  Marc (voice)  See fewer,Top 5000,Maron (2013)
Olivia Martin El Cid Background  El Cid Background  See fewer,Members only,Duck Butter (2018)
Rob McGrew Oil Can Harrys Background  Oil Can Harrys Background  See fewer,Members only,Duck Butter (2018)
Dee Dee McNeil Oil Can Harrys Background  Oil Can Harrys Background  See fewer,Members only,Duck Butter (2018)
Christelle Megne El Cid Background  El Cid Background  See fewer,Members only,Duck Butter (2018)
Jordan Merimee El Cid Background  El Cid Background  See fewer,Members only,Judgement (II) (2014)
Erin Naifeh the AC  the AC  See fewer,Members only,Hereditary (2018)
Huy Nguyen El Cid Background  El Cid Background  See fewer,Members only,Duck Butter (2018)
Jenny O'Hara Older Woman - Nathalie  Older Woman - Nathalie  See fewer,Top 5000,Devil (2010)
Marah Oseland Oil Can Harrys Background  Oil Can Harrys Background  See fewer,Members only,Duck Butter (2018)
Nany Parker Oil Can Harrys Background  Oil Can Harrys Background  See fewer,Members only,Duck Butter (2018)
Rhoda Pell Oil Can Harrys Background  Oil Can Harrys Background  See fewer,Members only,Blake Chandler: Psychic Investigator (2016)
Patricia Peridea Oil Can Harrys Background  Oil Can Harrys Background  See fewer,Members only,Duck Butter (2018)
Justin Perrine El Cid Background  El Cid Background  See fewer,Members only,Duck Butter (2018)
Valerie Ramos Oil Can Harrys Background  Oil Can Harrys Background  See fewer,Members only,Feel More Girls
Ellen Ramsdell Oil Can Harrys Background  Oil Can Harrys Background  See fewer,Members only,Tornado Alley (2014)
Rhonda Reasor Oil Can Harrys Background  Oil Can Harrys Background  See fewer,Members only,Duck Butter (2018)
Marian Reddick-Morris Oil Can Harrys Background  Oil Can Harrys Background  See fewer,Members only,Duck Butter (2018)
Sierra Renfro El Cid Background  El Cid Background  See fewer,Members only,Take Me (2017)
Luis Reyes El Cid Background  El Cid Background  See fewer,Members only,Duck Butter (2018)
Sonja Roden Oil Can Harrys Background  Oil Can Harrys Background  See fewer,Members only,The Bound (2013)
Corinne Rogan Oil Can Harrys Background  Oil Can Harrys Background  See fewer,Members only,Synching (2017)
Carlos Salazar the Carlos  the Carlos  See fewer,Members only,Duck Butter (2018)
Mindy Schiller Oil Can Harrys Background  Oil Can Harrys Background  See fewer,Members only,You Are So Going to Hell! (2004)
Stacy Schneiderman the HMU  the HMU  See fewer,Members only,Blue Jay (I) (2016)
Taylor Shofner El Cid Background  El Cid Background  See fewer,Members only,Ninjago: Decoded (2017)
Kasra Shokravi the Key Grip  the Key Grip  See fewer,Members only,Forerunner (2013)
Jason Sleisenger El Cid Background  El Cid Background  See fewer,Members only,Made in Cleveland (2013)
Allison Small El Cid Background  El Cid Background  See fewer,Members only,Research: The Musical (2011)
Elijah Springer El Cid Background  El Cid Background  See fewer,Members only,Duck Butter (2018)
Stella Star Oil Can Harrys Background  Oil Can Harrys Background  See fewer,Members only,Duck Butter (2018)
Martin Talvederian El Cid Background  El Cid Background  See fewer,Members only,Duck Butter (2018)
Patricia Tezeuka Oil Can Harrys Background  Oil Can Harrys Background  See fewer,Members only,Duck Butter (2018)
Tina Tieu El Cid Background  El Cid Background  See fewer,Members only,Duck Butter (2018)
Marijean Vardanian Oil Can Harrys Background  Oil Can Harrys Background  See fewer,Members only,So B. It (2016)
Bianca Vasquez El Cid Background  El Cid Background  See fewer,Members only,Duck Butter (2018)
Jesus Villarreal the Grip  the Grip  See fewer,Members only,The Rake (2018)
Shelly West the 2nd AD  the 2nd AD  See fewer,Members only,Fast & Furious: Supercharged (2015)
Michele Williams Oil Can Harrys Club Goer  Oil Can Harrys Club Goer  See fewer,Members only,The Last Fitness Instructor (2016)
Pamela Wilson Oil Can Harrys Background  Oil Can Harrys Background  See fewer,Members only,Duck Butter (2018)
Pamela Drake Wilson Lesbian Dancer  Lesbian Dancer  See fewer,Members only,Vice Squad: New Orleans (2019)
Brandon Winters El Cid Background  El Cid Background  See fewer,Members only,Searching (III) (2018)
Oliver Young the Grip  the Grip  See fewer,Members only,The Thinning: New World Order (2018)
