Name,STARmeter,Known for
Lola Kirke Jill LeBeau  Jill LeBeau  See fewer,Top 5000,Mistress America (2015)
Zoë Kravitz Heather Anderson  Heather Anderson  See fewer,46,Mad Max: Fury Road (2015)
John Cho Detective Edward Ahn  Detective Edward Ahn  See fewer,Top 5000,Harold & Kumar Go to White Castle (2004)
Greta Lee Tracy  Tracy  See fewer,Members only,Spider-Man: Into the Spider-Verse (2018)
Ricki Lake Vanessa  Vanessa  See fewer,Top 5000,Hairspray (1988)
Michelle Forbes Jamie  Jamie  See fewer,Top 5000,Kalifornia (1993)
Nelson Franklin Greg  Greg  See fewer,Members only,Scott Pilgrim vs. the World (2010)
Reeve Carney Devin  Devin  See fewer,Members only,Snow Falling on Cedars (1999)
Jessica Parker Kennedy Sierra  Sierra  See fewer,Top 5000,The Flash (2014)
James Ransone Stan  Stan  See fewer,Top 5000,Sinister (I) (2012)
Todd Louiso Keith  Keith  See fewer,Members only,High Fidelity (2000)
Marianne Rendón Cassandra  Cassandra  See fewer,Members only,Imposters (2017)
Juan Antonio Officer Santos  Officer Santos  See fewer,Members only,Good Trouble (2019)
Abraham Lim Seo-Jin  Seo-Jin  See fewer,Members only,The Catch (2016)
Gabriela Flores Andrea  Andrea  See fewer,Members only,Atypical (2017)
Ted Stavros Teenage Waiter  Teenage Waiter  See fewer,Members only,The Middle (2009)
Levy Tran Thiri  Thiri  See fewer,Top 5000,MacGyver (2016)
Naby Dakhli Production Assistant  Production Assistant  See fewer,Members only,Traces of Sandalwood (2014)
Ray Reynaga Paparazzo #1  Paparazzo #1  See fewer,Members only,Spin Cycle (2015)
Chad Hartigan Paparazzo #2  Paparazzo #2  See fewer,Members only,Morris from America (2016)
Jamel Baines Police Officer  Police Officer  See fewer,Members only,Going Black (2018)
Taylor Clemenza Restaurant Patron  Restaurant Patron  See fewer,Members only,The Mad Whale (2017)
Kennedy Collier Police Technician  Police Technician  See fewer,Members only,Gemini (II) (2017)
Khalid Dualeh Police Officer  Police Officer  See fewer,Members only,The Syndicate (2016)
Edgar Gonzalez Extra  Extra  See fewer,Members only,Caller ID: Entity (2010)
Ginger Horne Bar Patron  Bar Patron  See fewer,Members only,The Keepers (II) (2017)
Gary Karapetyan Bar Patron  Bar Patron  See fewer,Members only,Czech Mate on Ice (2017)
Steve Koss Bar Patron  Bar Patron  See fewer,Members only,Michael Myers: Absolute Evil (2016)
Stephanie McVay Maxine  Maxine  See fewer,Members only,Another Gay Movie (2006)
Emily Pearse Waitress  Waitress  See fewer,Members only,New Hardy Boys (2016)
Michael Joseph Pierce Studio Executive  Studio Executive  See fewer,Members only,General Hospital (1963)
Chris Pinto Bar Patron  Bar Patron  See fewer,Members only,Ted Bundy Had a Son
Nancy Pinto Bar Patron  Bar Patron  See fewer,Members only,Ted Bundy Had a Son
