Name,STARmeter,Known for
Andy Nyman Professor Goodman  Professor Goodman  See fewer,Members only,Judy (II) (2019)
Martin Freeman Mike Priddle  Mike Priddle  See fewer,Top 5000,Black Panther (2018)
Paul Whitehouse Tony Matthews  Tony Matthews  See fewer,Members only,The Fast Show (1994)
Alex Lawther Simon Rifkind  Simon Rifkind  See fewer,Top 5000,The Imitation Game (2014)
Paul Warren Woolly  Woolly  See fewer,Members only,Star Wars: Episode VII - The Force Awakens (2015)
Kobna Holdbrook-Smith Father Emery  Father Emery  See fewer,Members only,Mary Poppins Returns (2018)
Nicholas Burns Mark van Rhys  Mark van Rhys  See fewer,Members only,The World's End (2013)
Louise Atkins Steph  Steph  See fewer,Members only,From Hell (2001)
Lesley Harcourt BBC Local Newsreader  BBC Local Newsreader  See fewer,Members only,The Lock-In (2016)
Amy Doyle Esther Goodman  Esther Goodman  See fewer,Members only,The Crown (2016)
Deborah Wastell Mrs. Goodman  Mrs. Goodman  See fewer,Members only,Ghost Stories (I) (2017)
Daniel Hill Mr. Goodman  Mr. Goodman  See fewer,Members only,Harry Potter and the Deathly Hallows: Part 1 (2010)
Christine Dalby Beth Hooper  Beth Hooper  See fewer,Members only,Miss Peregrine's Home for Peculiar Children (2016)
Maggie McCarthy Jean Hooper  Jean Hooper  See fewer,Members only,Attack the Block (2011)
Joe Osborne Mr. Rifkind  Mr. Rifkind  See fewer,Members only,Peaky Blinders (2013)
Maria Major Mrs. Rifkind  Mrs. Rifkind  See fewer,Members only,Ghost Stories (I) (2017)
Ramzan Miah Esters's Boyfriend  Esters's Boyfriend  See fewer,Members only,Aladdin (I) (2019)
Benji Ming Headmaster  Headmaster  See fewer,Members only,Crying Wolf 3D (2015)
Emily Carding Maria Priddle  Maria Priddle  See fewer,Members only,Macbeth (II) (2018)
Leonard Byrne Charles Cameron  Charles Cameron  See fewer,Members only,Dead Man's Shoes (2004)
Macie Allen Tilly  Tilly  See fewer,Members only,Ghost Stories (I) (2017)
Ryan Oliva Hellion  Hellion  See fewer,Members only,Strike Back (2010)
Samuel Bottomley Young Goodman  Young Goodman  See fewer,Members only,Tyrannosaur (2011)
Jake Davies Desi Callahan / Kojak  Desi Callahan / Kojak  See fewer,Members only,A Brilliant Young Mind (2014)
Oliver Woollford Nico Freer  Nico Freer  See fewer,Members only,Utopia (I) (2013)
Callum Goulden Marcus Perry  Marcus Perry  See fewer,Members only,The Reckoning (IV)
Mike Aarons Mike from Barnett (voice)  Mike from Barnett (voice)  See fewer,Members only,Ghost Stories (I) (2017)
Derren Brown Betty (voice)  Betty (voice)  See fewer,Members only,Derren Brown: The Experiments (2011)
Anthony Davis Radio DJ (voice)  Radio DJ (voice)  See fewer,Members only,Planes That Changed the World (2015)
Elaine Dyson Mrs. Rifkind (voice)  Mrs. Rifkind (voice)  See fewer,Members only,Ghost Stories (I) (2017)
Jill Halfpenny Peggy Van Rhys (voice)  Peggy Van Rhys (voice)  See fewer,Members only,Waterloo Road (2006)
Billy Sneddon National Breakdown Assistant Caller (voice)  National Breakdown Assistant Caller (voice)  See fewer,Members only,Four Lions (2010)
Liam Swann Psychic Reading Audience Member (uncredited)  Psychic Reading Audience Member (uncredited)  See fewer,Members only,Audax (2014)
Julie Waring Psychic Reading Audience Member (uncredited)  Psychic Reading Audience Member (uncredited)  See fewer,Members only,The Syndicate (I) (2012)
Richard Waring Psychic Reading Audience Member (uncredited)  Psychic Reading Audience Member (uncredited)  See fewer,Members only,Cobra (2019)
