Name,STARmeter,Known for
Joey Slotnick Zimmerman  Zimmerman  See fewer,Members only,Too Big to Fail (2011)
Bernie McInerney Doctor  Doctor  See fewer,Members only,Dan in Real Life (I) (2007)
Elliott Gould Bob  Bob  See fewer,Top 5000,MASH (1970)
Tibor Feldman Ed  Ed  See fewer,Members only,Enchanted (2007)
Mike Hodge Alan  Alan  See fewer,Members only,Ransom (1996)
Ray Iannicelli Marv  Marv  See fewer,Members only,Joker (I) (2019)
Jemaine Clement Nate  Nate  See fewer,Top 5000,Flight of the Conchords (2007)
Haley Rawson Younger Actress  Younger Actress  See fewer,Members only,The Deuce (2017)
Bebe Neuwirth CC Rudin  CC Rudin  See fewer,Top 5000,Cheers (1982)
Marcy McGuigan Older Actress  Older Actress  See fewer,Members only,Grand Theft Auto IV (2008)
Maria Dizzia Nirit  Nirit  See fewer,Top 5000,Martha Marcy May Marlene (2011)
Cade Lappin Gabe  Gabe  See fewer,Members only,This Is Where I Leave You (2014)
Erich Bergen Randy  Randy  See fewer,Members only,Madam Secretary (2014)
Kristin McGee Kim  Kim  See fewer,Members only,The Nanny Diaries (2007)
Makia Martin Guard  Guard  See fewer,Members only,Bite Me (I) (2019)
Maxine Prescott Golf Cart Lady  Golf Cart Lady  See fewer,Members only,Still Alice (2014)
Ingrid Michaelson Allison  Allison  See fewer,Members only,Concert for America (2017)
Priscilla Lopez Connie  Connie  See fewer,Members only,Maid in Manhattan (2002)
Dipti Mehta Coffee Shop Clerk  Coffee Shop Clerk  See fewer,Members only,Yaatra (2015)
Malachy McCourt David  David  See fewer,Members only,The Devil's Own (1997)
Willie C. Carpenter Ellis  Ellis  See fewer,Members only,Men in Black (1997)
Rafael Benoit Marine  Marine  See fewer,Members only,Gotham (2014)
Matthew Streeter Staff Sergeant  Staff Sergeant  See fewer,Members only,Daredevil (2015)
Annie Potts Dee  Dee  See fewer,Top 500,Ghostbusters (1984)
Le Clanché du Rand Helen  Helen  See fewer,Members only,Sleepless in Seattle (1993)
Rosemary Prinz Gert  Gert  See fewer,Members only,Lights Out (1946)
Mary O'Rourke Beautiful Castaway (as Mary Kate O'Rourke)  Beautiful Castaway (as Mary Kate O'Rourke)  See fewer,Members only,Polycarp (2007)
Jill Eikenberry Jill Eikenberry  Jill Eikenberry  See fewer,Members only,L.A. Law (1986)
Michael Tucker Michael Tucker  Michael Tucker  See fewer,Members only,L.A. Law (1986)
Olga Merediz Fortune Teller  Fortune Teller  See fewer,Members only,The Place Beyond the Pines (2012)
Tara Alexandra Brown Friend (uncredited)  Friend (uncredited)  See fewer,Members only,Bosch (2014)
Rich Rothbell Golf Buddy (uncredited)  Golf Buddy (uncredited)  See fewer,Members only,Here Comes the Boom (2012)
