Name,STARmeter,Known for
Ingvar Sigurdsson Karl (as Ingvar Eggert Sigurðsson)  Karl (as Ingvar Eggert Sigurðsson)  See fewer,Members only,Everest (2015)
Thor Kristjansson Jón  Jón  See fewer,Members only,Dracula Untold (2014)
Hilmir Snær Guðnason Frægur leikari  Frægur leikari  See fewer,Members only,White Night Wedding (2008)
Þuríður Blær Jóhannsdóttir Ásta  Ásta  See fewer,Members only,A Reykjavík Porno (2016)
Katla M. Þorgeirsdóttir Ólöf  Ólöf  See fewer,Members only,Stelpurnar (2005)
Gríma Valsdóttir Sól  Sól  See fewer,Members only,Þú og ég (2015)
Þorleifur Einarsson Bjössi  Bjössi  See fewer,Members only,Rams (2015)
Gestur Einar Jónasson Maður á útihátíð  Maður á útihátíð  See fewer,Members only,On Top (1982)
