Name,STARmeter,Known for
Jocelyn DeBoer Jill  Jill  See fewer,Top 5000,Thunder Road (2018)
Dawn Luebbe Lisa  Lisa  See fewer,Members only,High Maintenance (2012)
Beck Bennett Nick  Nick  See fewer,Members only,Sing (2016)
Neil Casey Dennis  Dennis  See fewer,Members only,Ghostbusters (2016)
Mary Holland Kim Ann  Kim Ann  See fewer,Members only,The Package (II) (2018)
D'Arcy Carden Miss Human  Miss Human  See fewer,Top 5000,The Good Place (2016)
Julian Hilliard Julian  Julian  See fewer,Members only,The Haunting of Hill House (2018)
Janicza Bravo Marriott  Marriott  See fewer,Members only,Lemon (2017)
Dot-Marie Jones Little Helen  Little Helen  See fewer,Top 5000,The Boondock Saints (1999)
Asher Miles Fallica Bob  Bob  See fewer,Members only,Tully (2018)
Lauren Adams Erika / Cheryl Hoad  Erika / Cheryl Hoad  See fewer,Members only,Unbreakable Kimmy Schmidt (2015)
John Milhiser Photographer  Photographer  See fewer,Members only,Saturday Night Live (1975)
Santina Muha Shayna  Shayna  See fewer,Members only,Comedy Bang! Bang! (2012)
Mike Scollins Buck  Buck  See fewer,Members only,Late Night with Seth Meyers (2014)
Jim Cummings Rob  Rob  See fewer,Members only,Thunder Road (2018)
Beth Appel Crystal  Crystal  See fewer,Members only,Ghost Story Club (2018)
Ammie Masterson Mae (as Ammie Leonards)  Mae (as Ammie Leonards)  See fewer,Members only,Better Call Saul (2015)
Abigail Kurtz Madison Paige Wetbottom  Madison Paige Wetbottom  See fewer,Members only,Greener Grass (2019)
Allison Kurtz Madison Paige Wetbottom  Madison Paige Wetbottom  See fewer,Members only,Greener Grass (2019)
Sutton Johnston Dan  Dan  See fewer,Members only,Logan Lucky (2017)
Boden Johnston Rostaffano  Rostaffano  See fewer,Members only,Logan Lucky (2017)
Hollyn Johnston Citronella  Citronella  See fewer,Members only,Life @ Stipe (2019)
Jaxon Rose Moore Raja  Raja  See fewer,Members only,The Gifted (2017)
Emon Buckner Beazie  Beazie  See fewer,Members only,Greener Grass (2019)
Londale Theus Jr. The Ref  The Ref  See fewer,Members only,Future Man (2017)
Inessa Frantowski Mrs. Glass  Mrs. Glass  See fewer,Members only,Cosmopolis (2012)
Paul Ryden Anchor  Anchor  See fewer,Members only,Hidden Figures (2016)
Meredith Rose Brigitta  Brigitta  See fewer,Members only,Greener Grass (2019)
Emily Altman Penelope  Penelope  See fewer,Members only,Greener Grass (2019)
Will Hines Steve  Steve  See fewer,Members only,Wrecked (2016)
Mitch Magee Mike  Mike  See fewer,Members only,Mister Glasses (2007)
Kevyn Bowling Rick  Rick  See fewer,Members only,Ala (2018)
Paul Briganti Host  Host  See fewer,Members only,Greener Grass (III) (2015)
Corey Walter Johnson Waiter  Waiter  See fewer,Members only,Adam Ruins Everything (2015)
Rob Michael Hugel Food Runner  Food Runner  See fewer,Members only,Broad City (2010)
Icee 'Julian' the dog  'Julian' the dog  See fewer,Members only,Greener Grass (2019)
Anna Majewski  Actress  Actress  See fewer,Members only,Out of the Fight
Haven Nutt Haven Nutt  Haven Nutt  See fewer,Members only,Mr. Man (2015)
Josh Ruben Swim Coach  Swim Coach  See fewer,Members only,Lee's Kill List
John Schmedes The Reverend  The Reverend  See fewer,Members only,A Walk in the Woods (2015)
Martell Slater Paying Customer  Paying Customer  See fewer,Members only,Stargirl (2020)
Jecobi Swain Shad  Shad  See fewer,Members only,Troop Zero (2019)
Michael Taylor Police Officer  Police Officer  See fewer,Members only,Now That You Know (2018)
Kourtney Marie Webster Mae's Daughter  Mae's Daughter  See fewer,Members only,Servant (2019)
Parker Jaye Whipple Girl with Knives  Girl with Knives  See fewer,Members only,The Loss of Innocence
