Name,STARmeter,Known for
Matthew Goode Henry Talbot  Henry Talbot  See fewer,Top 500,Stoker (2013)
Tuppence Middleton Lucy Smith  Lucy Smith  See fewer,Top 500,The Current War: Director's Cut (2017)
Maggie Smith Violet Crawley  Violet Crawley  See fewer,Top 5000,Gosford Park (2001)
Michelle Dockery Lady Mary Talbot  Lady Mary Talbot  See fewer,Top 5000,Downton Abbey (2010)
Elizabeth McGovern Cora Crawley  Cora Crawley  See fewer,Top 5000,Ordinary People (1980)
Kate Phillips Princess Mary  Princess Mary  See fewer,Top 5000,Peaky Blinders (2013)
Allen Leech Tom Branson  Tom Branson  See fewer,Top 5000,The Imitation Game (2014)
Imelda Staunton Maud Bagshaw  Maud Bagshaw  See fewer,Top 5000,Harry Potter and the Order of the Phoenix (2007)
Laura Carmichael Lady Edith  Lady Edith  See fewer,Top 5000,Downton Abbey (2010)
Joanne Froggatt Anna Bates  Anna Bates  See fewer,Top 5000,Downton Abbey (2010)
Robert James-Collier Thomas Barrow  Thomas Barrow  See fewer,Top 5000,Downton Abbey (2010)
Raquel Cassidy Miss Baxter  Miss Baxter  See fewer,Top 5000,Downton Abbey (2010)
Sophie McShera Daisy Mason  Daisy Mason  See fewer,Top 5000,Cinderella (I) (2015)
Phyllis Logan Mrs. Hughes  Mrs. Hughes  See fewer,Top 5000,Secrets & Lies (1996)
"Hugh Bonneville Robert Crawley, Earl of Grantham  Robert Crawley, Earl of Grantham  See fewer",Top 5000,Notting Hill (1999)
Jim Carter Mr. Carson  Mr. Carson  See fewer,Top 5000,Transformers: The Last Knight (2017)
Max Brown Richard Ellis  Richard Ellis  See fewer,Top 5000,The Royals (2015)
Geraldine James Queen Mary  Queen Mary  See fewer,Top 5000,Sherlock Holmes (2009)
Brendan Coyle Mr. Bates  Mr. Bates  See fewer,Top 5000,Downton Abbey (2010)
Mark Addy Mr. Bakewell  Mr. Bakewell  See fewer,Top 5000,The Full Monty (1997)
Penelope Wilton Isobel Merton  Isobel Merton  See fewer,Top 5000,The Best Exotic Marigold Hotel (2011)
Stephen Campbell Moore Captain Chetwode  Captain Chetwode  See fewer,Top 5000,Season of the Witch (2011)
Susan Lynch Miss Lawton  Miss Lawton  See fewer,Members only,Waking Ned Devine (1998)
David Haig Mr Wilson  Mr Wilson  See fewer,Members only,My Boy Jack (2007)
James Cartwright Tony Sellick  Tony Sellick  See fewer,Members only,24 Hour Party People (2002)
Harry Hadden-Paton Bertie Hexham  Bertie Hexham  See fewer,Members only,Downton Abbey (2010)
Lesley Nicol Mrs. Patmore  Mrs. Patmore  See fewer,Members only,Downton Abbey (2010)
Kevin Doyle Mr. Molesley  Mr. Molesley  See fewer,Members only,Downton Abbey (2010)
Simon Jones King George V  King George V  See fewer,Members only,The Hitchhiker's Guide to the Galaxy (1981)
Michael Fox Andy Parker  Andy Parker  See fewer,Members only,Downton Abbey (2010)
Perry Fitzpatrick Chris Webster  Chris Webster  See fewer,Members only,I Am (2019)
Douglas Reith Lord Merton  Lord Merton  See fewer,Members only,Downton Abbey (2010)
Philippe Spall Monsieur Courbet  Monsieur Courbet  See fewer,Members only,Allied (2016)
Fifi Hart Sybbie  Sybbie  See fewer,Members only,Harry & Paul's Story of the 2s (2014)
Andrew Havill Henry Lascelles  Henry Lascelles  See fewer,Members only,The King's Speech (2010)
Richenda Carey Mrs. Webb  Mrs. Webb  See fewer,Members only,The Colony (2015)
Alice McCarthy Nanny Harewood  Nanny Harewood  See fewer,Members only,Doctors (2000)
Oliver Barker George  George  See fewer,Members only,King Arthur: Legend of the Sword (2017)
Philip Gascoyne Policeman  Policeman  See fewer,Members only,Morbius (2020)
Marina Baibara Baroness Valerenay  Baroness Valerenay  See fewer,Members only,Three Girls (2017)
Eva Samms Marigold  Marigold  See fewer,Members only,BBC News 8pm Summary (2007)
Rory Gauld  Actor  Actor  See fewer,Members only,The McCartneying (2019)
Guillaume Rivaud Downton Villager  Downton Villager  See fewer,Members only,Poldark (2015)
Tom Ashley Royal Footman  Royal Footman  See fewer,Members only,Curfew (2019)
Charlie Watson Albert the Hall Boy  Albert the Hall Boy  See fewer,Members only,Downton Abbey (2019)
Karina Samms Marigold  Marigold  See fewer,Members only,BBC News 8pm Summary (2007)
Alastair King Conductor  Conductor  See fewer,Members only,Aquaman (2018)
Max Hutchinson First Royal Footman  First Royal Footman  See fewer,Members only,Dream Horse (2020)
Ashley Lloyd Dancer  Dancer  See fewer,Members only,Made in the Eighties
Zac Barker George  George  See fewer,Members only,King Arthur: Legend of the Sword (2017)
Darren Strange Detective  Detective  See fewer,Members only,Parents (2012)
Matt Tyzack House Porter  House Porter  See fewer,Members only,Keeping Faith (2017)
Nick Owenford Downton Villager  Downton Villager  See fewer,Members only,Firrkie
Diane Halling Countess of Harrowby  Countess of Harrowby  See fewer,Members only,Philter (2012)
Ben Matthew Saunders Hall Boy / Paper Boy  Hall Boy / Paper Boy  See fewer,Members only,Slaughter Grounds
Alex Crisp Buckingham Palace Footman  Buckingham Palace Footman  See fewer,Members only,Wavelength (I) (2018)
Ashley Kirk Footman  Footman  See fewer,Members only,The Other
Zoë Watson Dancer (as Zoe Watson)  Dancer (as Zoe Watson)  See fewer,Members only,Belgravia (2020)
Tom Bennett Downton Villager  Downton Villager  See fewer,Members only,Contact 4:12
Harry Livingstone Harewood House Footman  Harewood House Footman  See fewer,Members only,Awakening (III) (2015)
Marc Esse Villager  Villager  See fewer,Members only,The City and the City (2018)
Meg Olssen Aristocrat (as Meg Davies)  Aristocrat (as Meg Davies)  See fewer,Members only,The Goodbye Girl (2018)
Mark Oldridge Gentleman  Gentleman  See fewer,Members only,1917 (2019)
Alan Billingham York Townfolk  York Townfolk  See fewer,Members only,Beowulf: Return to the Shieldlands (2016)
Jonathan Cheetham Flirtatious Gay Man (uncredited)  Flirtatious Gay Man (uncredited)  See fewer,Members only,Coronation Street (1960)
Adam Darlington Ball Room Guest (uncredited)  Ball Room Guest (uncredited)  See fewer,Members only,Morbius (2020)
Tony Dawson Policeman (uncredited)  Policeman (uncredited)  See fewer,Members only,No Offence (2015)
Adrian Lord Night Cub Attendee (uncredited)  Night Cub Attendee (uncredited)  See fewer,Members only,Soldiers of the Damned (2015)
Adrian P Lord Night Club Attendee (uncredited)  Night Club Attendee (uncredited)  See fewer,Members only,
Alex Russell York Townfolk (uncredited)  York Townfolk (uncredited)  See fewer,Members only,The Dark Ages (2015)
Kris Taylor York Townsfolk (uncredited)  York Townsfolk (uncredited)  See fewer,Members only,Coming out for Christmas (2019)
Sarah Trevelyan Villager (uncredited)  Villager (uncredited)  See fewer,Members only,Static (2020)
Kevin Vose Train Sorting Office Man (uncredited)  Train Sorting Office Man (uncredited)  See fewer,Members only,Govindudu Andari Vaadele (2014)
